;name;SKU;price;department;sector
1521;LDAILY Triciclo Infantil para Passeio com Assento Ajustavel 7 Estagios Idade Recomendada 1 a 5 Anos Rosa ;1002463353;2792.56;baby;passeio-do-bebe
1522;CARRINHO MUZE + BEBE CONFORTO JUVA PRETO E BASE ISOFIX - JOIE ;1002636369;2699.00;baby;passeio-do-bebe
1523;;;;baby;passeio-do-bebe
1524;Carrinho de Gemeos Bebe Conforto Base Galzerano Bali Black ;1002621747;2140.00;baby;passeio-do-bebe
1525;Carrinho de Gemeos Galzerano Bali com 2 Bebe Conforto Black ;1002621730;2352.00;baby;passeio-do-bebe
1526;CARRINHO DE BEBE NOMAD PRETO + BEBE CONFORTO CASULO (415NPP) + BASE - KIDDO ;1002620754;2935.00;baby;passeio-do-bebe
1527;CARRINHO DE BEBE NOMAD PRETO + BEBE CONFORTO CASULO (415NPP) - KIDDO ;1002620761;2708.00;baby;passeio-do-bebe
1528;CARRINHO NOMAD MELANGE GRAFITE + BEBE CONFORTO CASULO (415NPP) - KIDDO ;1002620762;2708.00;baby;passeio-do-bebe
1529;CARRINHO NOMAD MELANGE GRAFITE + BEBE CONFORTO CASULO (415NPP) + BASE - KIDDO ;1002620760;2935.00;baby;passeio-do-bebe
1530;Travel System Gia XP Trio Maxi-Cosi Midnight Moon ;1002496988;2999.00;baby;passeio-do-bebe
1531;Carrinho de Bebe Kiddo Winner com Bebe Conforto e Base Preto ;1002470319;2405.00;baby;passeio-do-bebe
1532;Carrinho de Bebe Kiddo Winner com Bebe Conforto e Base Cinza ;1002470320;2405.00;baby;passeio-do-bebe
1533;Carrinho de Bebê Passeio Compacto Leve 0 Meses Até 15Kg Reclinável Pact Cinza Gray Flannel Joie ;1002557847;2082.99;baby;passeio-do-bebe
1534;;;;baby;passeio-do-bebe
1535;Carrinho de Bebê Passeio Compacto Leve 0 Meses Até 15Kg Reclinável Pact Preto Cinza Ember Joie ;1002557849;2004.09;baby;passeio-do-bebe
1536;Cadeira De Carro Infantil All In One Até 36kgs Cinza Infanti ;1002455183;2599.00;baby;passeio-do-bebe
1537;Carrinho de Bebe Passeio Joie Tourist Signature Cinza Oyster ;1002415659;2599.00;baby;passeio-do-bebe
1538;Carrinho de Bebe Moises Kiddo Eclipse com Bebe Conforto e Base Melange Bordo ;100268639;2726.00;baby;passeio-do-bebe
1539;;;;baby;passeio-do-bebe
1540;Cadeirinha para Auto (Joie) Every Stage FX Gray Flannel ;100268687;2878.80;baby;passeio-do-bebe
1541;Carrinho de Bebê Compass III Kiddo Grafite ;1002421825;2364.90;baby;passeio-do-bebe
1542;Carrinho de Bebê Discover Safety ST 1 Cinza ;1002421751;2441.90;baby;passeio-do-bebe
1543;Carrinho de Bebê Eclipse Kiddo Melange Preto ;1002421785;2199.90;baby;passeio-do-bebe
1544;Carrinho de Bebê Cosmos Kiddo Melange Preto ;1002421755;2419.90;baby;passeio-do-bebe
1545;;;;baby;passeio-do-bebe
1546;Carrinho Gemeos Galzerano Duolee 2 Bebe Conforto 2 Bases Cobre ;1002611293;2785.00;baby;passeio-do-bebe
1547;Carrinho de Gemeos Galzerano Duolee com 2 Bebe Conforto Cobre ;1002611289;2387.00;baby;passeio-do-bebe
1548;Cadeira Auto Joie Every Stage Fx Preto Cinza Coal 0 a 36 Kg Isofix ;100266859;2265.00;baby;passeio-do-bebe
1549;Cadeira Para Auto - De 15 a 36 Kg - Oasys 2-3 Evolution - FixPlus - Chicco ;100151663;2099.00;baby;passeio-do-bebe
1550;;;;baby;passeio-do-bebe
1551;Carrinho de Bebe Kiddo Nomad com Bebe Conforto e Base Preto ;1002621739;2935.00;baby;passeio-do-bebe
1552;Joovy 1027 Triciclo Infantil para Passeio com Assento Ajustavel 4 Estagios Preto ;1002463394;2791.87;baby;passeio-do-bebe
1553;Travel System Poppy Duo Cosco - Cinza Mescla ;100286843;;baby;passeio-do-bebe
1554;Cadeirinha para Carro Seat4Fix Ombra Chicco ;1002341091;2299.00;baby;passeio-do-bebe
1555;Travel System Poppy Trio Cosco - Preto Mescla ;100286842;;baby;passeio-do-bebe
1556;Travel System Poppy Trio Cosco - Cinza Mescla ;100286839;;baby;passeio-do-bebe
1557;Travel System Poppy Trio Cosco - Rosa Mescla ;100286851;;baby;passeio-do-bebe
1558;Carrinho de Bebe Bebe Conforto e Base Galzerano Olympus Black ;100268736;;baby;passeio-do-bebe
1559;Cadeira para Auto Seat4Fix 360 - Preto - Chicco ;1002389573;2699.00;baby;passeio-do-bebe
1560;Chicco KidFit Assento Infantil Elevado para Carro 2 em 1 com Encosto Alto Peso Recomendado 18 a 45 kg Azul ;1002464131;2847.67;baby;passeio-do-bebe
1561;CYBEX 521001643 Assento Infantil Cadeira Automotiva para Criancas 12 Posicoes de 18 a 54 kg Vermelha ;1002408432;2266.19;baby;passeio-do-bebe
1562;Safety Bebe Conforto Cadeira Automotiva 2 em 1 Conversível 2 ;1002357573;2422.30;baby;passeio-do-bebe
1563;Carrinho de Bebê Goody Plus Chicco Preto Re Lux ;1002563649;2849.05;baby;passeio-do-bebe
1564;Baby Trend Cadeirinha de Bebê para Auto com Base e 4 Posições Ajustáveis Roxa e Preta ;1002124312;2718.67;baby;passeio-do-bebe
1565;Carrinho de Bebê 3 em 1 Golden Club Baby Preto ;1002167287;2299.08;baby;passeio-do-bebe
1566;Carrinho de Bebê Goody Plus Chicco Graphite ;1002341110;2659.05;baby;passeio-do-bebe
1567;Cadeira para Auto Chicco Seat4fix Ombra 0 a 36 Kg com Isofix ;100553842;2831.90;baby;passeio-do-bebe
1568;Carrinho de Bebê Travel System Infanti Legend Duo Fly Grey Bold ;1002694402;2294.99;baby;passeio-do-bebe
1569;Carrinho de Bebe Kiddo Nomad com Bebe Conforto e Base Grafite ;1002621735;2935.00;baby;passeio-do-bebe
1570;Carrinho de Bebe Berço Passeio Moises Kiddo Nomad Preto ;1002621743;2099.00;baby;passeio-do-bebe
1571;Travel System Poppy 3.0 Trio Cosco - Cinza Mescla ;1002647088;2633.90;baby;passeio-do-bebe
1572;Cadeira Auto Kaily Black - Chicco ;1002601839;2199.99;baby;passeio-do-bebe
1573;Cadeirinha para Carro Chicco Oasys 2-3 Fixplus 15-36kg Black ;1002470475;2199.00;baby;passeio-do-bebe
1574;Carrinho de Bebe Duplo Gemeos Joie Aire Twin Dark Pewter ;1002415674;2699.00;baby;passeio-do-bebe
1575;Cadeira Auto Oasys 2-3 FixPlus Evo Black - Chicco ;1002601823;2499.99;baby;passeio-do-bebe
1576;;;;baby;passeio-do-bebe
1577;Carrinho com Bebe Conforto Base Kiddo Compass III Cappuccino ;1002394584;2635.00;baby;passeio-do-bebe
1578;Carrinho Bebe Bebe Conforto Base Kiddo Prima Melange Grafite ;1002163344;2605.00;baby;passeio-do-bebe
1579;Carrinho de Bebê Mobi Safety 1st Black  Silver ;100571232;2981.90;baby;passeio-do-bebe
1580;Travel System Epic Lite Duo Infanti - Grey Steel ;100557722;2599.00;baby;passeio-do-bebe
1581;Carrinho de Bebê Travel System Kiddo Sprint Preto + Casulo Click ;100568039;2058.00;baby;passeio-do-bebe
1582;Carrinho de Bebe Passeio Moises Kiddo Cosmos Melange Preto ;1002111562;2589.00;baby;passeio-do-bebe
1583;Cadeira Auto Joie Every Stage Fx Preta Mescla FIint 0 a 36 Kg Isofix ;100502847;2265.00;baby;passeio-do-bebe
1584;Cadeirinha Jasper 0 a 36kg com Isofix Maxi-Cosi - Authentic Black ;100535660;2499.00;baby;passeio-do-bebe
1585;;;;baby;passeio-do-bebe
1586;Carrinho Bebe Travel System Burigotto Convert Touring Evolution X Dark Grey ;100236128;2028.00;baby;passeio-do-bebe
1587;Baby Trend Ez Cadeira de Bebe para Carro com Base Ajustavel Peso Rec 2 a 15 kg Preto ;1002464171;2520.18;baby;passeio-do-bebe
1588;Disney Cadeira de Bebe para Carro com Cinto de 5 Pontos Peso Recomendado 2 a 9 kg Mickey Mouse ;1002464126;2331.50;baby;passeio-do-bebe
1589;Baby Trend Tech 35 Cadeira de Bebe para Carro Idade Recomendada 0 a 24 Meses Preto ;1002464127;2879.42;baby;passeio-do-bebe
1590;INFANS Triciclo Infantil para Passeio com Assento Ajustavel 4 Estagios Idade Recomendada 9 Meses a 5 Anos Vermelho ;1002463386;2946.47;baby;passeio-do-bebe
1591;Joovy 1026 Triciclo Infantil para Passeio com Assento Ajustavel 4 Estagios Idade Recomendada 6 Meses a 5 Anos Rosa ;1002463388;2791.87;baby;passeio-do-bebe
1592;LDAILY Triciclo Infantil para Passeio com Assento Ajustavel 7 Estagios Idade Recomendada 1 a 5 Anos Rosa ;1002463353;2792.56;baby;passeio-do-bebe
1593;CARRINHO MUZE + BEBE CONFORTO JUVA PRETO E BASE ISOFIX - JOIE ;1002636369;2699.00;baby;passeio-do-bebe
1594;;;;baby;passeio-do-bebe
1595;Carrinho de Gemeos Bebe Conforto Base Galzerano Bali Black ;1002621747;2140.00;baby;passeio-do-bebe
1596;Carrinho de Gemeos Galzerano Bali com 2 Bebe Conforto Black ;1002621730;2352.00;baby;passeio-do-bebe
1597;CARRINHO DE BEBE NOMAD PRETO + BEBE CONFORTO CASULO (415NPP) + BASE - KIDDO ;1002620754;2935.00;baby;passeio-do-bebe
1598;CARRINHO DE BEBE NOMAD PRETO + BEBE CONFORTO CASULO (415NPP) - KIDDO ;1002620761;2708.00;baby;passeio-do-bebe
1599;CARRINHO NOMAD MELANGE GRAFITE + BEBE CONFORTO CASULO (415NPP) - KIDDO ;1002620762;2708.00;baby;passeio-do-bebe
1600;CARRINHO NOMAD MELANGE GRAFITE + BEBE CONFORTO CASULO (415NPP) + BASE - KIDDO ;1002620760;2935.00;baby;passeio-do-bebe
1601;Travel System Gia XP Trio Maxi-Cosi Midnight Moon ;1002496988;2999.00;baby;passeio-do-bebe
1602;Carrinho de Bebe Kiddo Winner com Bebe Conforto e Base Preto ;1002470319;2405.00;baby;passeio-do-bebe
1603;Carrinho de Bebe Kiddo Winner com Bebe Conforto e Base Cinza ;1002470320;2405.00;baby;passeio-do-bebe
1604;Carrinho de Bebê Passeio Compacto Leve 0 Meses Até 15Kg Reclinável Pact Cinza Gray Flannel Joie ;1002557847;2082.99;baby;passeio-do-bebe
1605;;;;baby;passeio-do-bebe
1606;Carrinho de Bebê Passeio Compacto Leve 0 Meses Até 15Kg Reclinável Pact Preto Cinza Ember Joie ;1002557849;2004.09;baby;passeio-do-bebe
1607;Cadeira De Carro Infantil All In One Até 36kgs Cinza Infanti ;1002455183;2599.00;baby;passeio-do-bebe
1608;Carrinho de Bebe Passeio Joie Tourist Signature Cinza Oyster ;1002415659;2599.00;baby;passeio-do-bebe
1609;Carrinho de Bebe Moises Kiddo Eclipse com Bebe Conforto e Base Melange Bordo ;100268639;2726.00;baby;passeio-do-bebe
1610;;;;baby;passeio-do-bebe
1611;Cadeirinha para Auto (Joie) Every Stage FX Gray Flannel ;100268687;2878.80;baby;passeio-do-bebe
1612;Carrinho de Bebê Compass III Kiddo Grafite ;1002421825;2364.90;baby;passeio-do-bebe
1613;Carrinho de Bebê Discover Safety ST 1 Cinza ;1002421751;2441.90;baby;passeio-do-bebe
1614;Carrinho de Bebê Eclipse Kiddo Melange Preto ;1002421785;2199.90;baby;passeio-do-bebe
1615;Carrinho de Bebê Cosmos Kiddo Melange Preto ;1002421755;2419.90;baby;passeio-do-bebe
1616;Trava Para Cinto de Segurança Safety 1st Black - 160822 ;100291194;39.99;baby;saude-e-seguranca
1617;Aspirador Nasal com Estojo - Buba ;100152464;29.90;baby;saude-e-seguranca
1618;Aspirador Nasal - Nuk ;100085384;35.90;baby;saude-e-seguranca
1619;Extensor de Grade - 5 cm - Kiddo ;100075002;22.99;baby;saude-e-seguranca
1620;Protetor de Quinas - 2 Unidades - Espuma - Multikids Baby ;100121412;17.90;baby;saude-e-seguranca
1621;Brinquedo de Parede Autoadesivo - Batedor de Porta - Porco Espinho - Oribel ;100160804;29.99;baby;saude-e-seguranca
1622;Protetor Para Cinto de Segurança Bebê Até 2 Anos Carro Infantil Acolchoado Aveludado Kababy ;1002607824;31.00;baby;saude-e-seguranca
1623;Protetor de Tomadas Safety 1st 24 Unidades IMP01783 ;100267006;32.99;baby;saude-e-seguranca
1624;Protetor de Quina e Borda Flexível em Rolo Buba Branco 08331 ;100282661;49.99;baby;saude-e-seguranca
1625;Acessórios de Segurança - Protetores de Canto - 4 Unidades - Clear - Safety 1St ;100172773;9.90;baby;saude-e-seguranca
1626;Trava Interna para Gavetas - 4 Unidades - Multikids Baby ;100121420;21.90;baby;saude-e-seguranca
1627;Protetor de Quinas - 4 Unidades - Médio - Multikids Baby ;100121410;19.90;baby;saude-e-seguranca
1628;Trava de Canto para Gavetas - 2 Unidades - Multikids Baby ;100121415;26.90;baby;saude-e-seguranca
1629;Trava de Segurança Multiuso - Flexível - 2 Unidades - Grande - Multikids Baby ;100121417;25.90;baby;saude-e-seguranca
1630;Fecho de Segurança Multiuso - Super Protetor - Chicco ;100079462;19.90;baby;saude-e-seguranca
1631;Termômetro de Banheira Banho Bebê Infantil Criança Medidor de Temperatura Água Kababy ;1002633610;26.00;baby;saude-e-seguranca
1632;Lençol com Elástico em Malha para Berço Americano 70cm x 1,3m Cinza - Bambi ;1002604024;24.90;baby;saude-e-seguranca
1633;Trava para portas Pezinho Buba Baby ;1002637846;15.00;baby;saude-e-seguranca
1634;Protetor de Quina e Borda em Rolo Buba ;100236342;34.90;baby;saude-e-seguranca
1635;Super Protetor Solar Para Carro KaBaby Preto ;1002449395;39.90;baby;saude-e-seguranca
1636;Protetor de Tomadas Padrão 10 PCS ;1002313742;24.90;baby;saude-e-seguranca
1637;Trava Flexível Multiuso Black - Safety 1st ;1002371005;;baby;saude-e-seguranca
1638;Extensor para Grade de Proteção de Porta Easy Fit - 20 cm - Branca ;1002193011;41.84;baby;saude-e-seguranca
1639;Trava Multiuso - 2 Unidades - Kababy ;100155425;17.90;baby;saude-e-seguranca
1640;Aspirador Nasal Infantil Com Bico Anatômico Rosa - Lillo ;1002445403;19.90;baby;saude-e-seguranca
1641;Aspirador Nasal Infantil Com Bico Anatômico Azul - Lillo ;1002445402;19.90;baby;saude-e-seguranca
1642;Termômetro para Água de Banho Urso - Branco - Buba ;100577306;24.88;baby;saude-e-seguranca
1643;Dosador de Remédio Baby 10ml Nûby ;100582427;;baby;saude-e-seguranca
1644;Bolsa Termica Semaan/Avent Hubpr10 ;1002711736;39.90;baby;saude-e-seguranca
1645;Aspirador Nasal Bebe Infantil Sugador Catarro Secreção Nariz - Rosa ;100415054;39.99;baby;saude-e-seguranca
1646;Aspirador Nasal Bebe Infantil Sugador Catarro Secreção Nariz - Azul ;100415061;39.99;baby;saude-e-seguranca
1647;Aspirador Sugador Nasal de Sucção Bucal- Lillo ;1002398644;32.90;baby;saude-e-seguranca
1648;CAPA PROTETORA SOLAR PARA JANELA TRASEIRA DO CARRO BUBA ;1002459200;;baby;saude-e-seguranca
1649;Prendedor De Chupeta Monstrinho Buba Colorido ;1002496951;19.90;baby;saude-e-seguranca
1650;Protetor Para Cinto de Segurança Infantil Para Bebê Desde o Nascimento Acolchoado Clingo Estampa:Listras ;1002607840;38.99;baby;saude-e-seguranca
1651;Protetor De Quina 4 Unidades, Buba, Branco ;1002637848;18.50;baby;saude-e-seguranca
1652;;;;baby;saude-e-seguranca
1653;Kit Aparadores Para Portas Prendedor Adaptáveis a Altura Das Portas PVC Preto 2 Unidades Kababy ;1002607869;13.00;baby;saude-e-seguranca
1654;Protetor Para Cinto de Segurança Infantil Para Bebê Desde o Nascimento Acolchoado Listras Clingo ;1002607838;38.99;baby;saude-e-seguranca
1655;PROTETOR SOLAR PARA CARRO COM VENTOSA 2 UNIDADES - 10503 ;1002438484;40.50;baby;saude-e-seguranca
1656;Fita De Espuma Protetora De Borda 2 Metros Comtac Kids 4213 ;1002175604;42.04;baby;saude-e-seguranca
1657;Protetor Para Borda De Vidro Formato U Comtac Kids 4218 ;1002175605;34.29;baby;saude-e-seguranca
1658;Fita Protetora Adesiva Multiuso EVA 1 metro Comtac Kids 4209 ;1002175526;17.18;baby;saude-e-seguranca
1659;Protetor Para Quina De Mesa Formato V Comtac Kids 4212 ;1002145511;17.63;baby;saude-e-seguranca
1660;Trava De Segurança Flexível Slide Multiúso Comtac Kids 4205 ;1002175589;31.41;baby;saude-e-seguranca
1661;Protetor Para Quina De Mesa Formato V Comtac Kids 4210 ;1002145510;17.63;baby;saude-e-seguranca
1662;Protetor Para Borda De Vidro Formato U Comtac Kids 4219 ;1002175577;34.29;baby;saude-e-seguranca
1663;Trava Slide Para Armários Formato U Comtac Kids 4173 ;1002175591;15.06;baby;saude-e-seguranca
1664;Trava Flexível Multiuso Segurança Bebê Criança Portas Janelas Gavetas Safety 1st Cor:Rosa ;1002607828;16.00;baby;saude-e-seguranca
1665;Trava Flexível Multiuso Segurança Bebê Criança Portas Janelas Gavetas Rosa Safety 1st ;1002607856;16.00;baby;saude-e-seguranca
1666;Faixa Térmica Abdominal com Ervas para Bebês  Zip Toys  Menina  Algodão  Rosa ;100227611;42.90;baby;saude-e-seguranca
1667;Mosquiteiro para Carrinho Branco - Bambi ;1002604034;;baby;saude-e-seguranca
1668;Protetor de Porta Eva 1 PC ;1002313548;19.90;baby;saude-e-seguranca
1669;Extensor 15cm ;100500210;;baby;saude-e-seguranca
1670;Extensor 10cm ;100500209;;baby;saude-e-seguranca
1671;Extensor 5cm ;100500208;;baby;saude-e-seguranca
1672;Seringa de Lavagem Nasal Para Bebês e Crianças NoseWash ;1002658604;46.60;baby;saude-e-seguranca
1673;Chupeta Bebê Infantil Ultra Air Desenhos Divertidos 6-18 meses Tamanho 2 Philips Avent Desenho:Elefante ;1002612251;39.00;baby;saude-e-seguranca
1674;Chupeta Bebê Infantil De 0 à 6 Meses Tamanho 1 Silicone Soft Livre de BPA Sensitive Azul Nuk ;1002612272;32.00;baby;saude-e-seguranca
1675;;;;baby;saude-e-seguranca
1676;Kit Aspirador Nasal com Conta-Gotas Buba ;1002661333;32.00;baby;saude-e-seguranca
1677;Termômetro Digital Haste Rígida Bioland ;1002668703;14.98;baby;saude-e-seguranca
1678;Chupeta Bebê Infantil Com Estojo Para Transporte 6-16M 100% Silicone Livre BPA Soft Rosa Chicco ;1002612264;39.36;baby;saude-e-seguranca
1679;Chupeta Bebê Infantil Ortodontica Bico Macio De 0 a 2 Meses Newborn Tommee Tippee Cor:Roxo ;1002612402;28.99;baby;saude-e-seguranca
1680;Prendedor de Chupeta Dupla Face Prendedor de Plástico Presilha Com Trava 2+ Meses Elefante Buba Cor:Laranja ;1002612512;12.99;baby;saude-e-seguranca
1681;Chupeta Bebê Infantil Ortodontica Bico Macio De 0 a 2 Meses Menino Newborn Tommee Tippee ;1002612525;28.44;baby;saude-e-seguranca
1682;Kit 2 Chupetas Bebê Com Estojo Para Esterilização +6 Meses Silicone Livre BPA Azul Verde Lillo ;1002612229;45.00;baby;saude-e-seguranca
1683;Cortador de Unha Infantil Para Bebê Desde o Nascimento Aço Inoxidável Com Protetor Azul Lillo ;1002612586;21.52;baby;saude-e-seguranca
1684;Kit 2 Chupetas Bebê Infantil Com Estojo Para Transporte De 0 à 6 Meses Silicone Dia e Noite Branco Lolly ;1002612450;30.99;baby;saude-e-seguranca
1685;Aspirador Nasal 2 em 1 Azul Lolly Kinndy ;1002703488;16.90;baby;saude-e-seguranca
1686;Kit 2 Chupetas Bebê Infantil Com Estojo Para Transporte +6 Meses Silicone Dia e Noite Lolly Cor:Neutra ;1002612527;30.99;baby;saude-e-seguranca
1687;Porta Chupeta para Armazenamento de 2 Chupetas Com Presilha e Alça de Transporte Lhama Baby Go ;1002612388;8.33;baby;saude-e-seguranca
1688;Prendedor Para Chupeta Do Bebê Em Silicone Presilha Anti Perdas Soft Buba ;1002612400;39.99;baby;saude-e-seguranca
1689;Prendedor Chupeta Bebê Criança Infantil Para +3 Meses Presilha Fácil Fixação Buba Estampa:Cupcake ;1002612303;18.00;baby;saude-e-seguranca
1690;Mordedor Para Bebê Com Água Resfriável Infantil +3 Meses Anatômico e Texturizado Buba ;1002612394;19.99;baby;saude-e-seguranca
1691;Aspirador De Nariz Para Bebê - Sugador Nasal De Sucção Buba ;1002512571;29.90;baby;saude-e-seguranca
1692;Kit Manicure Infantil Bebê Com Cortador de Unha Tesoura e Lixa A Partir do Nascimento Azul Clingo ;1002612315;34.90;baby;saude-e-seguranca
1693;Kit Chupetas Bebê Infantil C Estojo Brilha No Escuro +6M Silicone Livre BPA Night Neutra Mam ;1002612238;43.00;baby;saude-e-seguranca
1694;Porta Chupeta para Armazenamento de 2 Chupetas Com Presilha e Alça de Transporte Lhama Baby Go ;1002612605;8.33;baby;saude-e-seguranca
1695;Kit Manicure Bebê +0 Meses Tesoura Cortador Pinça e Lixa Com Case Higiene Infantil Egg Azul Kababy ;1002612540;44.45;baby;saude-e-seguranca
1696;Kit Lixas de Unha Selva ;1002525025;19.99;baby;saude-e-seguranca
1697;Sugador Nasal Blister Individual - Sana Babies ;1002371304;35.40;baby;saude-e-seguranca
1698;Aspirador Nasal de Sucção Infantil Para Bebê Desde o Nascimento de Silicone Com Estojo Higiênico Buba ;1002565860;28.99;baby;saude-e-seguranca
1699;Seringa para Lavagem Nasal 10ml Cachorro - Nosewash ;1002434401;29.90;baby;saude-e-seguranca
1700;Seringa Lavagem Nasal Infantil Nosewash ;1002403370;29.90;baby;saude-e-seguranca
1701;Seringa para Lavagem Nasal 10ml Unicórnio - Nosewash ;1002434400;29.80;baby;saude-e-seguranca
1702;;;;baby;saude-e-seguranca
1703;Seringa Lavagem Nasal Infantil Nosewash ;1002403371;29.90;baby;saude-e-seguranca
1704;Extensor de Grade Para Portas Escadas Corredores Infantil Bebê Pet 20CM Tubline Branco ;1002607885;41.34;baby;saude-e-seguranca
1705;Trava De Segurança Multiuso Flexível Infantil Bebê Criança Para Gavetas E Portas 2 Unidades Buba ;1002607834;20.99;baby;saude-e-seguranca
1706;Extensor de Grade Para Portas Escadas Corredores Infantil Bebê Pet 10CM Tubline Branco ;1002607891;22.00;baby;saude-e-seguranca
1707;Termômetro Infantil Girafinha 5240 - Buba ;100500280;29.99;baby;saude-e-seguranca
1708;Micronebulizador - Válvula Para Ar Comprimido - Infantil - 2,8m - Multilaser Saúde - HC051X [Reembalado] ;1002486079;4.59;baby;saude-e-seguranca
1709;MOSQUITEIRO PARA BEBE KIT COM 5 UNIDADES TELA DE PROTECAO PARA CRIANÇAS CONTRA MOSQUITOS INSETOS PERNILONGOS MOSCAS ;1002509275;45.95;baby;saude-e-seguranca
1710;Trava De Segurança Infantil Bebê Criança Para Puxador De Armário Multiuso Kababy ;1002607874;15.00;baby;saude-e-seguranca
1711;Kit Travas De Segurança Bebê Para Gavetas e Armários 2 Unidades Adesivo Multiuso Kababy ;1002607868;19.90;baby;saude-e-seguranca
1712;Trava Para Dobradiça De Porta Comtac Kids 4136 ;1002175603;13.94;baby;saude-e-seguranca
1713;Protetor Para Borda Formato V Comtac Kids 4216 ;1002175527;33.70;baby;saude-e-seguranca
1714;Protetor Para Quina De Mesa Formato V Comtac Kids 4211 ;1002175524;21.13;baby;saude-e-seguranca
1715;Termômetro de Banho Buba Urso Branco 12646 ;100301476;29.99;baby;saude-e-seguranca
1716;Protetor Para Borda Formato V Comtac Kids 4214 ;1002146165;34.44;baby;saude-e-seguranca
1717;Travas Para Gabinete Comtac Kids 4130 ;1002175590;23.37;baby;saude-e-seguranca
1718;Conjunto de Protetores Para Tomada Comtac Kids 4135 ;1002175597;20.91;baby;saude-e-seguranca
1719;Trava Para Gabinete Baleia Comtac Kids 4204 ;1002175523;22.46;baby;saude-e-seguranca
1720;Mordedor Infantil Para Bebê +4 Meses Com Formato Divertido Alivia as Gengivas Chaves Lolly Nenny Cor:Rosa ;1002612398;21.90;baby;saude-e-seguranca
1721;Kit 2 Chupetas Bebê Infantil +6 Meses Bico Anatômico de Silicone Air Dia e Noite Rosa e Lilás Lillo ;1002612277;25.00;baby;saude-e-seguranca
1722;Kit 2 Chupetas Bebê Infantil Com Estojo Para Transporte +0 Meses Silicone Air Dia e Noite Lillo Cor:Azul ;1002612341;17.00;baby;saude-e-seguranca
1723;Kit 2 Chupetas Bebê Infantil Com Estojo Para Transporte +0 Meses Silicone Air Dia e Noite Azul Lillo ;1002612483;17.00;baby;saude-e-seguranca
1724;Chupeta Para Bebê +6 Meses 100% Silicone Dreams Ovelhas Com Estojo Lolly Cor:Azul ;1002612474;23.99;baby;saude-e-seguranca
1725;Espelho Infantil Retrovisor para Carro - Buba ;100472269;35.90;baby;saude-e-seguranca
1726;Trava Interna Para Gaveta 2 Unidades Multikids Baby - Bb261 ;100466661;17.57;baby;saude-e-seguranca
1727;Protetor De Quina 4 Unidades Tamanho M Multikids Baby - Bb251 ;100466467;15.95;baby;saude-e-seguranca
1728;Bolsinha Térmica Bebê sem Cólica Cachorro Azul ;100225627;28.90;baby;saude-e-seguranca
1729;Aplicador e Dosador de Medicamentos Líquidos - Azul - Multikids Baby ;100163635;14.90;baby;saude-e-seguranca
1730;Protetor De Dedos Chicco ;100239915;34.90;baby;saude-e-seguranca
1731;Bolsinha Térmica Bebê Sem Cólica Cachorro Bege ;100225629;29.90;baby;saude-e-seguranca
1732;Acessórios de Segurança - Trava Multifuncional - Com Botão Secreto - White - Safety 1St ;100172770;26.90;baby;saude-e-seguranca
1733;Aspirador Nasal - White ;100293088;9.90;baby;saude-e-seguranca
1734;Protetor de Cantos - Chicco ;100009554;39.90;baby;saude-e-seguranca
1735;KIT DE LAVADOR NASAL 300ML - BUBA ;1002726494;39.90;baby;saude-e-seguranca
1736;Kit 2 Chupetas de Bebê Infantil De 0 à 6 Meses Tamanho 1 Bico de Silicone Com Estojo de Transporte Mam Cor:Rosa ;1002612490;43.00;baby;saude-e-seguranca
1737;Chupeta Bebê Infantil + 6 Meses Tamanho 2 Silicone Soft Livre de BPA Sensitive Nuk Cor:Rosa ;1002612455;31.99;baby;saude-e-seguranca
1738;Chupeta Bebe Infantil De 0 à 6 Meses Tamanho 1 Unitária Comfort Elefantinho Rosa Buba ;1002612438;19.99;baby;saude-e-seguranca
1739;Chupeta Bebe Infantil De 0 à 6 Meses Tamanho 1 Silicone Unitária Comfort Buba Estampa:Elefante Rosa ;1002612497;19.99;baby;saude-e-seguranca
1740;Chupeta Para Bebê Kit 2 Un De +6 Meses Tamanho 2 Silicone Ursinho e Estrelinhas Comfort Rosa Buba ;1002612217;29.00;baby;saude-e-seguranca
1741;Chupeta Bebê Infantil Criança + 6 Meses Tamanho 2 Bico Simétrico de Silicone BPA Free Comfort Buba Estampa:Ursinho Rosa ;1002612310;19.99;baby;saude-e-seguranca
1742;Kit Chupetas Bebê Infantil Com Estojo Brilha No Escuro +6M Silicone Livre BPA Night Mam Cor:Azul ;1002612491;43.00;baby;saude-e-seguranca
1743;Chupeta Bebê Infantil Ortodontica Bico Macio De 0 a 2 Meses Menina Newborn Tommee Tippee ;1002612190;28.99;baby;saude-e-seguranca
1744;Chupeta De Bebê Infantil Com Bico de Silicone A Partir dos 6 Meses Tam 2 Extra Air Lillo Cor:Rosa ;1002612560;10.99;baby;saude-e-seguranca
1745;Kit 2 Chupetas Bebê Infantil Com Estojo Para Transporte +0 Meses Silicone Air Dia e Noite Lillo Cor:Rosa ;1002612526;17.00;baby;saude-e-seguranca
1746;Mordedor Bebê Infantil +3 Meses Material Extra Macio Texturizado Mãozinha Buba Cor:Rosa ;1002612538;17.99;baby;saude-e-seguranca
1747;Chupeta De Bebê Infantil Bico de Silicone De 0 à 6 Meses Tam 1 Nk II Baby Go Cor:Rosa ;1002612544;8.33;baby;saude-e-seguranca
1748;Chupeta Para Bebê Infantil De Silicone +6 Meses Livre BPA Lolly Cor:Azul ;1002612489;19.00;baby;saude-e-seguranca
1749;Chupeta Bebê Infantil Criança + 6 Meses Tamanho 2 Bico Simétrico de Silicone BPA Free Comfort Buba Estampa:Elefantinho R ;1002612502;19.99;baby;saude-e-seguranca
1750;Prendedor Chupeta Bebê +3 Meses Com Argola de Silicone Buba Estampa:Colors ;1002612293;17.99;baby;saude-e-seguranca
1751;Prendedor Chupeta Bebê +3 Meses Prendedor de Metal Animal Fun Buba Estampa:Macaco ;1002612488;17.00;baby;saude-e-seguranca
1752;TERMOMETRO DE BANHO URSO - 12646 ;1002438590;41.00;baby;saude-e-seguranca
1753;Dosador Tipo Chupeta Buba Bebe 7556 ;1002438506;46.50;baby;saude-e-seguranca
1754;CAIXINHA PORTA MASCARA DUPLO COMPARTIMENTO DECORADO PLASUTIL ;1002438953;12.98;baby;saude-e-seguranca
1755;CAIXINHA PORTA MASCARA DUPLO COMPARTIMENTO MICKEY PLASUTIL ;1002438952;16.98;baby;saude-e-seguranca
1756;DOSADOR DE REMEDIO - 09807 ROSA ;1002438519;33.75;baby;saude-e-seguranca
1757;Máscara de Proteção Lisa ;1002491266;;baby;saude-e-seguranca
1758;6142 - KIT ASPIRADOR NASAL COM CONTA GOTAS ;1002392242;42.00;baby;saude-e-seguranca
1759;Aspirador Nasal de Sucção Safety 1st Transparente ;1002376359;42.90;baby;saude-e-seguranca
1760;Kit 2 Chupetas de Bebê Brilha No Escuro 0-6 Meses Tam 1 Menino Dia e Noite Nuk ;1002612228;0.00;baby;saude-e-seguranca
1761;Mordedor Infantil Para Bebê +3 Meses Com Formato Divertido Chaveirinho Buba ;1002612314;0.00;baby;saude-e-seguranca
