;name;SKU;price;department;sector
1041;BOIA INFLAVEL COLCHAO SANDALIA FRUITS SLIPPE ;1002344507;;produtos importados;esportes
1042;Barraca Infantil - Disney - Casinha das Princesas - Líder ;100152159;199.99;produtos importados;esportes
1043;Piscina Inflável Redonda 1.000 Litros Jilong Avenli ;1002090070;189.99;produtos importados;esportes
1044;Boia Unicórnio G ;100514786;199.00;produtos importados;esportes
1045;Bola Handebol Masculino Rainha T3 Pró C/C ;1002471523;155.90;produtos importados;esportes
1046;Bola Infantil Handebol Rainha T1 Pró C/C ;1002471528;155.90;produtos importados;esportes
1047;BOLA DE VOLEI VP 2000 X AM-RX-PT ;1002691032;;produtos importados;esportes
1048;Capacete Infantil Polisport Baby Rainbow XXS 44/48 ;1002684251;169.90;produtos importados;esportes
1049;Oculos de Triathlon Espelhado Hammerhead Offshore Polarized ;1002682101;163.90;produtos importados;esportes
1050;Oculos de Triathlon Espelhado Hammerhead Offshore Polarized ;1002682118;163.90;produtos importados;esportes
1051;Oculos de Triathlon Espelhado Hammerhead Offshore Polarized ;1002682111;163.90;produtos importados;esportes
1052;Patinete Radical Floresta Divertida Com Luz - DM Toys ;1002660920;169.99;produtos importados;esportes
1053;TOCA MÁGICA JÚNIOR NA SACOLA - BRASKIT  610B BRASKIT ;1002659556;159.99;produtos importados;esportes
1054;Bola de Basquete NBA DRV Verde ;1002633650;159.99;produtos importados;esportes
1055;Kit de Proteção Preto Mormaii ;1002606825;179.00;produtos importados;esportes
1056;Kit de Proteção Preto Mormaii ;1002606823;179.00;produtos importados;esportes
1057;Boia Inflável Gigante Anel de Coração ;1002603044;189.00;produtos importados;esportes
1058;Bola Handebol Feminino Rainha T2 Pró C/C ;1002471530;159.90;produtos importados;esportes
1059;Bola Handebol Infantil Penalty H1L Ultra Fusion X ;1002471526;159.90;produtos importados;esportes
1060;PISCINA 400L INFANTIL 3ANEIS COLOR (CORES SORTIDAS) ;1002563924;;produtos importados;esportes
1061;Patinete de Ferro Adesivado Caveira C/LED - Cie PT-53MS ;1002462002;199.99;produtos importados;esportes
1062;Barraca Portátil Casa da Minnie - Mimo 4312 Gf001D ;1002553472;198.53;produtos importados;esportes
1063;Kit Molas para Cama Elástica Pula Pula - 30 Molas de 18cm ;1002141501;192.00;produtos importados;esportes
1064;Kit Molas para Cama Elástica Pula Pula - 30 Molas de 13cm ;1002141497;192.00;produtos importados;esportes
1065;Kit Molas para Cama Elástica Pula Pula - 25 Molas de 13cm ;1002141502;163.00;produtos importados;esportes
1066;PRANCHA BODYBOARD ATRIO GRANDE AMARELO - ES430 ;1002126839;169.34;produtos importados;esportes
1067;Banheira Inflável 200 Litros Homem-Aranha - Mor 1176 ;1002114656;159.99;produtos importados;esportes
1068;BARRACA CASINHA SPIDERMAN LIDER-2534 ;1002112900;199.00;produtos importados;esportes
1069;Piscina Arco Iris 550L - Mor -  UNICA ;1002099074;187.62;produtos importados;esportes
1070;Bola de Futebol de Campo Matis IX Original Penalty ;100557793;178.10;produtos importados;esportes
1071;Gangorra Minhoquinha Verde ;100384078;159.00;produtos importados;esportes
1072;Proteção de Molas Colorida Alcamar para Cama Elástica de 2,50 m ;100354793;158.64;produtos importados;esportes
1073;;;;produtos importados;esportes
1074;Proteção de Molas Colorida ChicoPlay para Cama Elástica de 2,50 m ;100354775;158.64;produtos importados;esportes
1075;Lona de Salto para Cama Elástica 1,83m ChicoPlay Colorida Nacional ;100354695;184.90;produtos importados;esportes
1076;Proteção de Molas Colorida ChicoPlay para Cama Elástica de 2,44 m ;100354638;158.64;produtos importados;esportes
1077;Proteção de Molas Colorida Alcamar para Cama Elástica de 2,44 m ;100354815;158.64;produtos importados;esportes
1078;Boliche de Números - Brink Sul ;100346735;198.70;produtos importados;esportes
1079;Barraca Infantil Portatil Mickey Club House Zippy Toys ;1002385134;199.99;produtos importados;esportes
1080;Barraca Infantil Portatil Minnie Mouse Zippy Toys ;1002385078;159.99;produtos importados;esportes
1081;Barraca Infantil Portatil Iglu Casa do Mickey Facil de Monta ;1002385105;159.90;produtos importados;esportes
1082;Barraca Infantil Portatil Casa Turma da Monica Zippy Toys ;1002385101;199.99;produtos importados;esportes
1083;Barraca Infantil Portatil Princesas Zippy Toys ;1002385116;163.99;produtos importados;esportes
1084;Barraca Portatil Toy Story Zippy Toys ;1002385140;158.54;produtos importados;esportes
1085;Barraca Infantil Portátil Minnie Mouse BP19MN Zippy Toys ;100268888;;produtos importados;esportes
1086;Balanço Infantil com Encosto Regulável Fofossauros Ref 9254 Xalingo ;100302359;;produtos importados;esportes
1087;"Bicicleta 12"" Nathor Violet Roxo ";100472892;208.90;produtos importados;esportes
1088;"Bicicleta 12"" Nathor Fireman Vermelho ";100472891;208.90;produtos importados;esportes
1089;Bicicleta Aro 12 -  Arco Íris Branco e Pink - TK3 Track ;100412539;249.99;produtos importados;esportes
1090;Bicicleta - Aro 12 - Nathor - Charm - Rosa ;1002389767;227.90;produtos importados;esportes
1091;Bicicleta - Aro 12 - Nathor - Flower - Rosa ;1002389283;227.90;produtos importados;esportes
1092;Bicicleta - Aro 12 - Nathor - Black 12 - Verde ;1002389746;239.90;produtos importados;esportes
1093;Bicicleta Aro 12 - Arco Íris Vermelho e Azul - TK3 Track ;100412540;249.99;produtos importados;esportes
1094;Patins Inline - Tracer Boy - RollerDerby - Azul e Preto - Fila ;100157626;229.90;produtos importados;esportes
1095;Patinete Atrio Monster 2 Rodas ES271 ;1002514645;219.90;produtos importados;esportes
1096;Balanço Infantil com Encosto Ajustável - Disney - Minnie Mouse - Xalingo ;100153445;204.64;produtos importados;esportes
1097;Patins Clássico 4 Rodas Tamanho 35 e 36 - Fun Divirta-se ;100453307;244.99;produtos importados;esportes
1098;PATINETE INFANTIL 3 RODAS PRINCESAS DISNEY LED ETITOYS ROXO ;1002716361;;produtos importados;esportes
1099;BRINQUEDO DIVERSO THE AVENGERS CHUTE A GOL  (CORES SORTIDOS) ;1002326011;;produtos importados;esportes
1100;Patins Roller Roxo Com Kit De Proteção Tamanho 34 Ao 37 ;100437970;244.90;produtos importados;esportes
1101;Patinete Infantil Metal Sonic 3 Rodas Em Gel C/ Led - Buzina ;1002414166;230.00;produtos importados;esportes
1102;Skate Infantil Frozen + Capacete + Joalheira ;1002414163;230.00;produtos importados;esportes
1103;Skate Infantil Patrulha Canina + Kit Proteção ;1002453563;245.00;produtos importados;esportes
1104;RAQUETE BEACH TENNIS PROFISSIONAL TÊNIS DE PRAIA EM CARBONO RAQUETE BRAZILIAN ULTRA CUSHIN ;1002631851;209.90;produtos importados;esportes
1105;Patinete Infantil Metal Carros Mcqueen 3 Rodas Led - Buzina ;1002389985;249.90;produtos importados;esportes
1106;Patins Fênix Brinquedos Roller Skate RL-07 ;1002514614;234.90;produtos importados;esportes
1107;TOCA BALL C/40 BOLINHAS ;1002467614;;produtos importados;esportes
1108;Bola Futebol de Campo Adidas UWCL League Eindhoven 2023 ;1002685384;208.90;produtos importados;esportes
1109;RAQUETE BEACH TENNIS KEVLAR BRAZILIAN PROFISSIONAL2021 FIBRA ;1002606720;249.33;produtos importados;esportes
1110;RAQUETE DE BEACH TENNIS COM CAPA RAQUETEIRA WBT SPAIN 100% FIBRA DE CARBONO PROFISSIONAL ;1002525158;219.99;produtos importados;esportes
1111;Patinete Esportivo Rosa ;100349681;248.99;produtos importados;esportes
1112;Patinete Infantil 3 Rodas Led até 40kg c/ Kit de Proteção ;1002673904;229.90;produtos importados;esportes
1113;Cadeira Infantil em Madeira - Acabamento Laqueado Rosa ;100206449;;produtos importados;esportes
1114;KIT TRAVE DE FUTEBOL E TABELA DE BASQUETE 2 UNIDADES MINI GOLZINHO CESTO ARO 2 COM 2 BOLAS E BOMBA 2 EM 1 ;1002681580;;produtos importados;esportes
1115;Barraca Minha Casinha Tenda Toca Cabana Infantil + Led Fada ;100438121;209.99;produtos importados;esportes
1116;Boia Inflável Flamingo Muito Mfofo - 1,27x1,27m Na Caixa ;1002705825;229.99;produtos importados;esportes
1117;Bola de Futevôlei Penalty Altinha XXI ;1002493722;238.90;produtos importados;esportes
1118;Barraca Infantil Barbie Dreamtopia Bag - Fun ;1002433118;227.88;produtos importados;esportes
1119;Kit de Acessórios Básico para Reposição Cama Elástica de 1,83m ChicoPlay ;100354650;245.21;produtos importados;esportes
1120;Kit de Acessórios Básico para Reposição Cama Elástica de 1,50m ChicoPlay ;100354697;219.05;produtos importados;esportes
1121;Piscina Banheira Infantil Inflável 550l Arco-íris 1785 Mor ;100348448;217.70;produtos importados;esportes
1122;Lona de Salto Preta para Cama Elástica Importada 2,00 m ChicoPlay sem Emenda ;100354812;223.66;produtos importados;esportes
1123;Barraca Infantil Princesas Tenda do Indio  - Zippy Toys ;100331593;214.63;produtos importados;esportes
1124;Patins Inline 34-37 Inline Rosa ;1002443297;244.90;produtos importados;esportes
1125;Barraca Infantil Fun - Barbie ;1002694777;238.93;produtos importados;esportes
1126;Bicicleta Bike Infantil Aro 12 Menina Menino Nathor ;1002467290;239.90;produtos importados;esportes
1127;Bicicleta Flower Aro 12 Nathor com rodas de treinamento ;1002613302;;produtos importados;esportes
1128;Jogo de Boliche dos Macaquinhos - Chicco ;1002578937;239.90;produtos importados;esportes
1129;Bicicleta Charm Aro 12 - Nathor ;1002404841;249.99;produtos importados;esportes
1130;Bicicleta Balance Bike Feminina Aro 12 Nathor Multicor ;1002613301;;produtos importados;esportes
1131;Colete de Natação - Turma da Mônica - Sem Mangas - Rosa - Bel Fix ;100558468;219.99;produtos importados;esportes
1132;Barraca Infantil com Bolinhas - Hot Wheels - Fun Divirta-se ;100529390;229.99;produtos importados;esportes
1133;Barbie Piscina De Bolinhas Inflável Com 25 Bolinhas 135 Litros Fun Presente Brinquedo Original NFe ;1002462275;229.00;produtos importados;esportes
1134;PATINS 2 EM 1 ROSA BBR FLORES ;100485447;239.90;produtos importados;esportes
1135;Bola de Vôlei de praia Mikasa VXL 30 ;100454695;;produtos importados;esportes
1136;Patinete Alien Infantil 3 Rodas Com Música E Luz Radical ;100577685;249.99;produtos importados;esportes
1137;Patinete 3 Rodas Infanto-Juvenil Azul ;100514937;227.80;produtos importados;esportes
1138;Skate Street Spin Maple Semi-Profissional Abec 9 Coruja ;1002382741;249.99;produtos importados;esportes
1139;Barraca Túnel Infantil 3 Em 1 Sereias  Fabricando Ideias ;100455640;219.00;produtos importados;esportes
1140;Patinete Infantil Bel Sport Twist 3 Rodas Rosa - Belfix ;100428719;249.89;produtos importados;esportes
1141;BRINQUEDO PARA PLAYGROUND BALANCO TIGRINHO ;1002325788;;produtos importados;esportes
1142;Barraca com Bolinhas - Discovery Kids - Power Rockers - Fun ;100439828;233.99;produtos importados;esportes
1143;Bicicleta Aro 12 Infantil Violet Nathor Com Rodinhas ;1002696915;234.90;produtos importados;esportes
1144;Mesa Projetora De Imagens E Com Jogo Tetris Girafa ;1002515489;209.99;produtos importados;esportes
1145;Nadadeira pé de pato para mergulho infantil Scuba Jr Fin - VERDE ACQUA ;1002716682;249.90;produtos importados;esportes
1146;Nadadeira pé de pato para mergulho infantil Scuba Jr Fin - ROSA CLARO ;1002716688;249.90;produtos importados;esportes
1147;Patinete Twist Bel Sports 3 Rodas Rosa  Bel Sports ;1002719156;209.97;produtos importados;esportes
1148;Skate Infantil Patrulha Canina + Kit Proteção Rosa ;1002697313;245.00;produtos importados;esportes
1149;Bicicleta Aro 12 Infantil Black Nathor Com Rodinhas ;1002696918;234.90;produtos importados;esportes
1150;Bola Futsal Penalty Max 500 Termotec XXII ;1002708440;238.90;produtos importados;esportes
1151;Barraca Portátil Casa Princesas - Zippy Toys 3864 ;1002551961;207.41;produtos importados;esportes
1152;Nerf Cesta Basquete com Contador Eletrônico F0056-3 Fun ;1002519968;249.49;produtos importados;esportes
1153;Patinete Astro In-line Dinossauro ;1002514638;224.90;produtos importados;esportes
1154;Balanço gangorra infantil madeira 50x40 Colorido até 100kg ;1002686100;249.90;produtos importados;esportes
1155;Barraca Infantil 3 em 1 Dinossauro Túnel Cercadinho DM Toys ;1002438717;229.90;produtos importados;esportes
1156;Skate Semi Profissional Montado 7 Laminas Abec 5 Até 70 Kg ;1002583073;209.90;produtos importados;esportes
1157;Balanço Infantil Bebê Criança Unicórnio Resistente Menina ;1002518823;249.90;produtos importados;esportes
1158;Mesa Projetora De Imagens E Com Jogo Tetris Golfinho ;1002515492;209.99;produtos importados;esportes
1159;Patins Roller 34 BBR Toys Rosa ;1002562619;249.99;produtos importados;esportes
1160;Patinete Infantil Rosa Com 3 Rodas - CIE Ytt-07Ro-Lx ;1002461988;249.99;produtos importados;esportes
1161;Rosa Best Race Patinete 2 Rodas - BBR TOYS R2958 ;1002547693;211.86;produtos importados;esportes
1162;Roxo Best Race Patinete 2 Rodas - BBR TOYS R2958 ;1002547651;211.86;produtos importados;esportes
1163;Barraca Camping Camuflada 3 Lugares ;1002390218;225.00;produtos importados;esportes
1164;Patinete Infantil De Ferro Os Vingadores 3 Roda ;1002389988;249.90;produtos importados;esportes
1165;BRINQUEDO PARA PLAYGROUND HUPPA HUPPA ROSA ;1002467479;;produtos importados;esportes
1166;Patinete Infantil 3 Rodas Liga Da Justiça ;1002466119;245.00;produtos importados;esportes
1167;Balanco Infantil Disney Com Encosto Regulavel Minnie Xalingo ;1002417363;319.99;produtos importados;esportes
1168;Patinete DM Radical em Alumínio c/ 3 Rodas Dobrável DM Toys ;1002438685;229.90;produtos importados;esportes
1169;Skate Nerf Radical - Multikids ;1002329803;201.59;produtos importados;esportes
1170;Jump Ball - Lider -  HOMEN ARANHA/SPIDER MAN ;1002095019;218.39;produtos importados;esportes
1171;Tech Deck - Skate de Dedo e Rampa X-Connect Park - Sunny 2894 ;1002305892;239.90;produtos importados;esportes
1172;Skateboard Estampa Alienígena Semiprofissional - Bel Fix ;1002315397;239.88;produtos importados;esportes
1173;Patinete Infantil 3 Rodas com Led Masculino Menino preto e azul BBR ;100479515;249.99;produtos importados;esportes
1174;Bola Juvenil Penalty Society Se7e N4 X ;1002273220;219.90;produtos importados;esportes
1175;Kit Casa - Casinha Para Brincar - Papelão - 200701 - Eu Amo Papelão ;100416513;206.32;produtos importados;esportes
1176;Kit 6 Unidades Boia Inflável  Donut 107cm de diâmetro Bestway ;100559366;239.80;produtos importados;esportes
1177;Piscina Inflável Easy Set 2.362 Litros + Bomba de Inflar Intex ;100428646;249.89;produtos importados;esportes
1178;Bote Inflável Explorer 200 Intex 2 Pessoas Até 95kg + Remo + Bomba ;100428908;229.99;produtos importados;esportes
1179;Barraca Infantil - Bichinhos da Selva - Fisher-Price ;100165261;239.88;produtos importados;esportes
1180;Patinete Atrio 3 Rodas Led +3 anos - ES358OUT [Reembalado] ;100555139;230.15;produtos importados;esportes
1181;Colchonete para Piscina de Bolinhas ChicoPlay 2m ;100354757;210.47;produtos importados;esportes
1182;Piscina de Bolinhas HOT Wheels Inflavel com 25 Bolinhas FUN F0000-4 ;100295262;209.90;produtos importados;esportes
1183;Skate Street Spin Maple Abec 9 Garota Spin ;1002520186;219.99;produtos importados;esportes
1184;Patinete Infantil DM Toys 3 Rodas Musical com Cesta Dinossauro - DMR5620 ;1002525951;209.90;produtos importados;esportes
1185;Colchão Inflável Piscina Batata Potato Chips - Intex 58776 ;1002495103;215.00;produtos importados;esportes
1186;Colchão Inflável para Piscina Batata Frita Intex - 58775 ;1002491373;;produtos importados;esportes
1187;Colchão Inflável para Piscina Cachorro Quente Intex - 58771 ;1002491314;;produtos importados;esportes
1188;Barraca Casinha Infantil Cabeceira Cama Unicórnio Importway BW159RS ;1002401584;233.90;produtos importados;esportes
1189;Patins Clássico BW020AZ 32/33 ImportWay Azul ;1002324975;;produtos importados;esportes
1190;Lona de Salto Amarela para Cama Elástica 2,00M ChicoPlay ;1002161759;223.66;produtos importados;esportes
1191;Patinete Infantil 3 Rodas Patrulha da Justiça - Dm Toys 5667 ;100265387;249.72;produtos importados;esportes
1192;Barraca Casa Portátil - Spider-Man - Zippy Toys ;100040959;219.68;produtos importados;esportes
1193;Patinete Infantil Musical Com Luz e Cestinha Disney Minnie ;1002736448;205.99;produtos importados;esportes
1194;Piscina Inflável 1000 litros Fast Set com Borda Azul 1.68mx51cm ;1002730392;209.90;produtos importados;esportes
1195;Nadadeira pé de pato para mergulho infantil Scuba Jr Fin - ROSA CLARO ;1002716685;249.90;produtos importados;esportes
1196;Colchão Inflável Jilong para Piscina ;1002667067;239.90;produtos importados;esportes
1197;Colchão Inflável Jilong para Piscina ;1002667073;239.90;produtos importados;esportes
1198;Bola Basquete Magussy Pro6 Oficial ;1002646300;209.90;produtos importados;esportes
1199;Balanço Infantil Com Encosto Regulavel Unicornio - Xalingo 09298 ;1002604633;215.90;produtos importados;esportes
1200;Bola de Futevôlei Penalty Altinha XXI ;1002493723;228.90;produtos importados;esportes
1201;Bola de Futsal Infantil Max 100 Sub 9 / Sub 11 Penalty Term XXII - Branco+Preto ;1002471532;229.90;produtos importados;esportes
1202;Bola de Futsal Infantil Sub 7 / Sub 9 Penalty Max 50 Term XXII ;1002471533;219.90;produtos importados;esportes
1203;PISCINA 35L BEE CANOPY POOL REDONDA ;1002563917;;produtos importados;esportes
1204;Skate Com Acessórios 78cm x 20cm - HB151 ;1002469900;222.36;produtos importados;esportes
1205;Colchão Dura-Beam Casal - Intex 64758 ;1002568310;235.00;produtos importados;esportes
1206;Jogo Lança Disco Campo Colorido Inflável - Intex 57510 ;1002568315;239.90;produtos importados;esportes
1207;Kit Skate Infantil Sapo - Mor  40600201 ;1002114478;219.99;produtos importados;esportes
1208;Bola Futsal Topper Dominator Pró 2021 ;1002136037;229.90;produtos importados;esportes
1209;Cadeira de Balanço Lilás - Place 3160 ;100583352;219.98;produtos importados;esportes
1210;Cadeira de Balanço Amarela - Place 3160 ;100583357;219.98;produtos importados;esportes
1211;Barraca Castelo Encantado Toca Rosa 1,3m Altura 0,98m Diametro ;100577637;205.00;produtos importados;esportes
1212;Lonas de Salto p/ Cama Elástica Pula Pula - Todas as Medidas ;100470647;240.45;produtos importados;esportes
1213;Cadeira Balanço Infantil Segura c/ Encosto SpiderMan Xalingo ;100470919;240.45;produtos importados;esportes
1214;Bicicleta Aro 12 Preta ;100458224;249.99;produtos importados;esportes
1215;Patinete Street Fire com Led 2 Rodas Até 50 kg Regulagem Altura - Lotus ;1002311758;229.99;produtos importados;esportes
1216;Patinete Infantil 2 Rodas com Luzes e Pé de Apoio Até 60 Kg Dobrável Crazy Dream Etitoys ;1002633101;229.90;produtos importados;esportes
1217;Bicicleta para Meninos Aro 12 Azul e Branco Styll Radical ;1002577977;243.99;produtos importados;esportes
1218;TENDA CABANA ÍNDIO INFANTIL PRINCESAS TN18PR ;1002472502;219.00;produtos importados;esportes
1219;Skate Com Acessórios 78cm x 20cm - HB381 ;1002469888;222.36;produtos importados;esportes
1220;Piscina de Bolinha Mulher Maravilha Com 100 Bolinhas Zippy ;1002385339;230.99;produtos importados;esportes
1221;BARRACA INFANTIL TOCA TEMA BW133 ;1002404931;219.90;produtos importados;esportes
1222;Patinete Infantil 3 Rodas Articulado (rosa) - Unitoys ;1002398160;217.80;produtos importados;esportes
1223;Bicicleta - Aro 12 - Nathor - Princesas Disney ;1002457278;269.90;produtos importados;esportes
1224;Bicicleta Infantil - Aro 12 - Nathor - Mickey ;1002688585;259.90;produtos importados;esportes
1225;Bicicleta Infantil - Cecizinha - Aro 12 - Caloi – Lilás ;1002707087;259.90;produtos importados;esportes
1226;Patins - Hot Wheels - Ajustável - Tamanho 33 a 36 - Fun - Azul ;1002415232;279.90;produtos importados;esportes
1227;Patinete 3 Rodas - Monster Azul e Verde - LED e Guidão Ajustável - Multikids ;100175513;279.37;produtos importados;esportes
1228;Barraca - Barbie - 50 bolinhas - Fun ;100376692;299.88;produtos importados;esportes
1229;Bicicleta - Aro 12 - Nathor - Antonella - Rosa ;1002688579;259.90;produtos importados;esportes
1230;Conjunto de Mesa Infantil com Cadeira - Mundo Bita - Monte Líbano ;100174712;273.90;produtos importados;esportes
1231;CONJUNTO INFANTIL MESA EAMES BRANCA 60CM COM 1 CADEIRA AZUL CLARO ;1002512021;289.00;produtos importados;esportes
1232;Patinete Dobrável - Jurassic World - Froes - Laranja ;1002697727;269.90;produtos importados;esportes
1233;KIT PATINETE INFANTIL PRINCESAS LED + PROTEÇÃO ETITOYS ROSA ;1002726298;;produtos importados;esportes
1234;Patins Clássico 31/32 Barão Atacadista Branco,Rosa ;100214493;292.99;produtos importados;esportes
1235;BARRACA INFANTIL TOCA TÚNEL E PISCINA BOLINHAS BW158 ;1002404932;279.90;produtos importados;esportes
1236;Barraca Infantil+Tapete Acolchoado Azul Marinho 135X90X90 ;1002511339;299.90;produtos importados;esportes
1237;Bicicleta Infantil Aro 12 Flower - Nathor ;100254302;269.99;produtos importados;esportes
1238;"Bicicleta Infantil Nathor Aro 12"" - Black 12 ";100473044;275.00;produtos importados;esportes
1239;Proteção de Molas de 4,27m para Cama Elástica ;100354773;282.44;produtos importados;esportes
1240;Patinete Radical Azul ;1002568842;299.90;produtos importados;esportes
1241;Patins Inline Roller Semi Profissional  Roxo Tamanho 34 ao 36  - Mega Compras ;1002731233;279.90;produtos importados;esportes
1242;Barraca 3 Em 1 Princesa - DM Toys DMT5880 ;1002687035;;produtos importados;esportes
1243;Patins Inline - Roller Derby Girl - M - Froes - Verde ;1002717638;284.90;produtos importados;esportes
1244;Patins - Roller Derby - Tracer Girl - Tamanho P - Froes - Verde ;1002717648;284.90;produtos importados;esportes
1245;Skateboard Semi Profissional Abec 5 Kronik ;1002117825;;produtos importados;esportes
1246;Barraca Camping Camuflada Iglu 4 Pessoas 2x2 Metros ;1002674571;252.90;produtos importados;esportes
1247;Fucsia Aro 12 Bicicleta - 10440 ;1002530221;274.81;produtos importados;esportes
1248;Patins Roller Clássico - Quad 4 Rodas Tamanho 38 Unitoys ;1002443091;267.89;produtos importados;esportes
1249;Patins Roller Clássico - Quad 4 Rodas Tamanho 36 Unitoys ;1002443089;267.89;produtos importados;esportes
1250;Barraca Portátil Mickey Disney Toca Infantil + 25 Bolinha ;100498346;269.99;produtos importados;esportes
1251;PATINETE INFANTIL 3 RODAS ALTURA REGULÁVEL BW011 ;1002414268;269.90;produtos importados;esportes
1252;Patinete Radical New Plus Verde 3 Rodas DM Toys ;1002438684;279.90;produtos importados;esportes
1253;Patinete DM Radical Dobrável Rosa DM Toys ;1002438662;259.90;produtos importados;esportes
1254;PATINETE COM 3 RODAS LED ROSA CKS- 01/R ;1002112408;265.00;produtos importados;esportes
1255;CASINHA PRINCESAS - LIDER ;1002726454;259.99;produtos importados;esportes
1256;Hot Wheels Skate Sem Acessórios Carro Hot - Fun Divirta-se ;1002603938;269.99;produtos importados;esportes
1257;Piscina Azul Vollo 1000 L Inflável ;100403163;286.06;produtos importados;esportes
1258;Hot Wheels Skate Sem Acessórios Macaco - Fun Divirta-se ;1002603937;269.99;produtos importados;esportes
1259;Patins Roller + Proteção Completo Infantil Quad Menino Preto ;1002442594;299.99;produtos importados;esportes
1260;Patins Roller Quad Infantil 4 Rodas 30-33 + Kit De Proteção ;1002388742;289.90;produtos importados;esportes
1261;Kit de Haste Completa para Cama Elástica ChicoPlay 8 Unidades ;100354730;266.04;produtos importados;esportes
1262;Barbie Patinete 3 Rodas - Fun Divirta-se ;1002192430;299.99;produtos importados;esportes
1263;Skate Mini Long Cruiser Estampado - Sk8 - Retrô Radical 55cm Bandeira ;1002136135;274.99;produtos importados;esportes
1264;Patinete Infantil 3 Rodas com Ajuste Até 50 KG Unicórnio Fenix ;1002327983;269.99;produtos importados;esportes
1265;Par de Traves com Rede Extreme Goal junior Klopf ;100428978;299.99;produtos importados;esportes
1266;Luva Goleiro Three Stars Fox - Vermelho/Preto/Branco ;1002512207;262.90;produtos importados;esportes
1267;Bicicleta Aro 12 Fire Man Nathor Vermelho e Azul ;1002611794;289.90;produtos importados;esportes
1268;Luva Goleiro Poker Hug Flex 3 Profissional ;1002512000;287.90;produtos importados;esportes
1269;Brinquedo Gravitor - Air Hogs - Mini Drone Infantil - Sunny ;100570588;277.89;produtos importados;esportes
1270;Patinete Infantil 3 Rodas Rosa PPT-02R Ajustável Menina ;1002670260;299.90;produtos importados;esportes
1271;Skate - Hot Wheels - Colorido - Fun ;1002431117;269.99;produtos importados;esportes
1272;Bicicleta Infantil Black Aro12 Freios Tambor Com Rodinhas ;1002460161;262.99;produtos importados;esportes
1273;Patinete Hot Wheels - 3 Rodas - Vermelho e Azul - Fun ;100426044;279.90;produtos importados;esportes
1274;PATINETE DINOSSAURO C/SOM/LUZ E CESTA ;1002359170;;produtos importados;esportes
1275;PATINETE RADICAL POWER AZUL DOBRAVEL ;1002344487;;produtos importados;esportes
1276;PATINETE RADICAL POWER PINK DOBRAVEL ;1002344502;;produtos importados;esportes
1277;Skate - Barbie - Fun - Rosa ;1002441091;269.99;produtos importados;esportes
1278;PATINETE RADICAL POWER VERMELHO DOBRAVE ;1002344497;;produtos importados;esportes
1279;Barbie Skate Sem Acessórios Pace - Fun Divirta-se ;1002603962;269.99;produtos importados;esportes
1280;Patinete Radical NEW PLUS DM TOYS Azul DMR5666 PAZ ;1002484031;259.90;produtos importados;esportes
1281;Bicicleta Aro 12 Black 12 Nathor Verde e Preto ;1002611795;289.90;produtos importados;esportes
1282;Nerf Cesta Basquete com Contador Eletrônico ;1002136486;299.99;produtos importados;esportes
1283;Bola De Basquete Nba Los Angeles Lakers ;1002633647;299.99;produtos importados;esportes
1284;Colete Flutuante Infantil Coleman Cancun Shell ;1002619413;279.90;produtos importados;esportes
1285;Cabaninha barraquinha menino Infantil+Tapete Acolchoao Azul Claro 135X90X90Cm ;1002492778;299.90;produtos importados;esportes
1286;Barraca Infantil Com 50 Bolinhas Hot Wheels - Fun F0007-1 ;1002551920;251.85;produtos importados;esportes
1287;Barraca Castelo Mágico Frozen 2 - Lider 690 ;1002551944;260.74;produtos importados;esportes
1288;Barraca Tenda Toca Festa Pijama +Tapete Acolchoado Cru 135X90X90Cm ;1002492777;299.90;produtos importados;esportes
