;name;SKU;price;department;sector
2001;My Hero Academia - Vol.04 ;1002105955;29.90;produtos importados;livros-e-papelaria
2002;Caneca Jogos Vorazes Katniss Shadow ;100456720;29.90;produtos importados;livros-e-papelaria
2003;GATINHO LEVADO! ;100243617;49.90;produtos importados;livros-e-papelaria
2004;PAPO DE SAPATO ;100240722;37.00;produtos importados;livros-e-papelaria
2005;GATOS GUERREIROS: NA FLORESTA ;100245081;49.90;produtos importados;livros-e-papelaria
2006;BOA NOITE, MARCOS ;100243740;47.90;produtos importados;livros-e-papelaria
2007;NAO CONSIGO DESGRUDAR DA MAMAE ;100243563;18.00;produtos importados;livros-e-papelaria
2008;CHOQUE MALUCO ;100244803;38.00;produtos importados;livros-e-papelaria
2009;Livro Timóteo não quer dormir ;1002707473;48.60;produtos importados;livros-e-papelaria
2010;Livro Tykua E A Origem Da Anunciação ;1002707486;47.40;produtos importados;livros-e-papelaria
2011;Livro Clic ;1002707432;29.20;produtos importados;livros-e-papelaria
2012;Livro Pulo do Coelho, O ;1002707456;48.60;produtos importados;livros-e-papelaria
2013;Livro Por que Heloísa? ;1002707598;48.60;produtos importados;livros-e-papelaria
2014;Livro Um livro para Bart ;1002707573;46.10;produtos importados;livros-e-papelaria
2015;Livro Quando tudo começou ;1002707610;46.20;produtos importados;livros-e-papelaria
2016;Livro Pode Chorar, Coração, Mas Fique Inteiro ;1002707604;48.60;produtos importados;livros-e-papelaria
2017;Livro Pedacinho Do Ceu, Um ;1002700679;47.50;produtos importados;livros-e-papelaria
2018;Livro Um Presente Para Mamãe ;1002700767;;produtos importados;livros-e-papelaria
2019;Livro A Fazenda E A Vida No Campo - Pop ;1002700765;48.60;produtos importados;livros-e-papelaria
2020;Livro Drosófila, a mosquinha famosa ;1002700768;39.00;produtos importados;livros-e-papelaria
2021;Livro No início dos tempos ;1002701069;43.80;produtos importados;livros-e-papelaria
2022;Livro De Manhã ;1002701279;46.20;produtos importados;livros-e-papelaria
2023;Livro Irerê da Silva ;1002701058;47.50;produtos importados;livros-e-papelaria
2024;Livro  Menino é quantos Bichos?, Um ;1002701050;46.40;produtos importados;livros-e-papelaria
2025;Lili aprende a cumprimentar - Livro Boas Maneiras ;1002701482;48.60;produtos importados;livros-e-papelaria
2026;Livro Você está dodói, vovó? ;1002700752;36.60;produtos importados;livros-e-papelaria
2027;Livro Alberta e o pássaro azul ;1002700763;42.50;produtos importados;livros-e-papelaria
2028;Livro Colorir é Divertido! Adorável Lhama ;1002701219;;produtos importados;livros-e-papelaria
2029;Livro Que Bicho Doido! ;1002701189;48.80;produtos importados;livros-e-papelaria
2030;;;;produtos importados;livros-e-papelaria
2031;Livro Pequenos tesouros: O coelhão malvado ;1002700719;48.60;produtos importados;livros-e-papelaria
2032;Livro Viagem Dos Elefantes, A ;1002700658;47.40;produtos importados;livros-e-papelaria
2033;Livro O Fantasma da Ópera ;1002700111;30.30;produtos importados;livros-e-papelaria
2034;Livro O rei Sadim ;1002700119;36.40;produtos importados;livros-e-papelaria
2035;Livro Lui e Mila ;1002700054;42.50;produtos importados;livros-e-papelaria
2036;Livro Miró ;1002700065;12.00;produtos importados;livros-e-papelaria
2037;Livro Amigos do oceano ;1002700144;48.60;produtos importados;livros-e-papelaria
2038;Livro Poesia Na Varanda ;1002700186;34.10;produtos importados;livros-e-papelaria
2039;Livro O corvo e outros contos extraordinários ;1002700143;24.20;produtos importados;livros-e-papelaria
2040;Livro Um Balão No Deserto ;1002700187;36.60;produtos importados;livros-e-papelaria
2041;Livro Cirilo, o dragão que sonhava ser bombeiro ;1002699229;48.80;produtos importados;livros-e-papelaria
2042;Livro Pequenos tesouros: Me faça cócegas ;1002699362;48.60;produtos importados;livros-e-papelaria
2043;Livro Vire e veja: É bom ser legal ;1002699374;48.60;produtos importados;livros-e-papelaria
2044;Livro Mozart ;1002699218;48.60;produtos importados;livros-e-papelaria
2045;Livro La vem Lola! ;1002699242;48.60;produtos importados;livros-e-papelaria
2046;Livro Turma da Mônica Bem-Me-Quer ;1002699301;36.40;produtos importados;livros-e-papelaria
2047;Livro Feito bala perdida ;1002699639;40.80;produtos importados;livros-e-papelaria
2048;Livro Tibúrcio ;1002699628;45.00;produtos importados;livros-e-papelaria
2049;Livro Poche ;1002699372;48.60;produtos importados;livros-e-papelaria
2050;Livro Cozinhando no quintal ;1002699275;48.60;produtos importados;livros-e-papelaria
2051;Livro Toque, Sinta e Aprenda! Grande e Pequeno ;1002699487;42.50;produtos importados;livros-e-papelaria
2052;Livro Turma da Mônica Clássicos Ilustrados para Colorir ;1002699634;14.50;produtos importados;livros-e-papelaria
2053;Livro A Moreninha ;1002699642;44.60;produtos importados;livros-e-papelaria
2054;Livro Amiguinhos ;1002699422;;produtos importados;livros-e-papelaria
2055;Livro Pequenos tesouros: O leão assustado ;1002699253;48.60;produtos importados;livros-e-papelaria
2056;Livro Amigos da selva ;1002699341;;produtos importados;livros-e-papelaria
2057;Livro Homem Que Espalhou O Deserto, O - 12 Ed ;1002698457;47.50;produtos importados;livros-e-papelaria
2058;Livro O Menino Que Queria Virar Vento ;1002698584;42.70;produtos importados;livros-e-papelaria
2059;Livro Fitá ;1002698194;48.60;produtos importados;livros-e-papelaria
2060;Livro Bom Dia, Marcos ;1002698495;46.30;produtos importados;livros-e-papelaria
2061;Livro Esconde-Esconde ;1002698251;40.10;produtos importados;livros-e-papelaria
2062;Livro Mergulho ;1002698163;23.70;produtos importados;livros-e-papelaria
2063;Livro Meninos de verdade ;1002698190;48.10;produtos importados;livros-e-papelaria
2064;;;;produtos importados;livros-e-papelaria
2065;Livro Esconderijo ;1002697706;48.60;produtos importados;livros-e-papelaria
2066;Livro O lago das sanguessugas ;1002697625;34.00;produtos importados;livros-e-papelaria
2067;Livro Karius & Baktus ;1002697580;42.50;produtos importados;livros-e-papelaria
2068;Livro Fofilofa ;1002696012;46.20;produtos importados;livros-e-papelaria
2069;Livro Jerônimo Totes e suas estranhas mascotes ;1002695964;35.30;produtos importados;livros-e-papelaria
2070;Livro 101 Maneiras de amar seus filhos ;1002695951;34.00;produtos importados;livros-e-papelaria
2071;Livro Dadó é ranzinza e tem sua própria nuvem cinza ;1002696294;36.40;produtos importados;livros-e-papelaria
2072;Livro As Fadas De Maria ;1002696167;48.60;produtos importados;livros-e-papelaria
2073;Livro Eugênia e os robôs ;1002696041;29.80;produtos importados;livros-e-papelaria
2074;Livro Mundo Irritante De Norm, O ;1002696459;24.20;produtos importados;livros-e-papelaria
2075;Livro Mundo Injusto De Norm ;1002696221;24.20;produtos importados;livros-e-papelaria
2076;Livro Meus Amigos Do Jardim ;1002696330;24.20;produtos importados;livros-e-papelaria
2077;Livro Larga a chupeta! ;1002695953;48.60;produtos importados;livros-e-papelaria
2078;Livro Meu paninho ;1002696013;48.60;produtos importados;livros-e-papelaria
2079;Livro Mundo Inacreditavel De Norm, O ;1002696469;24.20;produtos importados;livros-e-papelaria
2080;Livro A origem dos bichos ;1002696010;46.20;produtos importados;livros-e-papelaria
2081;Livro Misture e combine: Ajudando ;1002678607;36.40;produtos importados;livros-e-papelaria
2082;Estojo Necessaire Paetê Muda Cor - Clio ;1002662057;41.88;produtos importados;livros-e-papelaria
2083;Perfurador Manual De Papel Furo Duplo Preto Até 10 Folhas ;1002666193;15.99;produtos importados;livros-e-papelaria
2084;Necessaire Sonic Hoodie ;1002117938;;produtos importados;livros-e-papelaria
2085;Bloco Adesivo Tipo Postit Menina Fofo Panda Unicórnio Coruja ;1002666248;19.67;produtos importados;livros-e-papelaria
2086;Avental Infantil Alice Floral Dream 903B16 Pacific ;1002387079;18.99;produtos importados;livros-e-papelaria
2087;Chaveiro De Metal Mônica: Turma da Mônica ;1002517002;;produtos importados;livros-e-papelaria
2088;Cesto De Coelho Com Pernas Mole Muito Fofo De 17x14cm Rosa ;1002659608;;produtos importados;livros-e-papelaria
2089;LAPIS GRAFITE H CAIXA COM 3 PEÇAS - TRIDENT ;1002326286;;produtos importados;livros-e-papelaria
2090;MARCA TEXTO AMARELO PASTEL SWING COOL - STABILO ;1002245503;;produtos importados;livros-e-papelaria
2091;Brinquedo Bichinhos Atividades Animal Fun Sortido Buba 13145 ;1002329311;49.90;produtos importados;livros-e-papelaria
2092;MARCA TEXTO LARANJA PASTEL SWING COOL - STABILO ;1002300007;;produtos importados;livros-e-papelaria
2093;Achou - Livro Infantil ;1002328131;44.90;produtos importados;livros-e-papelaria
2094;Muitas Coisas para Procurar nos Alimentos - Livro Infantil ;1002328109;49.90;produtos importados;livros-e-papelaria
2095;QUADRO FOGUETE LOUSA MÁGICA  COM CANETA  ZOOP TOYS ;1002311615;;produtos importados;livros-e-papelaria
2096;Desenhando animais - Livro Infantil ;1002328036;37.90;produtos importados;livros-e-papelaria
2097;CANETA ESFEROGRAFICA APAGAVEL BALL FRIXION PONTA 0.7 MM FINA VERMELHA - PILOT ;100560644;;produtos importados;livros-e-papelaria
2098;Lapiseira Preto Pilot 0.5 mm SUPER GRIP SL ;100560785;;produtos importados;livros-e-papelaria
2099;CADERNO ESPIRAL HARRY POTTER 1X1 SORTIDO - JANDAIA ;100564203;;produtos importados;livros-e-papelaria
2100;BLOCO TILIFLEX CAPRICHO - TILIBRA ;100523705;;produtos importados;livros-e-papelaria
2101;Lapiseira Vermelho Pilot 0.7 mm SUPER GRIP H187SL ;100560782;;produtos importados;livros-e-papelaria
2102;Super Alkaline GP AAA 1.5V Blister 2 Unidades ;100506495;7.94;produtos importados;livros-e-papelaria
2103;MARCA TEXTO MINI JOCAR OFFICE CORES SORTIDAS - LEONORA ;100523683;;produtos importados;livros-e-papelaria
2104;Jogo de Silicone Poc Pop Octógono Sortidos Amarelo ;100508086;44.90;produtos importados;livros-e-papelaria
2105;Livro Carregue-me Para Ler E Colorior 32 Paginas Patrulha Canina ;1002423478;9.99;produtos importados;livros-e-papelaria
2106;Lousa Magica Infantil Com Caneta E Carimbo Brinquedo Quadro Azul ;1002305953;35.99;produtos importados;livros-e-papelaria
2107;Marca texto 6 cores modelo morango  Emborrachado, lindo demais! ;1002412460;35.99;produtos importados;livros-e-papelaria
2108;Livro de Diversão O Show da Luna 4 em 1 - Ciranda Cultural ;1002100790;17.99;produtos importados;livros-e-papelaria
2109;Kit 5 Mini Canetas Marca Texto Colorido De Ursos Cores Candy ;1002392070;30.99;produtos importados;livros-e-papelaria
2110;Turma da Mônica Livro 400 Atividades e Desenhos para Colorir ;100395537;14.99;produtos importados;livros-e-papelaria
2111;Livro Ilustrado One Piece Edição De Colecionador Com Fotos ;1002123176;35.99;produtos importados;livros-e-papelaria
2112;Bíblia Infantil Letras Grandes - Todolivro ;1002163727;;produtos importados;livros-e-papelaria
2113;Penadinho: Lar (Graphic MSP) Capa Cartão ;1002686789;20.94;produtos importados;livros-e-papelaria
2114;Capitao América: A Morte Do Sonho ;1002670754;49.95;produtos importados;livros-e-papelaria
2115;Mônica: Força (Graphic MSP) - Capa Dura ;1002686699;26.94;produtos importados;livros-e-papelaria
2116;Livro Carregue-me Para Ler E Colorior 32 Paginas Dinossauros ;1002423477;9.99;produtos importados;livros-e-papelaria
2117;Zé Carioca E Panchito: Silly Simphonies 1942-1945 ;1002686902;49.45;produtos importados;livros-e-papelaria
2118;Marvel Comics 1000 ;1002686679;27.45;produtos importados;livros-e-papelaria
2119;Molde Eu Estilista - Roupa De Boneca Pra Barbie - Faça Você ;1002431268;44.99;produtos importados;livros-e-papelaria
2120;Uma Misteriosa Melodia, Ou Como Mickey Conheceu Minnie ;1002686900;38.45;produtos importados;livros-e-papelaria
2121;Álbum Baby Mickey e Minnie 80 Fotos 10x15 - Etipel ;100440706;11.88;produtos importados;livros-e-papelaria
2122;Kit com 2 Escovas de Limpeza Para Canudos Infantil Giro Baby ;1002519870;18.90;produtos importados;livros-e-papelaria
2123;Livro Carregue-me Para Ler E Colorior 32 Paginas Princesas ;1002423474;9.99;produtos importados;livros-e-papelaria
2124;De Quem é a Coroa? Phellip Willian - Thomas Nelson ;1002693019;43.30;produtos importados;livros-e-papelaria
2125;Livro De Atividades E Desenhos Com Lápis Cor - Moana Disney ;1002108624;14.99;produtos importados;livros-e-papelaria
2126;Piteco: Fogo (Graphic MSP) - Capa Dura ;1002719332;29.19;produtos importados;livros-e-papelaria
2127;O Homem que Amava Caixas - Livro Infantil ;1002363998;49.90;produtos importados;livros-e-papelaria
2128;Fidget Toy Flofys Bola Zoiudo com Luz DMT6284 ;1002718587;39.99;produtos importados;livros-e-papelaria
2129;X-Men (2020) Vol. 14 ;1002686876;16.19;produtos importados;livros-e-papelaria
2130;O Espetacular Homem-Aranha (2019) Vol. 24 ;1002686719;13.59;produtos importados;livros-e-papelaria
2131;Star Wars: A Ascensão De Kylo Ren ;1002686812;13.59;produtos importados;livros-e-papelaria
2132;O Espetacular Homem-Aranha (2019) Vol. 26 ;1002686722;13.59;produtos importados;livros-e-papelaria
2133;As Mais Belas Histórias da Bíblia para Crianças - Moisés e José, O Sonhador ;1002316527;14.90;produtos importados;livros-e-papelaria
2134;As Mais Belas Histórias da Bíblia para Crianças - A Arca de Noé e Torre de Babel ;1002316528;14.90;produtos importados;livros-e-papelaria
2135;Livro De Atividades E Desenhos Com Lápis Cor - Dinossauros ;1002108635;14.99;produtos importados;livros-e-papelaria
2136;Livro Dinossauro Com Aquarelacom 10 Cores + Pincel 16 Pg ;1002311280;15.99;produtos importados;livros-e-papelaria
2137;Revista - Planet Manga - Noragami - Edição 16 - Panini ;1002308159;14.90;produtos importados;livros-e-papelaria
2138;2 Canetas Batom Escrita Gel Fine 0,4 Preto C Aguá E Estrelas ;1002117226;20.99;produtos importados;livros-e-papelaria
2139;Dragon Ball Vol. 16 - Edição Definitiva (Capa Dura) ;1002719355;45.43;produtos importados;livros-e-papelaria
2140;Mochila Westpack Paris - 30x14x41,5 - Colorizi ;1002621621;32.80;produtos importados;livros-e-papelaria
2141;Conjunto de Carimbos PJ Masks 3 Unidades - DTC ;1002168784;35.88;produtos importados;livros-e-papelaria
2142;Bolsa de Transporte para Raquete de Beach Tennis ;1002311705;49.90;produtos importados;livros-e-papelaria
2143;Revista - Planet Manga - Noragami - Edição 13 - Panini ;1002307985;14.90;produtos importados;livros-e-papelaria
2144;Revista - Planet Manga - Noragami - Edição 18 - Panini ;1002308338;14.90;produtos importados;livros-e-papelaria
2145;Planner Ranking Controle Playstation ;100340926;34.50;produtos importados;livros-e-papelaria
2146;Dragon Ball Super Vol. 16 ;1002670790;20.93;produtos importados;livros-e-papelaria
2147;;;;produtos importados;livros-e-papelaria
2148;Floresta Encantada Revista em Quadrinhos Unicórnios ;100463658;3.99;produtos importados;livros-e-papelaria
2149;Almofada 40x40 Coala - Zonacriativa ;1002579376;45.90;produtos importados;livros-e-papelaria
2150;Mulher-Maravilha (2017) Vol. 1 / 51 (Capa Variante) ;1002686712;20.93;produtos importados;livros-e-papelaria
2151;Naruto - A História Secreta De Konoha: Um Dia Perfeito Para Se Casar ;1002686690;27.93;produtos importados;livros-e-papelaria
2152;;;;produtos importados;livros-e-papelaria
2153;Livro Sonoro, O Nascimento de Jesus - Ciranda Cultural ;1002701589;43.70;produtos importados;livros-e-papelaria
2154;Turma Da Mônica Jovem (2021) - 12 ;1002719390;17.93;produtos importados;livros-e-papelaria
2155;Histórias Bíblicas - Com Adesivo e Atividades ;1002629190;14.50;produtos importados;livros-e-papelaria
2156;O nome das coisas: Compras na feira ( Felipe Denardi ) ;1002619708;16.97;produtos importados;livros-e-papelaria
2157;Stranger Things Vol.02 ;1002719391;39.68;produtos importados;livros-e-papelaria
2158;Detetives Do Prédio Azul Magazine Vol. 1 ;1002719292;11.18;produtos importados;livros-e-papelaria
2159;Kit Figurinhas Copa do Mundo 2022 PCT.C/10 Envelopes - Panini ;1002466151;;produtos importados;livros-e-papelaria
2160;Turma da Mônica Que Horas São? - Ciranda Cultural ;1002100877;7.99;produtos importados;livros-e-papelaria
2161;Naruto Gold Vol. 9 ;1002474437;23.73;produtos importados;livros-e-papelaria
2162;Disney Maleta Cinema O Mundo De Pixar - DCL ;100421049;10.33;produtos importados;livros-e-papelaria
2163;Naruto Gold Vol. 35 ;1002474230;20.93;produtos importados;livros-e-papelaria
2164;Dragon Ball Super Vol. 5 ;1002474257;24.43;produtos importados;livros-e-papelaria
2165;Naruto Gold Vol. 38 ;1002474446;20.93;produtos importados;livros-e-papelaria
2166;Dragon Ball Super Vol. 6 ;1002474197;24.43;produtos importados;livros-e-papelaria
2167;Naruto Gold Vol. 7 ;1002474226;23.73;produtos importados;livros-e-papelaria
2168;Naruto Gold Vol. 8 ;1002474451;23.73;produtos importados;livros-e-papelaria
2169;Faixa Decorativa Parabéns Tema Festa PJ Masks ;1002695156;19.99;produtos importados;livros-e-papelaria
2170;6 Máscaras Papel Festa Tema Homem De Ferro ;1002720422;17.99;produtos importados;livros-e-papelaria
2171;Pop It Fura Bolhas Divertido Triângulo Arco-Íris ;1002308808;24.90;produtos importados;livros-e-papelaria
2172;Bolas Adesivas Neon Grudi Balls Multikids - BR1550X [Reembalado] ;1002565335;15.48;produtos importados;livros-e-papelaria
2173;Estojo Infantil Escolar Duplo - Maria Clara e JP - Clio Style ;1002658495;49.99;produtos importados;livros-e-papelaria
2174;Faixa Decorativa Parabéns Tema Festa Cinderela ;1002695178;19.99;produtos importados;livros-e-papelaria
2175;8 Caixas Surpresa Decoração Festa Luccas Neto 2 Lembrancinha ;1002680124;22.99;produtos importados;livros-e-papelaria
2176;O nome das coisas: Hora do banho ( Felipe Denardi ) ;1002619729;18.64;produtos importados;livros-e-papelaria
2177;Fisher-Price - Procurar e encontrar - Animais divertidos ;1002618080;16.92;produtos importados;livros-e-papelaria
2178;Mochila Bag Com Zíper Frontal Azul - Flatex ;1002429470;15.39;produtos importados;livros-e-papelaria
2179;8 Caixas Surpresa Decoração Festa PJ Masks Lembrancinha ;1002680123;22.99;produtos importados;livros-e-papelaria
2180;Faixa Parabéns Minnie Rosa Festa De Aniversário ;1002651861;21.99;produtos importados;livros-e-papelaria
2181;Dinossauros Aquabook ;100463668;19.90;produtos importados;livros-e-papelaria
2182;Painel Decoração Parede Safari 110cm x 116cm Festa Aniversário ;1002651856;40.99;produtos importados;livros-e-papelaria
2183;Chaveiro Olaf - Taimes ;100467389;11.88;produtos importados;livros-e-papelaria
2184;Chaveiro de PVC Frozen Elsa - ETITOYS ;100367964;9.48;produtos importados;livros-e-papelaria
2185;Quadro Mickey Tipografia - Disney ;100224251;27.90;produtos importados;livros-e-papelaria
2186;Caixa Surpresa Mundo Bita Para Lembrancinha Festa Aniversário 8 Unidades ;1002630373;20.99;produtos importados;livros-e-papelaria
2187;Cinto de Mala com Código Avengers - ETITOYS ;100369962;17.88;produtos importados;livros-e-papelaria
2188;Livro de Atividades - Super Color Pack - Animais da Fazenda - Catavento ;1002566362;34.90;produtos importados;livros-e-papelaria
2189;Quadro Homem de Ferro Ação - Marvel ;100224199;20.90;produtos importados;livros-e-papelaria
2190;Conjunto 12 Giz De Cera 12 Cores Magix Kids Infantil ;1002674666;6.90;produtos importados;livros-e-papelaria
2191;Kit Mesversário Lai Ballet Go Happy ;100265541;49.90;produtos importados;livros-e-papelaria
2192;Barbie de A a Z Meu Primeiro Dicionário - Ciranda Cultural ;100401108;15.48;produtos importados;livros-e-papelaria
2193;Almofada Arlequina Injustice DC Comics ;100216971;25.90;produtos importados;livros-e-papelaria
2194;Estojo Escolar Moana Dermiwil Soft ;100254126;35.99;produtos importados;livros-e-papelaria
2195;30 Adesivos Decorativo Familia Caipira Festa Junina/Julina ;1002695306;6.99;produtos importados;livros-e-papelaria
2196;Almofada Injustice Batman - DC Comics ;100216889;25.90;produtos importados;livros-e-papelaria
2197;Patrulha Canina Filhotes Salvam A Colheita -Ciranda Cultural ;100323608;12.90;produtos importados;livros-e-papelaria
2198;Memórias da Emília ( Monteiro Lobato ) ;1002618892;16.92;produtos importados;livros-e-papelaria
2199;Histórias fantásticas - Rapunzel ( Ciranda Cultural ) ;1002618836;8.42;produtos importados;livros-e-papelaria
2200;Kit Escolar Lápis De Cor 12 Cores Em Resina Plástica Com 4 Lápis Grafite ;1002671126;13.90;produtos importados;livros-e-papelaria
2201;Lança Confete Chá Revelação Rosa 30cm ;1002670953;23.90;produtos importados;livros-e-papelaria
2202;Livro Histórias para Crianças: 1 Ano ;1002699502;48.60;produtos importados;livros-e-papelaria
2203;Mochila Tribal Sortida - Clio Style ;100467439;;produtos importados;livros-e-papelaria
2204;Carimbos Frutas Brinquedos Educativos - NIG ;1002702000;32.29;produtos importados;livros-e-papelaria
2205;Kit Balão Mania - Todolivro ;100465300;17.88;produtos importados;livros-e-papelaria
2206;Livro Faça e Brinque: Navio Pirata ;1002699516;48.70;produtos importados;livros-e-papelaria
2207;Porta Joia Faça Por Você - Zonacriativa ;100215590;31.90;produtos importados;livros-e-papelaria
2208;Frozen - Rompendo Limites ;1002150905;44.90;produtos importados;livros-e-papelaria
2209;Livro Quem É Deus? ;1002707552;50.00;produtos importados;livros-e-papelaria
2210;Bolsa Mochila Escolar Rosa com Poá Feminina ;1002671096;44.90;produtos importados;livros-e-papelaria
2211;Livro Turma da Mônica Clássicos Ilustrados para Colorir ;1002701291;14.50;produtos importados;livros-e-papelaria
2212;Livro Decifra- te! e as pessoas: a psicanálise dos contos de fadas auxiliando crianças de todas as idades ;1002701421;48.60;produtos importados;livros-e-papelaria
2213;Galinha Pintadinha - O som dos animais ( Ciranda Cultural ) ;1002618823;25.42;produtos importados;livros-e-papelaria
2214;Livro Histórias para Crianças: 3 Anos ;1002699528;48.60;produtos importados;livros-e-papelaria
2215;Livro de Pano Culturama - Bichinhos do Mar ;1002698085;30.30;produtos importados;livros-e-papelaria
2216;Livro Siga a trilha cintilante! Unicórnio perdido, O ;1002699568;;produtos importados;livros-e-papelaria
2217;Livro Pequenos tesouros: Lar é onde o coração está ;1002701234;48.60;produtos importados;livros-e-papelaria
2218;Livro Sorriso no Rosto ;1002701474;19.40;produtos importados;livros-e-papelaria
2219;Livro Esconde-esconde: Espaço ;1002701335;48.60;produtos importados;livros-e-papelaria
2220;Livro Inventando números ;1002698360;36.40;produtos importados;livros-e-papelaria
2221;Livro Turma da Mônica Clássicos Ilustrados para Colorir ;1002701565;14.50;produtos importados;livros-e-papelaria
2222;Livro Dinossauros : Colorir&apagar ;1002697480;24.20;produtos importados;livros-e-papelaria
2223;Livro Cinderela ;1002699328;36.40;produtos importados;livros-e-papelaria
2224;Livro Toque e Sinta as Texturas: GRRR-GRRR! ;1002699544;42.50;produtos importados;livros-e-papelaria
2225;;;;produtos importados;livros-e-papelaria
2226;Caçadas de Pedrinho ( Monteiro Lobato ) ;1002618879;16.92;produtos importados;livros-e-papelaria
2227;Caneca Super Mario com Boneco Yoshi - Ifcat ;100469744;29.88;produtos importados;livros-e-papelaria
2228;Montessori Meu Primeiro Livro de Atividades... Coordenação M ;1002617925;31.41;produtos importados;livros-e-papelaria
2229;Minhas primeira 1000 palavras em inglês ( Cristina Klein ) ;1002619055;26.91;produtos importados;livros-e-papelaria
2230;Júlio Verne: Vinte mil léguas submarinas ( Roberto Belli ) ;1002619375;8.91;produtos importados;livros-e-papelaria
2231;Atlas do Corpo Humano - Escolar ( Roberto Belli ) ;1002619125;7.11;produtos importados;livros-e-papelaria
2232;Smilinguido e sua Turma em Quadrinhos VOL 6 ;100577863;4.00;produtos importados;livros-e-papelaria
2233;Lápis de cor grande com 24 unidades - Nobre ;1002606376;11.50;produtos importados;livros-e-papelaria
2234;Almofada 40x40 Capitão América Ação - Marvel ;100224144;39.90;produtos importados;livros-e-papelaria
2235;Almofada 40x40 Hulk Ação - Marvel ;100224131;39.90;produtos importados;livros-e-papelaria
2236;Almofada 40x40 Thor Ragnarok -  Marvel ;100224135;39.90;produtos importados;livros-e-papelaria
2237;Bíblia Ilustrada Infantil ;100291537;39.40;produtos importados;livros-e-papelaria
2238;Bolsa Com Zíper Anna Elsa & Olaf Frozen Tsum Tsum: Frozen ;1002563557;;produtos importados;livros-e-papelaria
2239;Chaveiro de Metal DC Batman - Tasco ;100467641;17.88;produtos importados;livros-e-papelaria
2240;Bola com Cordão Mola - Carinhas Coloridas Sortidas Bola Emoji ;1002678310;9.99;produtos importados;livros-e-papelaria
2241;Bíblia Devocional da Princesinha ;100264238;43.70;produtos importados;livros-e-papelaria
2242;Difusor Aromatizante Premium Floresta verde Verde ;1002717680;;produtos importados;livros-e-papelaria
2243;Bíblia Sonho de Princesa ;100260246;41.50;produtos importados;livros-e-papelaria
2244;Almofada Demolidor - Marvel ;100216880;39.90;produtos importados;livros-e-papelaria
2245;Bolsinha Infantil Box - Translucida - Clio Pets - Onça - Clio Style ;1002658532;49.99;produtos importados;livros-e-papelaria
2246;Lápis Risque e Apague Colorido Brincadeira no Banho +3 BUBA ;1002649826;22.90;produtos importados;livros-e-papelaria
2247;Peppa pig - revista de atividades - com colar ;1002661653;19.98;produtos importados;livros-e-papelaria
2248;Lancheira Infantil 5 Peças Plastico Coelha Verde - Facility ;1002663813;49.90;produtos importados;livros-e-papelaria
2249;Livro Infantil Colorir Barbie Meu Blocão 48pgs - Ciranda Cultural ;1002667404;20.50;produtos importados;livros-e-papelaria
2250;Caneca Hulk com Boneco - Ifcat ;100469734;29.88;produtos importados;livros-e-papelaria
2251;LOUSA MAGNETICA DUPLA FACE EM ALUMINIO PREMIUM MURAL RECADOS ANOTAÇÕES QUADRO INFANTIL ESTUDO COM KIT 35X50CM ;1002609599;;produtos importados;livros-e-papelaria
2252;Acessórios para Festa - Convites de Chá Revelação - 8 Un - Cromus ;100155795;9.99;produtos importados;livros-e-papelaria
2253;Caneta Unicórnio Ponta Fina Cor Sortida ;1002613257;;produtos importados;livros-e-papelaria
2254;LIVRO INFANTIL COLORIR AQUABOOK TURMINHA DO BOBBY ;1002363402;;produtos importados;livros-e-papelaria
