;name;SKU;price;department;sector
0;Acessórios de Praia - Sandtastic - Pixar - Carros - Disney ;100180467;24.99;produtos importados;esportes
1;Pula Corda - Azul - FanFun ;100156525;17.99;produtos importados;esportes
2;Bola de Futebol - Cores Sortidas - DTC ;100175577;49.90;produtos importados;esportes
3;Bote Inflável - Princesas Disney - Disney ;100041222;19.99;produtos importados;esportes
4;Teimoso do Solzinho ;100001335;15.99;produtos importados;esportes
5;Bola de Futebol de campo quadra  PSG modelo Mundial 20 Licenciada  Azul Vermelho 03 ;1002455715;49.99;produtos importados;esportes
6;Acessórios de Praia e Piscina - Bóias de Braço - Fundo do Mar - Intex ;100155769;10.99;produtos importados;esportes
7;Baby Bote do Solzinho ;100001333;9.99;produtos importados;esportes
8;Acessórios de Praia e Piscina - Boia com Cabeça - Baby Zoo - Zebra - New Toys ;1002641211;29.99;produtos importados;esportes
9;KIT DE PROTEÇÃO INFANTIL JOELHEIRA + COTOVELEIRA ROSA ETITOYS ;1002726291;;produtos importados;esportes
10;Acessórios de Praia e Piscina - Bóia Redonda - 114 Cm - Rosquinha Donut - Chocolate - Intex ;100155766;29.99;produtos importados;esportes
11;Acessórios de Praia e Piscina - Bóia Redonda - 61 Cm - Praia - Intex ;100291080;9.99;produtos importados;esportes
12;Boia - Intex - Transparente - Estampa de Dinossauros ;1002583630;9.99;produtos importados;esportes
13;Bote Inflável Infantil - Peixinho - Intex - New Toys ;100467398;29.99;produtos importados;esportes
14;Acessórios de Praia e Piscina - Boia com Cabeça - Baby Zoo - Pinguim - New Toys ;100180009;29.99;produtos importados;esportes
15;Kit Completo Ping Pong Tênis De Mesa Raquete Bolinha e Rede ;1002674613;44.90;produtos importados;esportes
16;BALDINHO PRAIA INFANTIL KIT CARRINHO COM PUXADOR ACESSORIOS PAZINHA BRINQUEDO BEBE MENINO MENINA COMPLETO Menino ;1002642042;21.90;produtos importados;esportes
17;Jogo Vai e Vem Princesas Disney ;1002702842;39.99;produtos importados;esportes
18;Capacete de Proteção Ajustável - Bike - Tamanho M - Bel Fix - Cores Sortidas ;100415385;49.99;produtos importados;esportes
19;Piscina Infantil Inflável Colorida 66 Litros Para Criança Brizi ;1002412332;44.90;produtos importados;esportes
20;Conjunto para Praia - Monte Líbano ;1002410292;45.99;produtos importados;esportes
21;;;;produtos importados;esportes
22;Óculos de Natação - Silicone - Preto - Bel Fix ;100557404;19.90;produtos importados;esportes
23;Kit  Ping Pong Tênis De Mesa Raquete e Bolinha ;1002674605;33.90;produtos importados;esportes
24;Bomba De Ar P/ Inflar Colchões, Piscinas Infláveis 30cm Bestway ;100428913;29.99;produtos importados;esportes
25;Boia Infantil Circular - Elefantes - Intex ;1002602249;7.99;produtos importados;esportes
26;Conjunto com 6 Bolinhas - Tênis de Mesa - Bel Fix ;100139080;24.99;produtos importados;esportes
27;Bambolê Kit com 12 ;100345695;36.00;produtos importados;esportes
28;BOLA DE BASQUETE CONVOY PESO TAMANHO OFICIAL NUMERO 7 YS37011 ESPORTIVA ;1002670490;31.90;produtos importados;esportes
29;BOLA INFANTIL VOLEI TOTAL SOFT EVA (CORES SORTIDAS 1 UND ;1002437186;;produtos importados;esportes
30;Mini Helicóptero com Sensor Smile Recarregável Art Brink ;1002560088;49.90;produtos importados;esportes
31;BOIA PISCINA BEBE INFLAVEL TUBARAO FRALDINHA BEBE COM ASSENTO VERAO INFANTIL ;1002631850;26.99;produtos importados;esportes
32;Kit de Proteção Girl Power Multikids - BR1632X [Reembalado] ;1002565113;38.81;produtos importados;esportes
33;Óculos De Natação Infantil - Lil Wave  - Rosa - Bestway - New Toys ;100427294;19.90;produtos importados;esportes
34;Máscara de Mergulho Juvenil - Azul - Bestway - New Toys ;100427304;49.90;produtos importados;esportes
35;Brinquedo Corda Estica Stretch Divertida - DmToys 6220 ;1002692354;18.52;produtos importados;esportes
36;Boia Circular -  Minnie - Bel Fix - Boia de Cintura - 56 cm - Rosa ;100539624;28.90;produtos importados;esportes
37;Óculos de Natação - DC Comics - Liga da Justiça - Mulher Maravilha - Vermelho - Bel Fix ;100557369;44.90;produtos importados;esportes
38;Bola de Basquete Esporte - Wellmix ;100416476;35.88;produtos importados;esportes
39;Boia Inflável Infantil Zoo Grande Intex 58221 ;1002504744;29.99;produtos importados;esportes
40;BOLA DE VINIL TOYS BOLINHAS N.4 MINI ;1002359115;;produtos importados;esportes
41;Bóia Infantil Circular - Amarela - Intek ;100130743;13.99;produtos importados;esportes
42;Bóia Infantil Circular - Laranja - Intek ;100114871;13.99;produtos importados;esportes
43;Kit Praia Infantil Completo - 6 Peças - Patati Patatá - Rosita ;1002627584;39.99;produtos importados;esportes
44;BALDINHO PRAIA INFANTIL KIT REGADOR BRINQUEDO AREIA COM PA E ACESSORIOS MENINA MENINO Menina ;1002538058;14.90;produtos importados;esportes
45;Bola de Futebol Mundi Tamanho 5 210g Atrio - ES393 ;100523689;39.90;produtos importados;esportes
46;Mascara Divertida para Natação Tubarão - Intex ;1002603887;46.99;produtos importados;esportes
47;Bola Iniciação de Borracha Magussy Tamanho 10 ;1002646304;44.90;produtos importados;esportes
48;Teimoso 3D Monstro - Brizi ;100415399;47.88;produtos importados;esportes
49;Boia Circular Decorada 82 Cm + 06 Anos Estampadas Sortido ;1002136111;45.99;produtos importados;esportes
50;Oculos De Mergulho Pato Patinho Infantil Amarelo Com Fecho ;100414733;49.99;produtos importados;esportes
51;Óculos de Natação Sport - Verde ;100515040;;produtos importados;esportes
52;Saco de Bolinhas Coloridas c/ 50 unidades ;1002678313;29.99;produtos importados;esportes
53;Corda Madeira,Nylon 1095 Carlu 2 m ;1002384724;39.90;produtos importados;esportes
54;Bóia Inflável Amarela Oceano - Praia e Piscina 61cm - Intex ;1002135931;29.90;produtos importados;esportes
55;Óculos Infantil De Natação Peixinhos - Piscina e Praia Intex ;1002100051;37.90;produtos importados;esportes
56;Piscina Infantil Inflável 2 Anéis 28 Litros Fundo Do Mar ;100414924;34.99;produtos importados;esportes
57;Oculos De Mergulho Crocodilo Infantil Verde Com Fecho ;100437843;49.99;produtos importados;esportes
58;Colete Inflável Do Homem Aranha Marvel Ultimate - 3-6 Anos ;100414853;49.99;produtos importados;esportes
59;Oculos De Mergulho Doo Doo Shark Infantil Tubarão Azul ;100414735;49.99;produtos importados;esportes
60;Oculos De Mergulho Golfinho Infantil Azul Celeste Com Fecho ;100414691;49.99;produtos importados;esportes
61;COLETE INFLAVEL INFANTIL CRIANÇA PISCINA PRAIA BOIA SALVA VIDAS MENINO MENINA Amarelo ;1002493172;;produtos importados;esportes
62;Touca de Natação Poliamida - Azul ;100515036;;produtos importados;esportes
63;Kit Ping Pong Junges Tenis de Mesa ;1002611599;49.99;produtos importados;esportes
64;Balde Areia Praia Castelo Com Alça + 5 Acessórios Sortidos ;100437780;39.99;produtos importados;esportes
65;Colete Inflável Infantil Summer Fun - Wellmix ;100370154;23.88;produtos importados;esportes
66;Brinquedo Para Areia 2 Peças Bene Casa Unica ;1002572103;;produtos importados;esportes
67;Colete Inflável Infantil Summer Fun - Wellmix ;100370152;23.88;produtos importados;esportes
68;Mini Cesta Basquete Infantil + Bola E Suporte P/ Porta ;1002449262;37.90;produtos importados;esportes
69;Boia Infantil Inflável de Braço - Flutuador Alaranjado Intex ;1002135927;19.89;produtos importados;esportes
70;Colete Boia Inflável Estampado - Art Summer ;1002163944;29.88;produtos importados;esportes
71;Colete Boia Inflável Estampado - Art Summer ;1002163946;29.88;produtos importados;esportes
72;BANHEIRA PISCINA INFLAVEL INFANTIL 28 LITROS BALEIA REDONDA 60X15 - MOR ;100560725;;produtos importados;esportes
73;Piscina Infantil Minha primeira Banheira Inflável Polvo 17 L ;100565740;47.90;produtos importados;esportes
74;Óculos De Natação Infantil Sport Menino Mor - 1897 ;100571917;19.70;produtos importados;esportes
75;Boia Lhama Circular Colorido Intex ;100564109;42.90;produtos importados;esportes
76;Boia Assento Inflável - 64x43cm - WellKids ;1002511081;21.16;produtos importados;esportes
77;Luva Esportiva - Punch - Gel e Neoprene - Preta e Vermelha - Tamanho PP ;1002155229;49.90;produtos importados;esportes
78;Óculos De Natação Antiembaçante Profissional Azul Mor - 1898 ;100564419;45.44;produtos importados;esportes
79;João Bobo Inflável Boneco Teimoso 3d - Intex ;1002520173;44.99;produtos importados;esportes
80;Touca de natação infantil de silicone para criança nadar piscina  tigre Hidro ;100439712;38.99;produtos importados;esportes
81;Conjunto de Ping Pong - Xalingo ;100559177;30.99;produtos importados;esportes
82;Bóia Inflável Esmeralda Grande Com Alça 76 cm - Intex ;100428706;29.99;produtos importados;esportes
83;Bola de Futebol de Campo Couro Sintético Tamanho Oficial ;1002700013;;produtos importados;esportes
84;Boia de Braço 29x15 Toy Story - ETITOYS ;100367986;17.88;produtos importados;esportes
85;Colete Inflável Infantil Summer Fun - Wellmix ;100370177;23.88;produtos importados;esportes
86;Óculos De Natação Infantil - Lil Wave  - Azul - Bestway - New Toys ;100427310;19.90;produtos importados;esportes
87;Aqua Escudo - Bel Lazer ;1002716422;19.26;produtos importados;esportes
88;Boia de Braço Infantil Intex  Peixinho 3-6 Anos - 23x15 Cm ;100293772;19.70;produtos importados;esportes
89;Piscina Inflável Peixinhos 21 Litros - Dm Toys ;1002108954;29.99;produtos importados;esportes
90;Macarrão Inflável com Glitter - 180cm até 40kg - Intex 57509 ;100355277;49.89;produtos importados;esportes
91;Boia Infantil Pinguim - Intex 64cmx64cm ;100277331;24.99;produtos importados;esportes
92;Brinquedo Infantil Balde com Pás Meninas - Tateti 3009 ;100293753;49.40;produtos importados;esportes
93;Óculos de Natação - DC Comics - Liga da Justiça - Aquaman - Verde - Bel Fix ;100557368;44.90;produtos importados;esportes
94;Baby Bote Kiddie Boia Inflável Policia Bombeiro Avião Intex ;100428845;39.99;produtos importados;esportes
95;Kit de Boxe Infantil 3 peças - Wellmix ;1002546227;41.02;produtos importados;esportes
96;Bola Futebol Campo Tamanho Oficial Tam 5 Bola Couro Sintético ;1002678311;29.99;produtos importados;esportes
97;Frescobol de Madeira Revestida Aloha - Azul ;100514969;30.60;produtos importados;esportes
98;Acessórios de Praia e Piscina - Boia Redonda - Florida - Laranja - Bestway ;100179025;14.99;produtos importados;esportes
99;Mini Bola De Futebol Couro Sintético Tamanho 1 Amarelo ;1002401714;19.90;produtos importados;esportes
100;Bola Inflável Princesas ;100514899;14.45;produtos importados;esportes
101;Máscara de Mergulho e Snorkel Infantil - Azul ;100515079;28.90;produtos importados;esportes
102;Baldinho de Praia Aventuras no Castelo Radical Rei do Balde - CORES SORTIDAS ;1002175167;49.99;produtos importados;esportes
103;Jogo Gol a Gol Fácil - Braskit ;100524786;35.79;produtos importados;esportes
104;Kit Baldinho De Praia + Regador + Forminhas + Pá, Rastelo ;1002628737;34.99;produtos importados;esportes
105;BRINQUEDO Popit QUADRADO POP it Autismo Antistress fidget ;100531498;21.00;produtos importados;esportes
106;;;;produtos importados;esportes
107;Flutuador 1,60 x 0,60 cm - Amarelo ;100564214;6.80;produtos importados;esportes
108;Boia de Braço Infantil Homem Aranha Bestway Mor ;1002641715;27.00;produtos importados;esportes
109;Boia Circular Infantil Princesas da Disney Branca de Neve ;1002690788;40.90;produtos importados;esportes
110;Water Balloon Acessório Para Encher Balões de Água - Braskit ;100366758;35.88;produtos importados;esportes
111;Poltrona Inflável 70cm Frozen - ETITOYS ;100367950;35.88;produtos importados;esportes
112;Óculos Natação Basic ;100515237;15.30;produtos importados;esportes
113;Kit Oculos Natacao Infantil Mascara Pequena + Snorkel Azul ;1002386087;41.99;produtos importados;esportes
114;Flutuador 1,60 x 0,60 cm - Laranja ;100564215;6.80;produtos importados;esportes
115;Bóia Inflável Princesas Redonda Mor ;100336515;19.89;produtos importados;esportes
116;Touca de Natação Silicone - Rosa ;100515068;11.05;produtos importados;esportes
117;Baldinho De Praia E Barquinho Radical Surf Com Pá E Estrela Menina ;1002515471;49.99;produtos importados;esportes
118;Óculos de Natação Aquaflow Sport - Intex 55682 ;1002453287;31.58;produtos importados;esportes
119;Balde de Praia para Bebês - Cardoso Toys ;1002393845;49.90;produtos importados;esportes
120;Boia Fralda Para Bebe De Sapinho inflável 27x18 verde Baby boat ;1002507837;39.00;produtos importados;esportes
121;Boia de Braço Bichinho - rosa ;100514797;12.75;produtos importados;esportes
122;Máscara Mergulho Infantil - Rosa ;100515322;19.55;produtos importados;esportes
123;Touca de Natação Látex - vermelho ;100515246;5.95;produtos importados;esportes
124;BALDINHO DE PRAIA KIT CASTELINHO DE AREIA CORES SORTIDA 1UND ;1002359209;;produtos importados;esportes
125;Boia de Braço 30cm x 15cm - verde ;100514794;11.05;produtos importados;esportes
126;BALDINHO DE PRAIA CARRIOLA DE PRAIA SORTIDO 1 UND ;1002344533;;produtos importados;esportes
127;BRINQUEDO DIVERSO KIT BETS TACO MADEIRA+BOLINHA ;1002358889;;produtos importados;esportes
128;Colete Inflável Premium +3 Anos Amarelo Mor ;100510041;34.78;produtos importados;esportes
129;Prancha Inflável Frutinhas Sortidas - vermelho ;100514910;40.80;produtos importados;esportes
130;Acessórios de Praia e Piscina - Conjunto de Praia - Luccas Neto - Novabrink ;100180762;29.90;produtos importados;esportes
131;BRINQUEDO DIVERSO FRESCOBOL KIT ;1002359012;;produtos importados;esportes
132;BRINQUEDO DIVERSO FRESCOBOL PLASTICO ;1002359017;;produtos importados;esportes
133;Máscara Mergulho Junior - Rosa ;100515038;45.05;produtos importados;esportes
134;BALDINHO DE PRAIA BALDINHO 15CM C/ ACESSORIOS ;1002344682;;produtos importados;esportes
135;Banheira Inflável 130 Litros - rosa ;100514839;47.60;produtos importados;esportes
136;Boia Bote Inflável Infantil Figuras Sortidas Intex ;100308463;43.99;produtos importados;esportes
137;Pula Cordas Individual 2 Metros ;100249639;19.46;produtos importados;esportes
138;Boia Bebê Infantil Baby Bote Kiddie Carrinho Intex ;100262322;38.10;produtos importados;esportes
139;Boia Inflável Grande Zoo - Sapo - Intex ;100052421;17.99;produtos importados;esportes
140;Bomba de Ar Manual Double Quick Pequena - Intex ;1002100733;28.99;produtos importados;esportes
141;Balde de Praia - Rosita FROZEN II ;1002094871;43.04;produtos importados;esportes
142;Boia de Braço Infantil Peixinhos 23x15cm - Intex UNICA ;1002095108;22.72;produtos importados;esportes
143;Piscina Inflável - Baby Arco-íris - Intex ;100145157;45.99;produtos importados;esportes
144;Jogo de Betes ;1002722960;39.00;produtos importados;esportes
145;Bola de Frescobol LCM Blue Star Tubo com 02 unidades ;1002677906;16.90;produtos importados;esportes
146;Bola de Tênis de Mesa Laranja 1 Estrela 6 Unidades Vollo ;1002718871;24.90;produtos importados;esportes
147;Bola de Iniciação Penalty T8 XXI ;1002708443;44.80;produtos importados;esportes
148;MINI CADEIRA POLTRONA INFANTIL EDUCACIONAL EM PLASTICO RESISTENTE ARQPLAST ROSA MENINAS ;1002609592;31.99;produtos importados;esportes
149;Peteca Grande 19 cm ;1002685661;39.90;produtos importados;esportes
150;Kit Infantil Jogo de Frescobol ;1002603177;39.00;produtos importados;esportes
151;Kit Jogo de Frescobol Luxo ;1002603173;49.00;produtos importados;esportes
152;PISCINA INFANTIL BEBE CRIANÇA INFLAVEL 3 ANEIS PASSEIO PORTATIL PRAIA VERAO CAMPO ;1002613015;39.99;produtos importados;esportes
153;Raquete de Ping-Pong ;1002621128;29.00;produtos importados;esportes
154;BALDINHO PRAIA INFANTIL KIT CARRINHO COM PUXADOR ACESSORIOS PAZINHA BRINQUEDO BEBE MENINO MENINA COMPLETO Menino ;1002538059;21.90;produtos importados;esportes
155;Flutuador Inflável de Piscina Flamingo ;1002603047;39.00;produtos importados;esportes
156;Bola de Iniciação Penalty T8 XXI ;1002708449;44.80;produtos importados;esportes
157;Bola Confete Na8 - Art Brink 7899658390624 ;1002547932;13.09;produtos importados;esportes
158;Boia De Braço Infantil 3-6 Anos 19cm x 19cm Intex - 59640 ;1002692269;14.60;produtos importados;esportes
159;BALDINHO DE PRAIA BEACH PLAY USUAL 361 ;1002694804;;produtos importados;esportes
160;Colete salva vidas Inflável infantil - Mor ;1002574918;49.99;produtos importados;esportes
161;BALDINHO PRAIA INFANTIL KIT CARRINHO COM PUXADOR ACESSORIOS PAZINHA BRINQUEDO BEBE MENINO MENINA COMPLETO Menino ;1002538062;21.90;produtos importados;esportes
162;Boia Infantil do Homem Aranha de Cintura de 56cm até 30kg ;1002667306;47.99;produtos importados;esportes
163;Arco Flecha Criança Lança Dardo C Alvo Envio Rápido Promoção ;1002430161;29.99;produtos importados;esportes
164;PISCINA INFLAVEL INFANTIL 21 LITROS BANHEIRA PEIXINHOS BEBE CRIANÇA 2 ANEIS ESTAMPADA COM KIT REPARO ;1002493136;25.99;produtos importados;esportes
165;Boia Inflável Estampada - 51cm - 03 a 06 anos - Intex 59230 ;1002667182;19.90;produtos importados;esportes
166;Boia Inflável Estampada - 51cm - 03 a 06 anos - Intex 59230 ;1002667193;19.90;produtos importados;esportes
167;JOGO DE TACO RUA PRAIA COMPLETO COM BOLINHA E CASINHA 2 TACOS TACOBOL EDUCATIVO ;1002527589;49.90;produtos importados;esportes
168;PISCINA INFLÁVEL 88L INFANTIL COLORIDA 3 ANEIS PRAIA CAMPO CRIANCA BEBE MENINO MENINA VERÃO ;1002509549;33.00;produtos importados;esportes
169;WATER BOMB BALLOM BEXIGA DE AGUA KIT COM 3 UNIDADES BEXIGUINHA DE ESTOURAR COM 60 BALÕS E ADAPTADOR PRAIA VERAO FESTA ;1002509322;19.92;produtos importados;esportes
170;Caneleira Infantil Preta Com Elástico ;1002504872;28.90;produtos importados;esportes
171;Bola de Iniciação Penalty T10 XXI ;1002567505;48.90;produtos importados;esportes
172;Boia De Braço Inflável Fisher-Price 25Cm X 15Cm 83255 - Fu ;1002529746;18.14;produtos importados;esportes
173;BOIA INFLAVEL LOL CIRCULAR 50CM ;1002563926;;produtos importados;esportes
174;Kit 6 Adesivos Para Reparo Boias Infláveis - Intex 59631 ;1002568313;19.90;produtos importados;esportes
175;Boia Inflável Circular Pneu Mud Master ;1002603038;29.00;produtos importados;esportes
176;Raquete Frescobol Red Nose Com Bolinha - Bel Fix ;1002734419;47.88;produtos importados;esportes
177;Capacete Infantil Verde Dm Radical Tamanho M DMR5954 dm Toys ;1002736657;47.99;produtos importados;esportes
178;Bola Squish Divertida Neon - Dm Toys ;1002391642;19.99;produtos importados;esportes
179;Touca de Natação Speedo Xtrafit JR Tecido Infantil 0/10 ANOS ;1002403390;42.90;produtos importados;esportes
180;Boia Inflável Redonda Rosquinha ;1002507835;37.90;produtos importados;esportes
181;BOLA DE FUTEBOL SOCIAL 3 ;1002167751;23.88;produtos importados;esportes
182;BOLA DE FUTEBOL SOCIAL 3 ;1002167748;23.88;produtos importados;esportes
183;Kit Proteção Capacete Joelheira e Cotoveleira - Mantica ;100430506;30.59;produtos importados;esportes
184;Banheira Inflavel 80L Verde MOR 001781 ;1002202248;49.90;produtos importados;esportes
185;Boia Inflável Circular Avengers ;1002155596;19.99;produtos importados;esportes
186;Piscina Inflável Fundo do Mar 46L - AZUL ;1002100288;39.99;produtos importados;esportes
187;CADEIRA CADEIRINHA POLTRONA INFANTIL EDUCACIONAL MENINAS ROSA ;1002190549;31.99;produtos importados;esportes
188;Buzina de Bicicleta Trim Color - Western ;1002163775;17.88;produtos importados;esportes
189;Buzina de Bicicleta Trim Color - Western ;1002163781;17.88;produtos importados;esportes
190;Touca Natação Infantil Super Homem - Bel Fix ;1002315388;35.88;produtos importados;esportes
191;Kit de Proteção Dinossauro Infantil Atrio - ES463X [Reembalado] ;1002605910;48.15;produtos importados;esportes
192;Corda de Pular 2,4 metros - Go Play - Multikids -  UNICA ;1002095435;25.47;produtos importados;esportes
193;Bóia de Braço Inflável Fisher-Price ;1002091123;14.99;produtos importados;esportes
194;Isotubo Blindado p/ Proteção de Haste de Cama Elástica- Unit ;100460741;7.35;produtos importados;esportes
195;Boia De Braço Infantil 6-12 Anos 30cm x 15cm Intex - 58641 ;100534669;39.50;produtos importados;esportes
196;Boia de Abacaxi Infantil - Redonda de Cintura Inflável Intex ;100564112;36.90;produtos importados;esportes
197;Boia Inflavel Colete Inflavel Tropical ;100567642;31.00;produtos importados;esportes
198;Bóia Inflável Pneu Radial - Intex ;100558225;35.88;produtos importados;esportes
199;Máscara de Mergulho Juvenil - Vermelha - Bestway - New Toys ;100427301;49.90;produtos importados;esportes
200;Touca de Natação Speedo Big Swim Cap ;100462970;;produtos importados;esportes
201;Bola De Vôlei De Praia e quadra tamanho oficial ;100336901;47.90;produtos importados;esportes
202;Soft Earplug Speedo ;100462953;;produtos importados;esportes
203;Bola Inflável Bolha Ball - Braskit ;100342246;14.99;produtos importados;esportes
204;Bóia de Braço Frutas - Vermelho - Zein ;100457410;24.99;produtos importados;esportes
205;Touca infantil para natação Speedo com estampa de peixe ;100454720;;produtos importados;esportes
206;Óculos de Natação Speedo Classic Starters ;100452161;;produtos importados;esportes
207;Óculos De Natação Juvenil - Proteção Uv - Cinza - Bestway ;100427306;29.90;produtos importados;esportes
208;Mola para Cama Elástica de 13cm ChicoPlay Kit com 10 Unidades ;100354748;49.95;produtos importados;esportes
209;Ponteira para Haste de Cama Elástica ChicoPlay Unitário ;100354597;3.68;produtos importados;esportes
210;Isotubo Blindado para Proteção de Haste de Cama Elástica Unitário ;100354820;5.64;produtos importados;esportes
211;Acessórios De Praia e Piscina - Boia Circular Inflável - 56Cm - Disney - Marvel - Avengers - Etilux ;100311981;29.99;produtos importados;esportes
212;Isotubo Blindado para Proteção de Haste de Cama Elástica 6 Unidades ;100354670;33.88;produtos importados;esportes
213;Pula Corda em Sisal Trançado - Menina - Artesanal - 2 Metros - Multicolorido ;100346852;33.56;produtos importados;esportes
214;Pula Corda em Sisal Trançado - Morango - Artesanal - 2 Metros - Multicolorido ;100346815;41.76;produtos importados;esportes
215;Kit Ping Pong - Art Sport ;100351270;39.99;produtos importados;esportes
216;Boia Inflavel Estampada Transparente - 61cm - 06 a 10 anos - Intex 59242 ;1002667184;25.00;produtos importados;esportes
217;Boia Inflavel Estampada Transparente - 61cm - 06 a 10 anos - Intex 59242 ;1002667205;25.00;produtos importados;esportes
218;Boia Inflável Estampada - 61cm - 06 a 10 anos - Intex 59241 ;1002667203;25.00;produtos importados;esportes
219;Brinquedo Inflável Aquáticos - Intex 58590 ;1002667183;29.90;produtos importados;esportes
220;Colchão Bronzeador Neon - Intex 59717 ;1002667237;29.99;produtos importados;esportes
221;Piscina Infantil Baby 17L - Intex 59409 ;1002667195;39.90;produtos importados;esportes
222;Kit Baldinho De Praia Infantil Kids Com 6 Peças Heróis Girls ;1002628756;24.99;produtos importados;esportes
223;Prancha de Natação Evamax Acqua Média Azul ;1002677921;37.52;produtos importados;esportes
224;Capacete de Proteção infantil 54 cm Fogo Preto/ Vermelho ;100429105;44.80;produtos importados;esportes
225;Baby Bote Inflável Bombeiro - intex ;100428917;39.89;produtos importados;esportes
226;Balde de Praia Infantil - Galinha Pintadinha - 7 Peças - Rosita ;100396096;39.99;produtos importados;esportes
227;Teimoso 3D Boto Azul - Brizi ;100415395;47.88;produtos importados;esportes
228;Boia Porta Copo 17,5cm Coqueiro Cores Sortidas - Wellmix ;100370129;11.88;produtos importados;esportes
229;Bolashow em Vinil Alpha Baby (1701) ;100355139;23.10;produtos importados;esportes
230;Boia Redonda Estampada Dinossauros Amarela Intex - 59242 ;100275344;;produtos importados;esportes
231;Flutuador Circular 55x6 cm - Azul ;100564213;10.20;produtos importados;esportes
232;Máscara Mergulho Junior - Azul ;100515039;45.05;produtos importados;esportes
233;Prancha Inflável Frutinhas Sortidas - verde ;100514911;40.80;produtos importados;esportes
234;Bote com Fralda - verde ;100514822;24.65;produtos importados;esportes
235;Barraca Toca Castelo do Dragão 3+ ;1002626602;0.00;produtos importados;esportes
236;Porta Chuteira Poker - Marinho ;1002512014;0.00;produtos importados;esportes
237;BOIA DE BRACO BICHINHO  23X15CM (SORTIDO 1UND) ;1002359200;;produtos importados;esportes
238;BOIA DE BRACO BICHINHOS SORTIDOS ;1002359255;;produtos importados;esportes
239;BOIA INFLAVEL MICKEY ROADSTER RACERS ;1002359086;;produtos importados;esportes
240;Boia Infantil Inflável - Boia Neon - Sortida - INTEX ;1002735631;49.99;produtos importados;esportes
241;Piscina Banheira Inflável Turma da Monica Baby Rosa - Bel ;1002734487;32.24;produtos importados;esportes
242;Piscina Banheira Inflável Turma da Monica Baby Verde - Bel ;1002734483;32.24;produtos importados;esportes
243;Boia Infantil Inflável Animais Saffari - Bel 96800 ;1002734358;32.24;produtos importados;esportes
244;Óculos De Natação Infantil Rosa Com Acessórios - Dm Toys ;1002734494;17.54;produtos importados;esportes
245;Boia Infantil Inflável De Animais - Bel 96700 ;1002734355;35.18;produtos importados;esportes
246;Colete Infantil Inflavel Tropical - Bel ;1002734360;33.22;produtos importados;esportes
247;Colchão Boia Inflável para Piscina Mar Verde e Amarelo 69x183cm ;1002730271;32.90;produtos importados;esportes
248;Óculos de Natação Infantil Flamingo Buba ;1002668894;38.92;produtos importados;esportes
249;Boia Neon 90cm Azul - Mor ;1002642094;30.59;produtos importados;esportes
250;CARRINHO DE PRAIA INFANTIL BALDINHO CARRIOLA COM KIT DE ACESSORIOS PÁ BRINQUEDO BEBE MENINA MENINO Azul ;1002613110;39.90;produtos importados;esportes
251;Kit de Limpeza Para Barraca Tent Clear Echolife ;1002609066;44.90;produtos importados;esportes
252;BOLA DE PING PONG BRANCA PLASTICO C/06 ;1002691034;;produtos importados;esportes
253;Teimoso 3D Golfinho - Intex ;1002603443;39.99;produtos importados;esportes
254;Bote Baby Kiddie Bombeiro - Intex ;1002603898;39.99;produtos importados;esportes
255;;;;produtos importados;esportes
256;Boia Inflável Circular Óculos de Sol ;1002603031;29.00;produtos importados;esportes
