;name;SKU;price;department;sector
1030;Cadeira Para Auto Nania Trio Accès 0 Até 25Kg Vermelha ;100436742;294.90;baby;passeio-do-bebe
1031;Cadeirinha de Carro Black TB II Tutti Baby 15kg a 36kg Preto ;1002646781;276.90;baby;passeio-do-bebe
1032;Cadeirinha de Carro Delta Tutti Baby 15kg a 36kg Preto ;1002646780;271.90;baby;passeio-do-bebe
1033;Cadeira Para Carro Infantil Masculino Feminino Automotivo 15 a 36kg Assento Booster Tutti Baby Cinza ;1002659421;299.90;baby;passeio-do-bebe
1034;BOLSA BEACH BAG STYLE STREET - ABC DESIGN ;100399844;269.00;baby;passeio-do-bebe
1035;BOLSA BEACH BAG GRAPHITE GREY - ABC DESIGN ;100399843;269.00;baby;passeio-do-bebe
1036;Bolsa Maternidade Preta - BB267 - Multikids Baby ;100346548;292.12;baby;passeio-do-bebe
1037;Canguru Para Bebê 3 Posições Até 9kgs Lillo - 629705 ;1002424716;273.32;baby;passeio-do-bebe
1038;Bolsa de Maternidade Pirulitando Baby Média Cute Nude ;1002610891;296.90;baby;passeio-do-bebe
1039;Mala de Maternidade Pirulitando Baby Prática Rosa ;1002610896;285.90;baby;passeio-do-bebe
1040;Mochila de Maternidade Hug Graça Azul ;1002610851;285.90;baby;passeio-do-bebe
1041;Bolsa de Maternidade Pirulitando Baby Grande Essencial Preto ;1002610918;274.90;baby;passeio-do-bebe
1042;Carrinho de Bebê Toffy 100 Poliéster Cosco ;1002608750;499.90;baby;passeio-do-bebe
1043;Canguru Baby Carrier Natural Fit 3 Em 1 Cinza - Nuk ;100174882;319.00;baby;passeio-do-bebe
1044;Cadeira para Automóvel Cosco Tour - 9 a 36 kg ;1002630843;399.90;baby;passeio-do-bebe
1045;Carrinho de Bebê Toffy Bege Cosco ;1002530173;499.90;baby;passeio-do-bebe
1046;Triciclo - Europa - Passeio e Pedal - Azul - Bandeirante ;1002325992;389.59;baby;passeio-do-bebe
1047;Booster de Elevação Trackfix 15 a 36KG Preto Safety 1st ;1002630835;359.90;baby;passeio-do-bebe
1048;Triciclo - Europa - Passeio e Pedal - Rosa - Bandeirante ;1002325993;449.99;baby;passeio-do-bebe
1049;Carro Bandeirante Roadster com Pedal ;1002505047;319.90;baby;passeio-do-bebe
1050;Canguru Supreme Comfort 4 Em 1 Nuk ;1002408270;379.90;baby;passeio-do-bebe
1051;Canguru para Bebê Kiddo Muuv - Até 9 Kg - Melange Preto ;100573909;364.37;baby;passeio-do-bebe
1052;Mochila Paternidade Maternidade Preta com Compartimento Térmico, Trocador e Porta Lenços Kababy ;1002606969;359.99;baby;passeio-do-bebe
1053;Bebê Conforto - Burigotto - Touring X - 0 até 13 Kg - Cappuccino ;1002405573;452.90;baby;passeio-do-bebe
1054;Bebê Conforto - De 0 a 13 Kg - Cocoon - Cinza - Galzerano ;100250717;378.90;baby;passeio-do-bebe
1055;Ruído Branco Portátil Acalmar Bebê Wooshh Kababy Cor:Branco ;1002711847;309.90;baby;passeio-do-bebe
1056;Assento de Elevação Booster Starfix Infanti Rosa Fantasy ;1002710445;399.00;baby;passeio-do-bebe
1057;Bebê Conforto Cosco Wizz - 0 a 13kg ;1002608867;319.90;baby;passeio-do-bebe
1058;Cadeira Para Auto Reclinável 15 A 36 Kg Cadeirinha Bebê Infantil Protege Burigotto Mesclado Azul ;1002557765;;baby;passeio-do-bebe
1059;Cadeira para Auto - Bebê - 0-25kg - DRC Maximus - Preto e Cinza - Galzerano ;1002525374;429.99;baby;passeio-do-bebe
1060;Cadeirinha para Carro Team Tex Kalle Happy Days Minnie 9-36kg ;1002389613;489.00;baby;passeio-do-bebe
1061;Cadeirinha para Carro Team Tex Kalle Riche Grafik 9 a 36 kg ;1002389609;409.00;baby;passeio-do-bebe
1062;Bebê Conforto Cadeirinha p/ Auto Joy Preto/Cinza Tutti Baby ;1002185914;;baby;passeio-do-bebe
1063;Bolsa Maternidade Duo Signature Cinza Skip Hop ;100452644;499.90;baby;passeio-do-bebe
1064;Carrinho Keep Preto - Cosco ;1002601904;359.99;baby;passeio-do-bebe
1065;Bebê Conforto Litet Bb384 0 Meses até 13 Kg Preto Mescla ;1002581640;439.90;baby;passeio-do-bebe
1066;Cadeira Infantil para Auto Tutti Baby Versati de 9 À 36 Kg Azul ;1002723774;410.90;baby;passeio-do-bebe
1067;Cadeira para Auto Galzerano Maximus 8012 de 0 até 25 Kg Grafite ;1002719020;374.90;baby;passeio-do-bebe
1068;Bebê Conforto Burigotto Touring X de 0 até 13 Kg Black Preto ;1002723769;467.90;baby;passeio-do-bebe
1069;Carrinho Gira Gira Car - Azul - Fenix Brinquedos ;100556543;499.99;baby;passeio-do-bebe
1070;Policar Passeio Poliplac ;100250367;426.95;baby;passeio-do-bebe
1071;Bolsa Maternidade Grande Fundo do Mar Azul com Trocador ;1002492536;418.79;baby;passeio-do-bebe
1072;Mochila Maternidade Boca de Peixe Silver ;100557970;429.00;baby;passeio-do-bebe
1073;Canguru para Bebê Kiddo Muuv - Até 9 Kg - Melange Grafite ;100424573;364.37;baby;passeio-do-bebe
1074;Cadeira para Auto Burigotto Protege Reclinável 2 de 15 a 36 Kg Mesclado Azul ;1002387607;489.90;baby;passeio-do-bebe
1075;Cadeira para Auto Burigotto Protege Reclinável 2 de 15 a 36 Kg Mesclado Bege ;1002387608;488.90;baby;passeio-do-bebe
1076;Triciclo Infantil Pônei com Balanço - Calesita ;100431671;439.29;baby;passeio-do-bebe
1077;Carrinho de Passeio para Bebê Burigotto Oi 6 Meses até 15 Kg Blue Black Azul ;100564172;322.90;baby;passeio-do-bebe
1078;Cadeira Para Auto Nania Kelle Accès 9 À 36Kg Cinza ;100436651;356.90;baby;passeio-do-bebe
1079;Assento De Elevação Infantil Carro Isofix Booster Auto Fisher Price Strada Preto 22-36kg Grupo III Com Apoio Braço BB646 ;1002599448;379.90;baby;passeio-do-bebe
1080;Carrinho Guarda-Chuva Multikids Baby Navy Azul 6m - Até 15kg - Bb557 ;1002707096;319.90;baby;passeio-do-bebe
1081;Cadeira para Automóvel Team Tex Disney Kalle Minnie Mouse 9 a 36kg ;1002505198;369.90;baby;passeio-do-bebe
1082;Carrinho de Bebê Umbrella Wing Voyage Rosa ;1002467804;426.90;baby;passeio-do-bebe
1083;Bolsa Maternidade M Hug Rosa B11402 ;1002647210;304.99;baby;passeio-do-bebe
1084;Cadeirinha para Carro Burigotto Protege 15-36kg Mesclado Preto ;1002524921;489.00;baby;passeio-do-bebe
1085;Bebê Conforto Dreambaby Pop 0 A 13kg Preto e Grafite - Styll Baby 2921764 ;1002627495;319.90;baby;passeio-do-bebe
1086;Bebê Conforto Grid Galzerano Preto e Cinza ;1002647101;429.00;baby;passeio-do-bebe
1087;Bebê Conforto Grid Galzerano Rosa ;1002647104;429.00;baby;passeio-do-bebe
1088;Carrinho Bebe Infantil Criança Passeio Guarda Chuva Pocket Plus Cinza De 6 Meses a 15Kg Multikids ;1002557843;369.99;baby;passeio-do-bebe
1089;Bolsa Maternidade M Hug Mimosa Bege B11902 ;1002647211;327.90;baby;passeio-do-bebe
1090;Carrinho de Pedal Calesita Poponei com Balanço 12m+ 1007 ;100527026;454.99;baby;passeio-do-bebe
1091;Mochila de Maternidade Hug Xadrez Flávia Calina Bege ;1002584446;384.90;baby;passeio-do-bebe
1092;Cadeirinha para Carro Galzerano Maximus 9 a 25kg Preto Cinza ;100557318;399.00;baby;passeio-do-bebe
1093;Assento para Carro com Isofit - Kiddo ;100528627;427.38;baby;passeio-do-bebe
1094;Mochila de Maternidade Hug Grid Azul ;1002495727;329.90;baby;passeio-do-bebe
1095;Bebê Conforto Reverse Cosco - Cinza Rajado ;100446305;422.90;baby;passeio-do-bebe
1096;Assento Para Auto Booster com Isofit Kiddo Fika Preto 552APR ;100403200;419.00;baby;passeio-do-bebe
1097;Bebê Conforto Cocoon Black Galzerano 8181BL ;100412450;459.00;baby;passeio-do-bebe
1098;Bolsa de Maternidade Hug Grande Grid Azul ;1002495730;329.90;baby;passeio-do-bebe
1099;Mochila Maternidade Fundo do Mar Azul ;1002492537;309.49;baby;passeio-do-bebe
1100;Bebe Conforto Joy Azul - até 13kg - Tutti Baby ;1002171660;;baby;passeio-do-bebe
1101;Rino Baby Car Rosa Mercotoys ;100276142;327.64;baby;passeio-do-bebe
1102;Policar Passeio Rosa Poliplac ;100246006;426.95;baby;passeio-do-bebe
1103;Cadeira para Auto Disney Kalle Minnie Mouse Happy Days 9kg até 36kg Preto ;1002512118;450.90;baby;passeio-do-bebe
1104;Bolsa de Maternidade - Barcelona - 30x39x12 Cm - Mescla - Hug Baby ;100162050;371.90;baby;passeio-do-bebe
1105;Cadeira para Auto Disney Trio Luxe Mickey Mouse Happy Days 0 Meses até 25 Kg Preto ;1002304740;357.90;baby;passeio-do-bebe
1106;Bebê Conforto Cadeirinha Auto Infantil Criança Grid Galzerano Até 13kg + Protetor Solar Quebra Sol Cor:Cappuccino ;1002607960;349.00;baby;passeio-do-bebe
1107;Mochila Maternidade Multifuncional Hug Mescla Rosa B11400-1 ;1002675614;444.90;baby;passeio-do-bebe
1108;Mochila Maternidade Hug Mescla Azul Marinho B11400 ;1002675611;350.90;baby;passeio-do-bebe
1109;Mochila Maternidade Hug Mescla Rosa B11400 ;1002675613;350.90;baby;passeio-do-bebe
1110;Bebe Conforto Cadeirinha Auto Infantil 0 Até 13Kg Dispositivo de Retenção Grid Galzerano Cor:Rosa ;1002565626;349.00;baby;passeio-do-bebe
1111;Bebe Conforto Cadeirinha Auto Infantil 0 Até 13Kg Dispositivo de Retenção Grid Galzerano Cor:Black ;1002565604;349.00;baby;passeio-do-bebe
1112;Bebe Conforto Cadeirinha Auto Infantil 0 Até 13Kg Dispositivo de Retenção Grid Black Galzerano ;1002565682;349.00;baby;passeio-do-bebe
1113;Bebe Conforto Cadeirinha Auto Infantil 0 Até 13Kg Dispositivo de Retenção Grid Rosa Galzerano ;1002565680;349.00;baby;passeio-do-bebe
1114;Bebê Conforto Black - Tutti Baby ;1002185910;489.90;baby;passeio-do-bebe
1115;Bolsa Changing Bag Zapp X Quinny - Graphite ;100581659;469.90;baby;passeio-do-bebe
1116;Bolsa Changing Bag Zapp X Quinny - Black ;100557967;469.90;baby;passeio-do-bebe
1117;Cobre-Pernas Footmuff Zapp Quinny - Graphite ;100535673;464.90;baby;passeio-do-bebe
1118;Bebê Conforto Reverse Cosco - Azul ;100513801;422.90;baby;passeio-do-bebe
1119;Bebê Conforto Cocoon Galzerano Preto ;100513830;459.90;baby;passeio-do-bebe
1120;Bebê Conforto Reverse Cosco - Preto Rajado ;100446306;422.90;baby;passeio-do-bebe
1121;Bebê Conforto Reverse Cosco - Vermelho ;100446309;422.90;baby;passeio-do-bebe
1122;Cadeira Para Auto 0-36 Kg Mass Preta Litet - BB456 ;1002681594;;baby;passeio-do-bebe
1123;Cadeira Para Automóvel Cosco Progress 0 a 36kg ;1002529028;699.90;baby;passeio-do-bebe
1124;Carrinho de Passeio - Delta - Preto - Voyage ;100170998;529.00;baby;passeio-do-bebe
1125;Carrinho de Bebê para Passeio Galzerano Romano 1035 de 0 Meses até 15kg Preto com Cobre ;1002521186;635.90;baby;passeio-do-bebe
1126;Carrinho de Bebê Umbrella Park Voyage - Cinza ;100277493;568.90;baby;passeio-do-bebe
1127;Carrinho de Bebê Toffy Cosco Preto Absoluto ;1002376362;648.90;baby;passeio-do-bebe
1128;Quadriciclo - Passeio e Pedal - Smart - Bandeirante - Rosa ;1002697839;699.99;baby;passeio-do-bebe
1129;Carrinho de Passeio - Delta - Colore - Voyage ;100159996;529.00;baby;passeio-do-bebe
1130;Carrinho de Bebe Passeio Compacto Leve Galzerano Bali Black ;1002621727;598.00;baby;passeio-do-bebe
1131;Cadeirinha para Carro Dobravel Galzerano Mib 9-36 kg Grafite ;1002524928;562.00;baby;passeio-do-bebe
1132;Carrinho de Bebê Rock infanti - Grey Total ;1002496995;699.00;baby;passeio-do-bebe
1133;Cadeira Para Automóvel Team Tex Nania Primo Luxe Até 25kg ;1002505220;644.90;baby;passeio-do-bebe
1134;Carrinho de Bebe Reversivel Tutti Baby Solare Preto Cinza ;1002394596;699.90;baby;passeio-do-bebe
1135;;;;baby;passeio-do-bebe
1136;Quadriciclo de Madeira - Andamóbil - Bohney ;100348526;517.08;baby;passeio-do-bebe
1137;Triciclo Eletrico G204 Belfix Infantil 6v Vermelho ;100318246;;baby;passeio-do-bebe
1138;Cadeirinha de Carro Beline Luxe Mickey Mouse Cool 9 kg a 36 kg Disney Preto ;1002620614;;baby;passeio-do-bebe
1139;Carrinho de Bebê para Passeio Galzerano Romano 1035 de 0 Meses até 15kg Preto com Rosa ;1002717602;615.90;baby;passeio-do-bebe
1140;Bebê Conforto Cocoon Black - Galzerano 8181BL ;1002627481;;baby;passeio-do-bebe
1141;CADEIRA DE SEGURANCA P/ CARRO MINNIE TYPO KALLE ROSA 9 A 36K ;1002359991;597.78;baby;passeio-do-bebe
1142;Cadeira para Auto Nania Primo Luxe Rouge de 0 Meses até 25 Kg Preto com Vermelho ;1002304739;623.90;baby;passeio-do-bebe
1143;Conjunto Bebê Conforto com Base para Carro Burigotto Touring X de 0 até 13 Kg Cinza e Rosa ;1002564946;615.90;baby;passeio-do-bebe
1144;Cinto Resistente para Bêbe Conforto Adpatável em Bagagens, ALNOOR USA 005, Laranja ;1002307471;588.74;baby;passeio-do-bebe
1145;Conjunto Bebê Conforto com Base para Carro Burigotto Touring X de 0 até 13 Kg Preto Mesclado ;1002564951;609.90;baby;passeio-do-bebe
1146;Carrinho de Bebê Hobby Cosco Cinza Mescla ;1002647093;637.90;baby;passeio-do-bebe
1147;Espelho Retrovisor Interativo E Musical Nuvem - Skip Hop ;1002681158;579.99;baby;passeio-do-bebe
1148;Carrinho de Bebe Guarda Chuva Galzerano Campora Preto Rosa ;1002611259;677.00;baby;passeio-do-bebe
1149;Bebe Conforto Cadeirinha Auto Infantil 0 Até 13Kg Galzerano Dispositivo Retenção Grid Preto + Base ;1002607904;532.00;baby;passeio-do-bebe
1150;QUADRICICLO CROSS LEGACY AZUL E VERMELHO - CALESITA ;1002516099;509.00;baby;passeio-do-bebe
1151;Bebe Conforto Cadeirinha Auto Infantil 0 Até 13Kg Galzerano Dispositivo De Retenção Grid + Base Cor:Preto ;1002607894;532.00;baby;passeio-do-bebe
1152;Cadeirinha De Carro Beline Homem Aranha Team Tex Preto e Vermelho ;1002693151;569.00;baby;passeio-do-bebe
1153;Bebê Conforto Infantil Cadeirinha Auto Grid Cappuccino Galzerano Até 13kg + Base + Protetor Solar ;1002614266;532.00;baby;passeio-do-bebe
1154;Carrinho de Bebê Umbrella Park Voyage - Preto ;100277495;568.90;baby;passeio-do-bebe
1155;CAPOTA PARA CARRINHO SPRING SHADOW GREY - THULE ;100400405;589.00;baby;passeio-do-bebe
1156;Carrinho de Bebê Luck Voyage - Preto ;100384508;651.90;baby;passeio-do-bebe
1157;Carrinho de Bebê Spot  Voyage - Azul Geo ;100384505;648.90;baby;passeio-do-bebe
1158;Bebê Conforto Casulo Click Melange Preto Sprint 415smp ;100380084;689.00;baby;passeio-do-bebe
1159;Carrinho Infantil Gira Gira Car - Azul- Fenix ;100345302;602.35;baby;passeio-do-bebe
1160;CADEIRA DE SEGURANCA P/ CARRO MICKEY TRIO LX.HAPPY DAYS 25K ;1002712873;530.10;baby;passeio-do-bebe
1161;Cadeira Auto Burigotto Protege Reclinável Mesclado Bege IXAU3041PR33 ;100313076;554.99;baby;passeio-do-bebe
1162;BEBE CONFORTO CASULO CLICK PRETO PARA SPEEDY (415Y) - KIDDO ;1002726556;609.00;baby;passeio-do-bebe
1163;Carrinho de Bebe Berço para Passeio Kangalup Easy F1 Amarelo ;1002726330;549.00;baby;passeio-do-bebe
1164;Cadeirinha Para Automóvel Ninna 0570000 Tutti Baby 9kg a 36kg ;1002652018;549.90;baby;passeio-do-bebe
1165;Espelho Retrovisor Interativo e Musical Nuvem Skip Hop ;1002628970;599.90;baby;passeio-do-bebe
1166;BEBE CONFORTO CASULO CLICK PARA NOMAD PRETO - KIDDO ;1002620756;609.00;baby;passeio-do-bebe
1167;Bebê Conforto Infantil Criança Grid Rosa Galzerano Até 13kg + Base + Protetor Solar Quebra Sol ;1002614168;532.00;baby;passeio-do-bebe
1168;Bebe Conforto Cadeirinha Auto Infantil 0 Até 13Kg Galzerano Dispositivo De Retenção Grid + Base Cor:Rosa ;1002607907;532.00;baby;passeio-do-bebe
1169;Bebe Conforto Cadeirinha Auto Infantil 0 Até 13Kg Galzerano Dispositivo Retenção Cappuccino + Base ;1002607906;532.00;baby;passeio-do-bebe
1170;Carrinho de Passeio Infantil Cross Turbo Azul ;100470684;537.60;baby;passeio-do-bebe
1171;Carrinho de Passeio Park Voyage - Preto ;100471472;599.00;baby;passeio-do-bebe
1172;Cadeira para Auto Burigotto Protege Reclinável - Mesclado Cinza - Grupos 2 e 3: 15 a 36 Kg ;100406618;626.74;baby;passeio-do-bebe
1173;Cadeira para Auto Burigotto Protege Reclinável - Mesclado Preto - Grupos 2 e 3: 15 a 36 Kg ;100403257;626.74;baby;passeio-do-bebe
1174;CAPOTA PARA CARRINHO SPRING MAJOLICA OLIVE - THULE ;100400400;589.00;baby;passeio-do-bebe
1175;CAPOTA PARA CARRINHO SPRING TEAL MELANGE - THULE ;100400413;589.00;baby;passeio-do-bebe
1176;CAPOTA PARA CARRINHO SPRING MIDNIGHT BLACK - THULE ;100399757;589.00;baby;passeio-do-bebe
1177;Carrinho de Bebê Luck Voyage - Azul Boreal ;100384515;651.90;baby;passeio-do-bebe
1178;Cadeira para Auto - Multikids - Isofix Litet All Stages - De 0 a 36kg - Preto ;1002717622;999.90;baby;passeio-do-bebe
1179;Cadeira Infantil para Carro Legacy 0-36kg Preta - Voyage ;100299086;749.90;baby;passeio-do-bebe
1180;Cadeira Para Auto - Isofix - 0-36 kg - Multikids - All Stages - Preta e Cinza ;1002717635;999.90;baby;passeio-do-bebe
1181;Cadeira para Auto - Multikids - Isofix Litet All Stages - De 0 a 36kg - Cinza ;1002717623;999.90;baby;passeio-do-bebe
1182;Carrinho de Bebê - Chicco - Ohlalà 3 - De 0 à 15kg  Preto ;100546211;949.05;baby;passeio-do-bebe
1183;Cadeira para Auto - Fisher-Price - Arya - De 0 a 25 Kg - Cinza ;1002390396;729.90;baby;passeio-do-bebe
1184;Cadeira Para Auto - De 0 a 25 Kg - Recline Grey Denim - Safety 1st ;100134022;761.90;baby;passeio-do-bebe
1185;Carrinho Passeio Beyond 2 em 1 Assento Moisés 0-15kgs Preto Multikids Baby - BB428 ;1002110291;994.65;baby;passeio-do-bebe
1186;Cadeira para Automóvel Cosco Unique Sport - 0 a 36 kg ;1002525592;829.90;baby;passeio-do-bebe
1187;Carrinho de Bebê para Passeio Burigotto Rio K Reversível até 15 Kg Preto Mescla ;100564168;984.90;baby;passeio-do-bebe
1188;Cadeira para Auto - De 0 a 25 Kg - Evolution K - Mescla Cinza - Burigotto ;100209466;999.90;baby;passeio-do-bebe
1189;Carrinho de Bebê Galzerano Milano Reversível II - Preto / Cobre ;1002192968;948.21;baby;passeio-do-bebe
1190;Carrinho de Passeio e Pedal para Bebe Calesita Kombina Azul ;100516909;829.00;baby;passeio-do-bebe
1191;Cadeirinha de Carro Primo Luxe Rouge Team Tex ;1002467803;829.00;baby;passeio-do-bebe
1192;Carrinho de Bebe para Passeio Tutti Baby Joy Rosa Reversível ;100516973;;baby;passeio-do-bebe
1193;Carrinho de Bebe para Passeio 3 Rodas Tutti Baby Evo Verde ;100516970;799.90;baby;passeio-do-bebe
1194;Carrinho Passeio Beyond 2 em 1 Assento Moisés 0-15kgs Cinza Multikids Baby - BB429 ;1002110289;994.65;baby;passeio-do-bebe
1195;Cadeira para Auto Recline Safety 1st Full Black 0 a 25kg Preto ;1002246444;762.90;baby;passeio-do-bebe
1196;Cadeira para Auto - Voyage - De 0 a 36 Kg - Preta ;1002583960;799.00;baby;passeio-do-bebe
1197;Carro Buggy Vermelho com Alça Step 2 - Edição Especial ;100238190;754.88;baby;passeio-do-bebe
1198;Almofada de Suporte para Cabeça e Corpo Britax, Cinza ;1002678802;752.21;baby;passeio-do-bebe
1199;Carrinho de Passeio / Pedal - Poliquadri ;1002527402;;baby;passeio-do-bebe
1200;Carrinho de Bebê Passeio Infantil Berço 2 em 1 Reclinável Do Nascimento Até 15 kg Romano Galzerano Cor:Preto Cobre ;1002620148;779.90;baby;passeio-do-bebe
1201;Carrinho de Bebê Passeio Infantil Berço 2em1 Reclinável De 0 Até 15 kg Romano Preto Cobre Galzerano ;1002620146;779.99;baby;passeio-do-bebe
1202;Cadeira para Auto Disney Primo Minnie Mouse Red de 0 Meses até 25 Kg Vermelho ;1002304743;761.90;baby;passeio-do-bebe
1203;Cadeirinha Para Carro Burigotto GT 0.1.2.3 0 a 36kg Black Preta ;100268130;999.00;baby;passeio-do-bebe
1204;CADEIRA DE SEGURANCA P/ CARRO BELINE CAPITAO AMERICA 9 A 36K ;1002363881;730.94;baby;passeio-do-bebe
1205;CADEIRA DE SEGURANCA P/ CARRO MINNIE MOUSE CLASSIQUE COSMO ;1002363597;914.09;baby;passeio-do-bebe
1206;CADEIRA DE SEGURANCA P/ CARRO BELINE MICKEY VITE 9 A 36KG. ;1002363588;730.94;baby;passeio-do-bebe
1207;Carrinho de Bebê para Passeio Burigotto Ecco de 0 até 15 Kg Cinza com Bege ;1002387615;812.90;baby;passeio-do-bebe
1208;Carrinho de Bebê para Passeio Burigotto Ecco de 0 até 15 Kg Cinza com Rosa ;1002387604;834.90;baby;passeio-do-bebe
1209;Carrinho de Bebê para Passeio Burigotto Ecco de 0 até 15 Kg Cinza com Vermelho ;1002387614;812.90;baby;passeio-do-bebe
1210;Carrinho de Bebê Delta Voyage Rosa Mescla ;1002665690;713.90;baby;passeio-do-bebe
1211;Carrinho De Bebê Passeio 6M a 15kg Guarda-Chuva Reversível Reclinável Campora Girafa Galzerano Estampa:Preto Caramelo ;1002620616;749.99;baby;passeio-do-bebe
1212;CARRINHO OHLALA 3 RED PASSION - CHICCO ;1002636373;999.90;baby;passeio-do-bebe
1213;Carrinho de Bebe Reversivel Galzerano Milano Preto Cobre ;1002611216;873.00;baby;passeio-do-bebe
1214;Carrinho de Bebê Passeio 2em1 Reversível Reclinável Até 15Kg Maranello II Galzerano + Mosquiteiro Cor:Caramelo ;1002607919;935.00;baby;passeio-do-bebe
1215;Carrinho De Bebe Passeio 6m a 15kg Guarda-Chuva Compacto Reversível Reclinável Campora Galzerano Cor:Preto Rosa ;1002620134;749.99;baby;passeio-do-bebe
1216;Carrinho De Bebe Passeio 6m a 15kg Guarda-Chuva Compacto Reversível Reclinável Campora Galzerano Cor:Preto Caramelo ;1002620133;749.99;baby;passeio-do-bebe
1217;Carrinho De Bebe Passeio 6m a 15kg Guarda-Chuva Reversível Reclinável Campora Caramelo Galzerano ;1002620137;749.99;baby;passeio-do-bebe
1218;Carrinho de Bebê - Conforto - Tivoli Travel Coccon Slim - Vermelho - Galzerano ;1002523704;929.99;baby;passeio-do-bebe
1219;Carrinho Milano Rev. II Cappuccino Rosa Galzerano 1016CPR ;1002414625;869.99;baby;passeio-do-bebe
1220;Carrinho de Passeio Infantil Calesita DIIPI c/ Pedal - Verde ;100470794;837.90;baby;passeio-do-bebe
1221;Carrinho de Bebê Passeio Compacto Multikids Baby Spy Bb424 Preto ;1002405563;;baby;passeio-do-bebe
1222;Mini Veículo - Kombina - Passeio/ Pedal - Rosa ;1002468698;998.00;baby;passeio-do-bebe
1223;VEICULO A PEDAL TRATOR LASER GIRL COM CACAMBA ;1002467615;899.00;baby;passeio-do-bebe
1224;Carrinho de Bebe Reversível Galzerano Milano II Preto Cobre ;1002380237;873.00;baby;passeio-do-bebe
1225;Super Quad Passeio e Pedal Rosa ;100444452;799.99;baby;passeio-do-bebe
1226;Carrinho de Passeio Calesita Kombina c/ Haste e Pedal - Azul ;100471004;807.45;baby;passeio-do-bebe
1227;Cadeirinha Progress 0 a 36kg Cosco - Cinza Mescla ;100384497;908.90;baby;passeio-do-bebe
1228;Carrinho de Bebê Yupi Voyage - Cinza Mescla ;100446365;879.90;baby;passeio-do-bebe
1229;Cadeirinha Para Carro CBX Xelo 9 a 36 Kg Latch Black Preta ;100400324;899.00;baby;passeio-do-bebe
1230;Carrinho london up matrix - Chicco ;100400425;999.00;baby;passeio-do-bebe
1231;CARRINHO ECHO STONE - CHICCO ;100399372;879.90;baby;passeio-do-bebe
1232;CARRINHO DE PASSEIO MK TRUCK -CALESITA ;100399301;751.16;baby;passeio-do-bebe
1233;Cadeirinha Progress 0 a 36kg Cosco - Preto ;100384495;908.90;baby;passeio-do-bebe
1234;Carrinho de Bebê Galzerano Capri - Preto/Preto/Cinza ;1002678254;705.59;baby;passeio-do-bebe
1235;Carrinho de Bebê Galzerano Capri - Preto/Grafite/Rosa ;1002609527;705.59;baby;passeio-do-bebe
1236;Carrinho de Bebê Galzerano Campora - Preto/Caramelo ;1002609521;765.69;baby;passeio-do-bebe
1237;Carrinho de Bebê - Passeio-Berço - Milano Reversível 2 - Cappuccino Rosa - Galzerano ;1002523702;899.99;baby;passeio-do-bebe
1238;Cadeirinha para Carro Safety 1st Recline 0 a 25 kg Black Ink ;1002470455;929.00;baby;passeio-do-bebe
1239;Bebê Conforto Casulo Click Kiddo Preto ;1002421512;769.90;baby;passeio-do-bebe
1240;Carrinho de Bebê Voyage Luck Rosa Boreal ;1002429720;791.90;baby;passeio-do-bebe
1241;Kit de Montagem de Suporte para Bebê Conforto Takpat Universal, TAKPART 25049, Preto ;1002307475;705.93;baby;passeio-do-bebe
1242;Carrinho Para Bebê Passeio 2 em 1 Nascimento Até 15Kg Reclinavel Maranello II Galzerano Cor:Rosa Preto ;1002617307;905.00;baby;passeio-do-bebe
1243;Cadeirinha de Bebe Para Auto de 0 a 25 kg Primo Disney Team Tex Nome:Minnie Mouse Cool ;1002617746;844.00;baby;passeio-do-bebe
1244;Cadeirinha de Bebe Para Auto de 0 a 25 kg Primo Disney Team Tex Nome:Mickey Mouse Cool ;1002617730;844.00;baby;passeio-do-bebe
1245;Carrinho Para Bebê Passeio 2 em 1 Nascimento Até 15Kg Reclinavel Maranello II Galzerano Cor:Caramelo ;1002617303;905.00;baby;passeio-do-bebe
1246;Carrinho De Passeio Com 3 Rodas Reclinável De 0 a 15 Kg Delta Voyage Cor:Colorido ;1002618180;679.00;baby;passeio-do-bebe
1247;Carrinho de Bebê 2 em 1 Passeio Até 15Kg Reclinável Maranello II Galzerano Caramelo + Mosquiteiro ;1002614311;935.00;baby;passeio-do-bebe
1248;Carrinho de Bebe Reversivel Galzerano Milano Cappuccino Rosa ;1002611269;873.00;baby;passeio-do-bebe
1249;Carrinho Bebe Berço Passeio Guarda Chuva Reclinável De 0 à 15kg Leve e Compacto Echo Chicco Cor:Preto e Vermelho ;1002607920;999.00;baby;passeio-do-bebe
1250;CARRINHO AIRPLANE CINZA - BABY STYLE ;1002523415;759.90;baby;passeio-do-bebe
1251;CARRINHO SPYDER C/ CAPACETE QUADRI TOYS DOLL - MAGIC TOYS ;1002516049;790.90;baby;passeio-do-bebe
1252;Carrinho de Bebê - Berço-Passeio - Cross Trail - Preto e Cobre - Galzerano ;1002523698;899.99;baby;passeio-do-bebe
1253;CARRINHO CROSS TRAIL CINZA/PRETO - GALZERANO ;1002516231;882.55;baby;passeio-do-bebe
1254;CARRINHO CROSS TRAIL CINZA/PRETO - GALZERANO ;1002516184;882.55;baby;passeio-do-bebe
1255;Carrinho de Bebê Passeio 2 em 1 Até 15kg Acopla Bebê Conforto Reclinavel San Remo Galzerano Cor:Preto Cinza ;1002618509;970.90;baby;passeio-do-bebe
1256;Carrinho de Bebê Urban Baby Style ;1002514894;719.00;baby;passeio-do-bebe
1257;Carrinho de Bebê com 3 Rodas Função Passeio Berço Reclinável De Recem Nascido até 15kg Cross Trail - Galzerano Cor:Cinza ;1002618512;939.99;baby;passeio-do-bebe
1258;Carrinho de Bebe Bebe Conforto Tutti Baby Solare Rosa Coroa ;1002394590;999.80;baby;passeio-do-bebe
1259;Carrinho de Bebe Passeio Reversível Tutti Baby Joy II Preto ;1002394595;849.90;baby;passeio-do-bebe
1260;Carrinho de Bebê Evo Tutti Baby Preto e Cinza ;1002376392;738.90;baby;passeio-do-bebe
1261;Carrinho de Bebe para Passeio Berço Burigotto Ecco CZ Rosa ;1002380230;929.00;baby;passeio-do-bebe
1262;Carrinho de Bebe Galzerano Milano Reversível Capuccino Rosa ;1002380250;873.00;baby;passeio-do-bebe
1263;Carrinho de Bebe Passeio Reversível Tutti Baby Joy II Azul ;1002380233;849.90;baby;passeio-do-bebe
1264;Carrinho de Bebe Bebe Conforto Tutti Baby Solare Preto Cinza ;1002394599;999.80;baby;passeio-do-bebe
1265;Carrinho de Bebe Passeio Reversível Tutti Baby Joy II Rosa ;1002394601;849.90;baby;passeio-do-bebe
1266;Bebê Conforto Touring X Burigotto Capuccino ;100301365;709.00;baby;passeio-do-bebe
1267;Carrinho de Bebê Whoop Street Cappuccino e Preto 8003CP ;100236679;719.00;baby;passeio-do-bebe
1268;Carrinho de Bebê Evo Tutti Baby Rosa- 2004 ;1002488446;949.90;baby;passeio-do-bebe
1269;Carrinho De Bebê Solare Tutti Baby Rosa Múltiplas Posições ;1002488443;898.90;baby;passeio-do-bebe
1270;Carrinho de Bebê Evo Tutti Baby Preto - 2008 ;1002488448;949.90;baby;passeio-do-bebe
1271;Carrinho De Bebê Solare Tutti Baby Preto Múltiplas Posições ;1002488442;898.90;baby;passeio-do-bebe
1272;Carrinho Berço Hórus Tutti Baby 10.015.008 Preto/Cinza ;1002488445;789.90;baby;passeio-do-bebe
