;name;SKU;price;department;sector
2754;Lancheira Escolar Barbie Fashion Vermelha - LA38183BB-VM - Luxcel ;1002638777;100.41;produtos importados;livros-e-papelaria
2755;Estojo Soft Luxo - The Last of Us ;1002646095;114.90;produtos importados;livros-e-papelaria
2756;Superman vs. Shazam - Quando as Terras se Chocam! ;1002657174;149.90;produtos importados;livros-e-papelaria
2757;Kit de Bolsa Maternidade Impermeável  Saída ;1002415143;129.90;produtos importados;livros-e-papelaria
2758;LANCHEIRA TERMICA UP4YOU BLAH MAO/OMBRO AZ ;1002631512;;produtos importados;livros-e-papelaria
2759;Mini Mochila De Rodinha Infantil Clio Pets - CP3397B ;1002534566;127.30;produtos importados;livros-e-papelaria
2760;Mochila Fortnite Camuflada Tipo Saco Fortnite Mochila ;1002723199;129.90;produtos importados;livros-e-papelaria
2761;Lancheira Escolar Infantil Branca de Neve - Xeryus ;1002605364;116.01;produtos importados;livros-e-papelaria
2762;LANCHEIRA TERMICA UP4YOU FOGUETE MAO LR ;1002631508;;produtos importados;livros-e-papelaria
2763;MOCHILA INFANTIL PICOLE MD AMARELO ;1002628245;;produtos importados;livros-e-papelaria
2764;Lancheira com Alça e 2 Compartimentos - LC1801 - YES - PRETO ;1002605337;144.03;produtos importados;livros-e-papelaria
2765;Colar Mamãe Criança Menina Filha Coração Folheado A Ouro 18k ;1002715851;129.90;produtos importados;livros-e-papelaria
2766;Lancheira Escolar Patrulha Canina - Xeryus ;1002605367;116.01;produtos importados;livros-e-papelaria
2767;Caderno Inteligente Pandalu By Luluca - Grande ;1002492971;148.90;produtos importados;livros-e-papelaria
2768;EMBALAGEM PARA DOCES COELHINHO BOMBOM P/2UN. PAPAYA CX.C/30 DELLO ;1002684602;;produtos importados;livros-e-papelaria
2769;Lancheira - Liga Da Justiça - Dc Comics - Xeryus ;1002491261;109.90;produtos importados;livros-e-papelaria
2770;LANCHEIRA TERMICA FISHER-PRICE MAO/COSTAS LR ;1002631530;;produtos importados;livros-e-papelaria
2771;Livro 365 - Histórias para Dormir - Princesas e Fadas - Editora DCL ;1002570655;132.75;produtos importados;livros-e-papelaria
2772;LANCHEIRA TERMICA BARBIE MAO/COSTAS VD ;1002631528;;produtos importados;livros-e-papelaria
2773;LANCHEIRA TERMICA FISHER-PRICE MAO/COSTAS VM ;1002631534;;produtos importados;livros-e-papelaria
2774;Homem-Aranha: As Tiras Vol. 4 (1983-1984) ;1002719365;149.93;produtos importados;livros-e-papelaria
2775;Homem-Aranha: As Tiras Vol. 3 (1981-1982) ;1002719339;149.93;produtos importados;livros-e-papelaria
2776;CADERNO INTELIGENTE A5 BUTTERFLY ;1002635963;;produtos importados;livros-e-papelaria
2777;Mochila Pink Lol Taxi - Maxlog IS37971LO0310UN ;1002649537;110.86;produtos importados;livros-e-papelaria
2778;Mochila de Costas Infantil - Marvel - Homem-Aranha X1 - Xeryus ;1002658588;139.99;produtos importados;livros-e-papelaria
2779;Kit Cinema Com Almofada Balde Pipoca 2 Copos Santos ;1002629238;103.90;produtos importados;livros-e-papelaria
2780;Kit 6 Cadernos Naruto Shippuden Brochura Tamanho Peq. + Desenho e Cartografia Naruto ;1002646156;149.90;produtos importados;livros-e-papelaria
2781;Kit 5 Caderno Brochura Tam. Pequeno My Hero Academia Anime - Foroni ;1002646180;129.90;produtos importados;livros-e-papelaria
2782;Bolsa Trançada Bela Gaia Laranja ;1002717649;;produtos importados;livros-e-papelaria
2783;Bolsa Trançada Bela Gaia Bege ;1002717650;;produtos importados;livros-e-papelaria
2784;Bolsa Trançada Bela Gaia Verde ;1002717652;;produtos importados;livros-e-papelaria
2785;;;;produtos importados;livros-e-papelaria
2786;Kit 2 Cadernos Dragon Ball Super Espiral Goku 160 Folhas 10 Matérias ;1002581463;139.90;produtos importados;livros-e-papelaria
2787;Maleta para Notebook Targus Intellect Slim Briefcase 12.1 Preto - TBT248US-90 ;1002511554;130.29;produtos importados;livros-e-papelaria
2788;Mesa Projetora Kids - Art Brink ;1002489552;149.99;produtos importados;livros-e-papelaria
2789;Mochila de Costas Pack Me Unicórnio - Pacific ;1002581270;149.90;produtos importados;livros-e-papelaria
2790;Lancheira Lilica Ripilica Céu Azul 2023 ;1002605097;;produtos importados;livros-e-papelaria
2791;Kit 4 Caderno Hello Kitty Brochurão 80 Folhas 1 Matéria - São Domingos ;1002581535;149.90;produtos importados;livros-e-papelaria
2792;Mochila De Rodinhas Escolar T Rex Attack - Clio ;1002599387;;produtos importados;livros-e-papelaria
2793;MINI MOCHILA COM GLITTLER OFICIAL REBECCA BONBON ;1002448106;109.90;produtos importados;livros-e-papelaria
2794;Kit de Bolsa Maternidade Impermeável  Saída ;1002415146;129.90;produtos importados;livros-e-papelaria
2795;Kit 10 Capacete Bombeiro Infantil Adulto p/ Festa Fantasia Decoração e Aniversário ;1002404180;119.90;produtos importados;livros-e-papelaria
2796;Cantil Cavaleiros do Zodíaco ;1002398569;127.44;produtos importados;livros-e-papelaria
2797;Pasta Álbum Fichário Central 2x2 Pokémon Magic P/ 160 Cards ;1002310605;139.90;produtos importados;livros-e-papelaria
2798;Homem-Aranha: Tábula da Vida ;1002474359;104.93;produtos importados;livros-e-papelaria
2799;Superman: Vermelho e Azul ;1002474372;139.93;produtos importados;livros-e-papelaria
2800;Cantil Buck Garfield ;1002430722;132.90;produtos importados;livros-e-papelaria
2801;KIT MANTA + BALDE PIPOCA NARUTO - ZONA CRIATIVA ;1002384570;149.70;produtos importados;livros-e-papelaria
2802;Garrafinha Zoo Borboleta - Skip Hop ;1002339582;109.90;produtos importados;livros-e-papelaria
2803;Mochila De Costas Juvenil Oneill Sea Degrade Isibras ;1002385866;129.99;produtos importados;livros-e-papelaria
2804;Mochila Vermelho Pacific Carrinho ;1002386100;134.99;produtos importados;livros-e-papelaria
2805;Bolsa Transversal Among Us Crewmate ;1002141776;146.79;produtos importados;livros-e-papelaria
2806;BABY MESINHA EDUCATIVA LUZ SOM ;1002365201;148.89;produtos importados;livros-e-papelaria
2807;Mochila de Rodinha Monster High Scaris 6298100 Sestini ;1002384629;129.99;produtos importados;livros-e-papelaria
2808;Topper de Bolo Minecraft AuthenticGames Pra Festa de Aniversário ;1002410019;140.13;produtos importados;livros-e-papelaria
2809;Luminária Pote Stranger Things ;1002100427;129.90;produtos importados;livros-e-papelaria
2810;Quarteto Fantástico - Antologia ;1002150054;144.90;produtos importados;livros-e-papelaria
2811;Os Poderosos Vingadores - A Iniciativa Ultron ;1002150035;113.88;produtos importados;livros-e-papelaria
2812;Necessaire Lilica Ripilica Lov It Spotty ;1002117944;129.80;produtos importados;livros-e-papelaria
2813;Lancheira Pequena Sestini 2 em 1 20Y Futebol Azul ;1002659360;120.90;produtos importados;livros-e-papelaria
2814;Harry Potter e as Relíquias da Morte - J. K. Rowling (Capa Dura) ;1002142545;116.87;produtos importados;livros-e-papelaria
2815;Harry Potter e o Enigma do Príncipe - J. K. Rowling (Capa Dura) ;1002142523;110.37;produtos importados;livros-e-papelaria
2816;Ábaco Aberto de Pinos Professor Material Pedagógico Didático ;1002178084;119.90;produtos importados;livros-e-papelaria
2817;Bíblia Ilustrada Anote - NVT - Espiral ;100438510;104.90;produtos importados;livros-e-papelaria
2818;Mochila Liga da Justica Teen 01 - Xeryus ;100443363;119.88;produtos importados;livros-e-papelaria
2819;Garrafa De Água Portátil Cantil Em Forma Sorvete De Luxo Melancia ;1002412527;134.99;produtos importados;livros-e-papelaria
2820;Garrafa De Água Portátil Cantil Em Forma Sorvete De Luxo Chocolate ;1002412529;134.99;produtos importados;livros-e-papelaria
2821;Kit 20 Copos Ladybug Miraculous p/ Festa Infantil Lembrança Decoração ;1002185748;135.90;produtos importados;livros-e-papelaria
2822;Lousa Coelho Moulin Roty Les Jolis ;100263189;149.90;produtos importados;livros-e-papelaria
2823;Livro o Babeiro Salomão com Super Massa - Estrela ;100421197;132.59;produtos importados;livros-e-papelaria
2824;Kit 15 Copos Ladybug Miraculous p/ Festa Infantil Lembrança Decoração ;1002185736;109.90;produtos importados;livros-e-papelaria
2825;WIFI RALPH - QUEBRANDO A INTERNET - MELHORAMENTOS ;100240448;115.00;produtos importados;livros-e-papelaria
2826;SHIMMER AND SHINE - DUAS GEMEAS DEMAIS - MELHORAMENTOS ;100240456;134.90;produtos importados;livros-e-papelaria
2827;Caixa De Música Chicco Soft Cuddles Azul ;100237202;139.90;produtos importados;livros-e-papelaria
2828;Caderno de Anotações - Batman - Batman shadow ;1002113170;143.88;produtos importados;livros-e-papelaria
2829;Mochilete Escolar Dark Spider - Clio ;1002735543;144.53;produtos importados;livros-e-papelaria
2830;;;;produtos importados;livros-e-papelaria
2831;Mochila Infantil Personagens 42cm ;1002703825;;produtos importados;livros-e-papelaria
2832;Lancheira Térmica Cindy Luxcel Rosa ;1002693858;120.90;produtos importados;livros-e-papelaria
2833;Bolsa Pelúcia Mickey 22 cm: Disney ;1002563607;;produtos importados;livros-e-papelaria
2834;Mini Bolsa Pelúcia Mickey Coração Arco-Íris 20cm: Disney ;1002563562;;produtos importados;livros-e-papelaria
2835;Mochila Clio Style Executiva ;1002602268;118.90;produtos importados;livros-e-papelaria
2836;Bolsa Preta Assinatura Rosto Minnie: Disney ;1002563574;;produtos importados;livros-e-papelaria
2837;Bolsa Laço Minnie: Disney ;1002563572;;produtos importados;livros-e-papelaria
2838;Bolsa Transversal Minnie Lantejoulas 30x21cm: Disney ;1002563552;;produtos importados;livros-e-papelaria
2839;Bolsa Preta Minnie Raio X: Disney ;1002563575;;produtos importados;livros-e-papelaria
2840;Bolsa Térmica Preta Minnie: Disney ;1002563522;;produtos importados;livros-e-papelaria
2841;Star Wars - Kit Manta com Balde The Child Baby Yoda ;1002404690;;produtos importados;livros-e-papelaria
2842;Almofada de Amamentação Travesseiro Mamãe Bebê Menina Menino ;1002415072;145.41;produtos importados;livros-e-papelaria
2843;Mochila Maternidade Grande Carinho Bebê Menino ou Menina ;1002415118;129.90;produtos importados;livros-e-papelaria
2844;Mochila Maternidade Grande Carinho Bebê Menino ou Menina ;1002415123;129.90;produtos importados;livros-e-papelaria
2845;Mochila Maternidade Grande Carinho Bebê Menino ou Menina ;1002415129;129.90;produtos importados;livros-e-papelaria
2846;Mochila Maternidade Grande Carinho Bebê Menino ou Menina ;1002415140;129.90;produtos importados;livros-e-papelaria
2847;Mochila Maternidade Grande Carinho Bebê Menino ou Menina ;1002415137;129.90;produtos importados;livros-e-papelaria
2848;Mochila Maternidade Grande Carinho Bebê Menino ou Menina ;1002415103;129.90;produtos importados;livros-e-papelaria
2849;MOCHILA DESCENDENTES G 30140 - DERMIWIL ;100523623;;produtos importados;livros-e-papelaria
2850;Cofre Taca Campeão - Bem Infantil ;100367981;143.88;produtos importados;livros-e-papelaria
2851;Almofada de Amamentação com Travesseiro - Buba ;100500106;102.39;produtos importados;livros-e-papelaria
2852;Mochila Xiaomi Casual Daypack Mi Impermeável 10L Preta - XM328PRE ;1002727218;149.90;produtos importados;livros-e-papelaria
2853;Chinelo Central Perk ;1002121528;104.90;produtos importados;livros-e-papelaria
2854;BRINQUEDO EDUCATIVO MESINHA ENCANTADA ;1002358752;;produtos importados;livros-e-papelaria
2855;Kit Caderno Inteligente Bianco e Refil Pautado Grande ;1002161546;149.00;produtos importados;livros-e-papelaria
2856;Kit Caderno Inteligente Basic Black e Refil Pautado Grande ;1002161544;149.00;produtos importados;livros-e-papelaria
2857;MOCHILA ESCOLAR COLORS NEON MD 1BOLSO (COR SORTIDA 1 UND) ;1002344773;;produtos importados;livros-e-papelaria
2858;ESTOJO TECIDO NYLON GD 3ZIPERES VERDE AGUA ;1002344730;;produtos importados;livros-e-papelaria
2859;Caderno Inteligente Grande Bianco ;1002161554;119.50;produtos importados;livros-e-papelaria
2860;Caderno Inteligente Grande Rose Pastel ;1002149261;119.50;produtos importados;livros-e-papelaria
2861;Caderno Inteligente Grande Arco Íris Pastel ;1002161545;129.50;produtos importados;livros-e-papelaria
2862;Coleção Infantil Conhecendo a Deus ;100260234;131.10;produtos importados;livros-e-papelaria
2863;Luminária Te Amo K Pop ;100456016;110.90;produtos importados;livros-e-papelaria
2864;Pilha Duracell Recarregável AAA 4 unidades ;100332794;138.96;produtos importados;livros-e-papelaria
2865;Caixa Correspondencia Tripla Movel Fume - Waleu ;1002736641;102.99;produtos importados;livros-e-papelaria
2866;Mochila de Costa Juvenil Grande Big Shark Azul Sestini ;1002736493;109.99;produtos importados;livros-e-papelaria
2867;Mochila de Rodinha Baby Ballet 33514 Winth ;1002736498;106.99;produtos importados;livros-e-papelaria
2868;Caderno Inteligente Pequeno A5 80 Folhas Poa Anna ;1002736569;107.99;produtos importados;livros-e-papelaria
2869;Kit 2 Caderno Brochurão Capa Dura One Piece 80 Folhas - Tilibra ;1002735913;109.90;produtos importados;livros-e-papelaria
2870;Mochila Lisa Preta da Winth + Garrafinha da Netflix Cor:Preto ;1002736081;109.99;produtos importados;livros-e-papelaria
2871;Mochila Lisa Preta Winth + Kit Netflix Shoulder Bag +Garrafa Cor:Preto ;1002736080;129.99;produtos importados;livros-e-papelaria
2872;Kit Mochila Lisa Preta Winth + Garrafa Netflix Perfil Cor:Preto ;1002736082;109.99;produtos importados;livros-e-papelaria
2873;Lustre Metalizado Dourado 40X125 ;1002724480;103.73;produtos importados;livros-e-papelaria
2874;Saco Metal 50X70 Encontro - 25 Un ;1002724352;124.81;produtos importados;livros-e-papelaria
2875;Lousa - Primeiros Desenhos - Brinqmutti ;1002722018;142.79;produtos importados;livros-e-papelaria
2876;Coleção Minhas Primeiras Palavras - Trílingue - Kit com 4 Livros ;1002720618;119.60;produtos importados;livros-e-papelaria
2877;Kit Caderno Brochurao Sonic + Desenho 80Fls Sortidos - Tilibra ;1002723213;109.90;produtos importados;livros-e-papelaria
2878;Kit 2 Cadernos Brochurão Sonic 80Fls - Tilibra ;1002723231;109.90;produtos importados;livros-e-papelaria
2879;Kit Caderno Espiral Minecraft + Caderno Desenho Minecraft ;1002723220;109.90;produtos importados;livros-e-papelaria
2880;Coleção Meu Primeiro Livro -  Kit com 4 Livros ;1002720619;119.60;produtos importados;livros-e-papelaria
2881;Livro Atlas de Dinossauros e Animais Pré-Históricos ;1002699303;103.50;produtos importados;livros-e-papelaria
2882;Livro Na Fazenda: Livro Com Quebra-Cabeça ;1002699262;109.60;produtos importados;livros-e-papelaria
2883;Livro Mordisco - O guia dos dinossauros ;1002700125;109.60;produtos importados;livros-e-papelaria
2884;Livro Animais do Mundo: Livro com quebra-cabeça ;1002694885;109.60;produtos importados;livros-e-papelaria
2885;Livro Jane, a raposa e eu ;1002701431;109.60;produtos importados;livros-e-papelaria
2886;Livro Mordisco - A caçada monstruosa ;1002699717;109.60;produtos importados;livros-e-papelaria
2887;Livro Turma da Mônica Folclore Brasileiro ;1002691298;115.70;produtos importados;livros-e-papelaria
2888;Livro Os pets ;1002698298;118.20;produtos importados;livros-e-papelaria
2889;Kit 3 Cadernos Fortnite Brochurão + Desenho Sortido - Foroni ;1002723223;149.90;produtos importados;livros-e-papelaria
2890;Kit 2 Cadernos Brochurao + 1 Brochura Pequeno Carros 80Fls Sortidos - Foroni ;1002723242;119.90;produtos importados;livros-e-papelaria
2891;Mochila Costas Simpsons Emoticons - Pacific 7402205 ;1002723204;139.90;produtos importados;livros-e-papelaria
2892;Kit 4 Cadernos Espiral Frozen II 80 Fls - Jandaia ;1002723163;139.90;produtos importados;livros-e-papelaria
2893;Mochila Pack Me Roar ;1002649819;119.80;produtos importados;livros-e-papelaria
2894;Kit 2 Cadernos Espiral Universitario Minecraft 80 Folhas Foroni ;1002723244;108.90;produtos importados;livros-e-papelaria
2895;Mochila Rodinha Subway Surfers Grande - Santino ;1002723175;139.90;produtos importados;livros-e-papelaria
2896;Kit 2 Cadernos Playstation Brochurão Capa Dura 80Fls - Tilibra ;1002723262;119.90;produtos importados;livros-e-papelaria
2897;Colar Mamães Crianças Filhos Coração Folheado A Ouro 18k ;1002715844;139.90;produtos importados;livros-e-papelaria
2898;Colar Mamães Crianças Filhos Coração Folheado A Ouro 18k ;1002715807;139.90;produtos importados;livros-e-papelaria
2899;Colar e Pingente Filhos  - 1 Casal ou 2 Meninas ou 2 Meninos ;1002715854;104.90;produtos importados;livros-e-papelaria
2900;Colar e Pingente Filhos  - 1 Casal ou 2 Meninas ou 2 Meninos ;1002715815;104.90;produtos importados;livros-e-papelaria
2901;Colar Mamães Crianças Filhos Coração Folheado A Ouro 18k ;1002715858;139.90;produtos importados;livros-e-papelaria
2902;MOCHILA CAMUFLADO G (CORES SORTIDAS) IMAGENS ILUSTRATIVAS ;1002633664;;produtos importados;livros-e-papelaria
2903;MOCHILA UP4YOU GOOD 4 U GD AZ ;1002629082;;produtos importados;livros-e-papelaria
2904;MESINHA EDUCATIVA ESTUDOS BRANCA DE NEVE PRINCESAS COM PORTA LAPIS ROSA MENINAS ;1002621454;109.99;produtos importados;livros-e-papelaria
2905;LANCHEIRA TERMICA BATMAN MAO/COSTAS PT ;1002691080;;produtos importados;livros-e-papelaria
2906;Lacheira Infantil Escolar Hulk 38003 - Verde - Luxcel ;1002605326;100.41;produtos importados;livros-e-papelaria
2907;Estojo Escolar Capricho c/2 Divisórias - Dermiwil ;1002605286;122.98;produtos importados;livros-e-papelaria
2908;Mochilete Escolar Trex Atack - Clio ;1002605357;143.74;produtos importados;livros-e-papelaria
2909;Livro MegaDino: Estegossauro ;1002701387;146.20;produtos importados;livros-e-papelaria
2910;LANCHEIRA TERMICA PACK ME ADVENTURE REX ;1002691083;;produtos importados;livros-e-papelaria
2911;LANCHEIRA TERMICA NARUTO KURAMA ;1002691081;;produtos importados;livros-e-papelaria
2912;Livro A orquestra do penico ;1002697553;102.30;produtos importados;livros-e-papelaria
2913;Rosa Holográfica No Bad Days Glitter - Seanite MI40481 ;1002649590;137.82;produtos importados;livros-e-papelaria
2914;Roxa Holográfica No Bad Days Glitter Mochila - Seanite MI40 ;1002649597;137.82;produtos importados;livros-e-papelaria
2915;Kit 10 Caneca Infantil Hulk Giratória Decoração Festa Infantil ;1002549889;149.99;produtos importados;livros-e-papelaria
2916;Kit 10 Caneca Giratória Homem Aranha Decoração Festa Infantil ;1002549887;149.99;produtos importados;livros-e-papelaria
2917;Kit 10 Garrafas de Foguete Unicórnio para Festa Infantil e Decoração ;1002549893;127.99;produtos importados;livros-e-papelaria
2918;Caderno Brochurão Baby Shark 40fls Foroni ;1002646123;129.90;produtos importados;livros-e-papelaria
2919;Caderno Brochurinha Pequeno Baby Shark 96fls Foroni ;1002646128;129.90;produtos importados;livros-e-papelaria
2920;Kit 4 Cadernos Naruto Shippuden Brochurinha + Desenho e Cartografia Naruto ;1002646181;129.90;produtos importados;livros-e-papelaria
2921;CADERNO INTELIGENTE A5 ONYX ;1002635961;;produtos importados;livros-e-papelaria
2922;CADERNO INTELIGENTE A5 NEW YORK ;1002635962;;produtos importados;livros-e-papelaria
2923;CADERNO INTELIGENTE MEDIO BUTTERFLY ;1002635922;;produtos importados;livros-e-papelaria
2924;CADERNO INTELIGENTE A5 PARIS ;1002635940;;produtos importados;livros-e-papelaria
2925;CADERNO INTELIGENTE A5 SILVER LOVE ;1002635943;;produtos importados;livros-e-papelaria
2926;CADERNO INTELIGENTE A5 AGATHA ;1002635935;;produtos importados;livros-e-papelaria
2927;CADERNO INTELIGENTE MEDIO ONYX ;1002635924;;produtos importados;livros-e-papelaria
2928;CADERNO INTELIGENTE A5 BLACK 80FLS. ;1002635956;;produtos importados;livros-e-papelaria
2929;LANCHEIRA TERMICA TOY STORY MAO/COSTAS AZ ;1002631557;;produtos importados;livros-e-papelaria
2930;ESTOJO PVC MICKEY Y TRIPLO ;1002631396;;produtos importados;livros-e-papelaria
2931;LANCHEIRA TERMICA DRAGON BALL Z AZUL ;1002631553;;produtos importados;livros-e-papelaria
2932;MOCHILA UP4YOU GOOD 4 U GD VD ;1002629091;;produtos importados;livros-e-papelaria
2933;MOCHILA FLORAL G  (CORES SORTIDAS 1 UND) ;1002629151;;produtos importados;livros-e-papelaria
2934;MOCHILA UP4YOU GOOD 4 U GD MR ;1002629080;;produtos importados;livros-e-papelaria
2935;MOCHILA INFANTIL PINGUIM MD PRETA ;1002628233;;produtos importados;livros-e-papelaria
2936;MOCHILA AUTHENTIC G (CORES SORTIDAS 1 UND) ;1002628324;;produtos importados;livros-e-papelaria
2937;Mochila De Costas Escolar Mcqueen Lipstick Preto ;1002610724;119.99;produtos importados;livros-e-papelaria
2938;Liga da Justiça Por George Perez (DC Vintage) ;1002496085;139.90;produtos importados;livros-e-papelaria
2939;Patrulha Canina Lousa Divertida FUN F0090-5 ;1002484042;119.90;produtos importados;livros-e-papelaria
2940;Kit 3 Cadernos Naruto Shippuden Brochurão 80 Fls Naruto São Domingos ;1002581565;117.90;produtos importados;livros-e-papelaria
2941;Kit 2 Caderno Venom Espiral 160 Folhas 10 Matérias São Domingos ;1002581323;149.90;produtos importados;livros-e-papelaria
2942;Kit 4 Caderno Star Wars Espiral Ordem 96fls Jandaia Sortido ;1002581529;149.90;produtos importados;livros-e-papelaria
2943;Kit 2 Cadernos Hello Kitty Brochurão 80Fls + 1 Caderno Desenho Hello Kitty ;1002581478;129.90;produtos importados;livros-e-papelaria
2944;Kit 4 Caderno Marvel Now Brochurinha 80 Folhas Vingadores ;1002581444;119.90;produtos importados;livros-e-papelaria
2945;Caderno Inteligente Butterfly Medio By Barbara Bandeira ;1002547068;148.99;produtos importados;livros-e-papelaria
2946;MOCHILA EM VINIL TRANSPARENTE COM BOLSA INTERNA PRETA  PAGANI LD1931 ;1002451252;129.74;produtos importados;livros-e-papelaria
2947;Garrafa Built Hogwarts - Harry Potter ;1002430709;136.37;produtos importados;livros-e-papelaria
2948;Homem-Aranha: Tábula da Vida ;1002430741;149.90;produtos importados;livros-e-papelaria
2949;Batman por Tom King - Vol.05 ;1002430728;107.88;produtos importados;livros-e-papelaria
2950;Mochila Neon Transparente com bolsa Removível CLIO CG3412 ;1002520928;129.90;produtos importados;livros-e-papelaria
2951;Tarzan - A Volta do rei das Selvas e Outras Histórias - Vol.1 ;1002430717;100.80;produtos importados;livros-e-papelaria
2952;Caixinha Dente De Leite Sous Mon Baobab Elefante Moulin Roty ;1002434499;149.90;produtos importados;livros-e-papelaria
2953;Kit É Só Um Bolinho Turma da Mônica Decoração Com 89 Peças ;1002409756;105.90;produtos importados;livros-e-papelaria
2954;Painel Festa Infantil em TNT Cinderela Para Aniversário ;1002410239;126.14;produtos importados;livros-e-papelaria
2955;Copo Descartável Personalizado Dragon Ball pra Festa de Aniversário ;1002410072;133.00;produtos importados;livros-e-papelaria
2956;Forminhas Para Doces Dragon Ball de Aniversário ;1002410189;126.08;produtos importados;livros-e-papelaria
2957;Painel Festa Infantil em TNT Os Carros Para Aniversário ;1002409694;126.14;produtos importados;livros-e-papelaria
2958;Harry Potter - Tapete Capacho Welcome Hogwarts ;1002404684;;produtos importados;livros-e-papelaria
2959;;;;produtos importados;livros-e-papelaria
2960;Lanternas Verdes - A Revolta dos Lanternas Alfa ;1002390435;124.90;produtos importados;livros-e-papelaria
2961;Decoração de Halloween 12 Apliques Para Tubetes e Caixinhas ;1002409915;127.79;produtos importados;livros-e-papelaria
2962;Decoração Mesa de Convidados Aniversario Princesas Carruagem 3D em EVA ;1002410047;126.08;produtos importados;livros-e-papelaria
2963;Máscara de Bruxa com Óculos pra Fantasia de Halloween ;1002409999;148.06;produtos importados;livros-e-papelaria
2964;Tiara Diabinho Para Fantasia de Halloween e Carnaval ;1002409873;127.79;produtos importados;livros-e-papelaria
2965;Festa Pop It Adesivos Redondo para Decorar Tubetes e Caixa Acrílica de Aniversário ;1002409770;148.06;produtos importados;livros-e-papelaria
2966;Topper Docinho Minnie Vermelha Para Festa de Aniversário Infantil ;1002410149;119.01;produtos importados;livros-e-papelaria
2967;Topo de Bolo Free Fire Topper Para Festa de Aniversário Menino ;1002410231;140.13;produtos importados;livros-e-papelaria
2968;Topo de Bolo Minnie Vermelha Para Festa de Aniversário Infantil ;1002410026;140.13;produtos importados;livros-e-papelaria
2969;Vingadores - Os Vingadores do Amanhã ;1002151895;104.00;produtos importados;livros-e-papelaria
2970;Lanterna Verde - A Vingança dos Lanternas Verdes ;1002151877;106.00;produtos importados;livros-e-papelaria
2971;DC: Explorando Gotham ;1002151848;149.90;produtos importados;livros-e-papelaria
2972;Superman - Pelo Amanhã ;1002151894;106.00;produtos importados;livros-e-papelaria
2973;Os Novos Vingadores - A Era Heróica ;1002151899;109.90;produtos importados;livros-e-papelaria
2974;Giz Líquido Tons Pasteis Linha Soul 6 Cores Sortidas - Brw ;1002315437;143.88;produtos importados;livros-e-papelaria
2975;As Historias da Baía - Vol.02 ;1002150463;109.90;produtos importados;livros-e-papelaria
2976;Capitão America - Renascimento ;1002149930;122.90;produtos importados;livros-e-papelaria
2977;Homem de Ferro - Essência do Medo ;1002149956;140.00;produtos importados;livros-e-papelaria
2978;Invasores - Fantasmas de Guerra ;1002150251;101.90;produtos importados;livros-e-papelaria
2979;Capitão América: Antologia ;1002149991;141.90;produtos importados;livros-e-papelaria
2980;Homem-Aranha: As Tiras Vol.02 (1979-1981) ;1002151022;149.90;produtos importados;livros-e-papelaria
2981;X-Men - Aliança Falange ;1002150017;124.90;produtos importados;livros-e-papelaria
2982;Batman - Corporação Batman ;1002150534;104.90;produtos importados;livros-e-papelaria
2983;O Espetacular Homem-Aranha - Vol.10 - De Volta à Vida ;1002150217;101.88;produtos importados;livros-e-papelaria
2984;Thor - Antologia ;1002150120;129.90;produtos importados;livros-e-papelaria
2985;Mochila Infantil escolar para criança Feminina  com Paetê Prata Clio ;1002108482;119.99;produtos importados;livros-e-papelaria
2986;Luminária Pote Friends ;1002100419;129.90;produtos importados;livros-e-papelaria
2987;Planner Vermelho Hogwarts Classic ;1002119556;129.90;produtos importados;livros-e-papelaria
2988;Mini Cantil Max Homem de Ferro  Marvel ;1002121478;129.90;produtos importados;livros-e-papelaria
2989;Mini Cantil Max Spirit of Play ;1002121479;129.90;produtos importados;livros-e-papelaria
2990;Bolsa Pochete Zoo Borboleta Skip Hop ;100557700;129.90;produtos importados;livros-e-papelaria
2991;Luminária Cactus Verde ;100556186;119.90;produtos importados;livros-e-papelaria
