;name;SKU;price;department;sector
521;Kit Higiene Espelho Potes, Molhadeira e Capa Branco ;1002557399;99.00;baby;banho-e-higiene
522;Garrafa Térmica E Molhadeira ;1002557417;89.00;baby;banho-e-higiene
523;Kit Higiene Espelho Potes, Molhadeira e Capa Rosa ;1002557403;99.00;baby;banho-e-higiene
524;ESCOVA DENTAL CHICCO ELETRICA 1UN INFANTIL AZUL+REFIL ;1002509156;;baby;banho-e-higiene
525;Toalha de Banho de bebe Forrada com Mesversário Azul ;1002491609;88.90;baby;banho-e-higiene
526;Redutor de Assento Infantil Nuvem Colorido -  Buba ;1002457475;93.90;baby;banho-e-higiene
527;Toalha de Banho bebe Capuz Bordada e Forrada c/ Fralda Rosa ;1002491598;90.90;baby;banho-e-higiene
528;Banheira Babytub Evolution - De 0 a 8 Meses - Rosa - Baby Tub ;100129094;119.90;baby;banho-e-higiene
529;Banheira Babytub Evolution - De 0 a 8 Meses - Azul - Baby Tub ;100129093;119.90;baby;banho-e-higiene
530;Kit Burigotto - Banheira Rígida e Assento para Banheira ;1002530631;122.90;baby;banho-e-higiene
531;Pipinela - Patrulha Canina ;1002719081;114.99;baby;banho-e-higiene
532;Assento Redutor Infantil Dican com Escada Colorida e Apoio para As Mãos ;100468258;114.90;baby;banho-e-higiene
533;;;;baby;banho-e-higiene
534;Pipinela Peppa ;1002718642;114.99;baby;banho-e-higiene
535;;;;baby;banho-e-higiene
536;TRONINHO RECIPIENTE REMOVÍVEL AZUL ;1002314535;;baby;banho-e-higiene
537;Toalha de Banho Hug Com Capuz Amor de Mãe Bege ;1002705586;109.90;baby;banho-e-higiene
538;Toalha de Banho Hug Com Capuz Voando Entre Nuvens ;1002705589;109.90;baby;banho-e-higiene
539;Toalha de Banho Hug Baby Lion Off White ;1002705669;104.90;baby;banho-e-higiene
540;Fralda Babysec Galinha Pintadinha Ultrasec M 26 Unids ;1002635370;101.29;baby;banho-e-higiene
541;FRALDA BABYSEC ULTRASEC XG 60 UNIDADES ;1002635362;101.29;baby;banho-e-higiene
542;Fralda Babysec Premium M 96 Unidades ;1002634453;144.59;baby;banho-e-higiene
543;Fraldas Pampers Confort Sec XG 54 Un ;1002645254;110.68;baby;banho-e-higiene
544;Toalha De Banho Bebê Soft Com Capuz Primavera Papi ;1002327654;137.90;baby;banho-e-higiene
545;Almofada de Banho Rosa para Bebê - Buba 7277 ;1002423209;139.90;baby;banho-e-higiene
546;Assento Redutor - Kababy - Escada - Azul ;1002339647;143.90;baby;banho-e-higiene
547;Assento Redutor - Kababy - Escada - Cinza ;1002339666;143.90;baby;banho-e-higiene
548;Banheira Inflável Para Bebê Pratica Compacta Baleia Feliz De 6 Meses a 2 Anos Buba ;1002566028;134.99;baby;banho-e-higiene
549;Fralda Descartável - Mili Love&Care - Tam: M - 3 Pacotes c/ 26 Unidades ;100568676;127.12;baby;banho-e-higiene
550;Fralda Descartável - Mili Love&Care  - Tam: XG - 3 Pacotes com 22 Unidades ;100568675;127.12;baby;banho-e-higiene
551;Almofada Banho Importway Bebê Rosa ;100444969;149.99;baby;banho-e-higiene
552;Troninho Infantil Voyage Ploc Cinza 18M+ CAX00547 ;1002694437;104.99;baby;banho-e-higiene
553;Kit Manicure Eletrico Portátil Para Bebês e Adultos Com 5 Lixas e 1 Polidor KaBaby Cor:Rosa ;1002608306;85.00;baby;banho-e-higiene
554;Pipinela Patrulha Canina - Elka 1095 ;1002552144;106.36;baby;banho-e-higiene
555;Rede Protetora De Banho Banheira Bebê +0 Meses Infantil Redutor Kababy Cor:Azul ;1002618635;109.90;baby;banho-e-higiene
556;;;;baby;banho-e-higiene
557;Kit Higiene Chicco Tesoura e Pente e Escova Cerdas Naturais ;1002472332;;baby;banho-e-higiene
558;Fralda Pampers Confort Sec Tam. Xg 11 A 15Kg - 54 Unidades ;1002638541;103.00;baby;banho-e-higiene
559;ASSENTO REDUTOR DE VASO SANITÁRIO INFANTIL BW073 ;1002414179;109.90;baby;banho-e-higiene
560;Fralda de Muslin Balões Stephen Joseph ;1002723965;149.90;baby;banho-e-higiene
561;Viseira Protetora para Banho Baleia Moby Skip Hop ;1002311690;149.90;baby;banho-e-higiene
562;Brinquedo de Banho Unicórnio e Raposa SKIP HOP ;1002702039;109.38;baby;banho-e-higiene
563;Fralda Pampers Pants Ajuste Total Hiper G 52 unidades ;1002685781;113.90;baby;banho-e-higiene
564;Fralda Confort Sec Pampers Tamanho G com 60 Fraldas ;1002646788;103.00;baby;banho-e-higiene
565;Troninho Pipinico Baby Land - Cardoso -  MENINAS ;1002094344;120.73;baby;banho-e-higiene
566;Almofada para Banho Infantil Bebê Importway ;100428980;109.99;baby;banho-e-higiene
567;COMBO REPELENTE - 2 SAI MOSQUITO + 1 POST PICADA - BABYDEAS ;1002662132;105.99;baby;banho-e-higiene
568;Almofada de Banho Bebê Ergonomica Com Travas de Segurança Fofinha Kababy Azul ;1002566257;156.42;baby;banho-e-higiene
569;;;;baby;banho-e-higiene
570;5 POST PICADA - CALMANTE DE PICADAS EM ADESIVO 20UN BABYDEAS ;1002662139;149.95;baby;banho-e-higiene
571;3 PÓS SOL INFANTIL REFRESCANTE - 150ML - BABYDEAS ;1002662135;119.99;baby;banho-e-higiene
572;Roupão Aveludado Quimono Patrulha Canina PP Lepper Azul 7801 ;1002681560;124.90;baby;banho-e-higiene
573;Baleia Moby para Enxágue Skip Hop Azul ;1002573689;139.99;baby;banho-e-higiene
574;Toalha com Capuz Super Absorvente Pink - Ecokids Place ;1002604028;109.70;baby;banho-e-higiene
575;REDUTOR DE ASSENTO ARCO-IRIS - 12315 ;1002438525;109.00;baby;banho-e-higiene
576;Roupão Microfibra Camesa Azul ;1002715721;;baby;banho-e-higiene
577;AGUA PERFUMADA SUAVE PARA PELE DELICADA 100ML - CHICCO ;1002712758;139.90;baby;banho-e-higiene
578;Roupão Microfibra Camesa Laranja ;1002715724;;baby;banho-e-higiene
579;Refil Sacos Lixeira Magica Lixo Anti-odor Kababy Cor:Branco ;1002711845;109.90;baby;banho-e-higiene
580;Kit Higiene Completo Cuidados do Bebê Safety 1st 0+ meses Cor:Verde Acqua ;1002708880;109.90;baby;banho-e-higiene
581;Roupão Infantil Manga Curta Atoalhado com Capuz Ursinho Marinho Everly ;1002693820;;baby;banho-e-higiene
582;Roupão Infantil Manga Curta Atoalhado com Capuz Ursinho Rosa Everly ;1002693817;;baby;banho-e-higiene
583;Roupão Infantil Manga Curta Atoalhado com Capuz Ursinho Marinho Everly ;1002693818;;baby;banho-e-higiene
584;Escadinha Infantil com Dois Degraus Recomendado A Partir 3 Anos Clingo Cor:Azul ;1002617227;118.00;baby;banho-e-higiene
585;Toalha com Capuz Super Absorvente Royal - Ecokids Place ;1002604045;109.70;baby;banho-e-higiene
586;BRINQUEDO PARA HORA DO BANHO INFANTIL BEBE MENINO MENINA KIT 4 LIVRINHOS EDUCATIVO BUBA ;1002559963;118.00;baby;banho-e-higiene
587;KIT 4 ESCOVAS MAM DE DENTES INFANTIL PARA BEBES MACIA CABO ERGONOMICO EMBALAGEM Cor:Rosa 5+ Meses / Azul 5+ Meses ;1002655039;110.00;baby;banho-e-higiene
588;KIT 4 ESCOVAS MAM DE DENTES INFANTIL PARA BEBES MACIA CABO ERGONOMICO EMBALAGEM Cor:Rosa 5+ Meses / Rosa 6+ Meses ;1002655040;110.00;baby;banho-e-higiene
589;KIT 2 LIVRINHOS EDUCATIVO E 1 LETRAS E NÚMEROS BRINQUEDO PARA HORA DO BANHO INFANTIL BEBE MENINO MENINA BUBA Cor:Fundo M ;1002559964;115.00;baby;banho-e-higiene
590;KIT 2 LIVRINHOS EDUCATIVO E 1 LETRAS E NÚMEROS BRINQUEDO PARA HORA DO BANHO INFANTIL BEBE MENINO MENINA BUBA Cor:Fundo M ;1002559976;115.00;baby;banho-e-higiene
591;KIT 2 LIVRINHOS EDUCATIVO E 1 LETRAS E NÚMEROS BRINQUEDO PARA HORA DO BANHO INFANTIL BEBE MENINO MENINA BUBA Cor:Um Dia ;1002559968;115.00;baby;banho-e-higiene
592;BANHEIRA ANATOMICA PORTATIL DOBRAVEL ROSA - CLINGO ;100402843;149.00;baby;banho-e-higiene
593;Kit cuidados Baby com estojo - Buba ;100313258;119.99;baby;banho-e-higiene
594;Almofada de Banho Sosseguinho Menina Multikids Baby - BB1050 ;100312965;120.90;baby;banho-e-higiene
595;Almofada Para Banho Bebê Com Fivela Ajustável Rosa Buba ;100225229;149.99;baby;banho-e-higiene
596;Almofada Para Banho Bebê Com Fivela Ajustável Azul Buba ;100225231;144.99;baby;banho-e-higiene
597;Roupão com Capuz Bordado Azul Cachorrinho - Fisher-Price ;1002604046;112.50;baby;banho-e-higiene
598;Kit Higiene Espelho Potes, Molhadeira e Capa Passarinho Dourado ;1002557400;109.00;baby;banho-e-higiene
599;Potes E Garrafa Térmica Náutico ;1002557468;139.00;baby;banho-e-higiene
600;Potes, Garrafa E Molhadeira Com Capa Vermelha (Conj. 4 Peças) ;1002557473;139.00;baby;banho-e-higiene
601;Kit Higiene Espelho Potes, Molhadeira, Porta Álcool-Gel e Capa Coroa Azul ;1002557408;149.00;baby;banho-e-higiene
602;Potes, Molhadeira e Porta Álcool-Gel Com Capa Cavalinho Prata ;1002557435;119.00;baby;banho-e-higiene
603;Potes, Molhadeira e Porta Álcool-Gel Cavalinho Prata ;1002557443;109.00;baby;banho-e-higiene
604;Kit Higiene Espelho Potes, Molhadeira, Porta Álcool-Gel e Capa Flor de Liz Rosa ;1002557503;149.00;baby;banho-e-higiene
605;Potes E Garrafa Com Capa Verde (Conj. 3 Peças) ;1002557472;129.00;baby;banho-e-higiene
606;Kit de Cuidados para Bebê com Estojo Neutro - Buba ;1002449479;134.60;baby;banho-e-higiene
607;Kit Lixa de Unha Elétrico Buba ;1002421579;109.90;baby;banho-e-higiene
608;Banheira - Bebê -  Plástico - Galzerano - Acqua Trio - Branca ;100304066;188.90;baby;banho-e-higiene
609;Banheira Retrátil Easy Bath Rosa Multikids Baby- BB1222 ;1002656304;159.22;baby;banho-e-higiene
610;Fisher-Price - Baby - Troninho 3 em 1 - Mattel ;100412500;188.99;baby;banho-e-higiene
611;Troninho 3 em 1 - Fisher-Price - Rosa - 33 cm ;1002095782;179.99;baby;banho-e-higiene
612;Kit Burigotto - Banheira Rígida, Assento para Banheira e Saboneteira ;1002530137;167.90;baby;banho-e-higiene
613;Fralda-Calça MamyPoko Dia e Noite XG 104 Unidades ;1002529186;186.90;baby;banho-e-higiene
614;Fralda Babysec Premium Xg 72 Unidades ;1002635358;184.79;baby;banho-e-higiene
615;Suporte para Banheira - Burigotto ;100110088;185.81;baby;banho-e-higiene
616;Assento Redutor Infantil Antiderrapante Com Escada, Buba ;1002650445;;baby;banho-e-higiene
617;Baby Bath Johnsons Soothing Vaporr ;1002450630;;baby;banho-e-higiene
618;Sabonete Liquido P/ baby  Whash & Shampoo Cetaphil 230 ml ;1002416694;;baby;banho-e-higiene
619;Banheira Inflável Infantino Baleia ;1002535362;199.99;baby;banho-e-higiene
620;Fralda Descartável Mili Giga Love & Care Premium   Tam: XXG - 80 fraldas ;1002709155;156.20;baby;banho-e-higiene
621;Fralda Babysec Premium G 96 Unidades ;1002635369;184.79;baby;banho-e-higiene
622;Fralda Babysec Ultrasec Xg 72 Unidades ;1002634450;150.49;baby;banho-e-higiene
623;Fralda Babysec Premium M 108 Unidades ;1002635376;184.79;baby;banho-e-higiene
624;Fraldas Babysec UltraSec Galinha Pintadinha Jumbinho G 128 Unidades ;1002529197;159.90;baby;banho-e-higiene
625;Kit 4 Fraldas Ecológicas Happy Flute - Bichinhos Safari ;1002388026;159.90;baby;banho-e-higiene
626;Kit 4 Fraldas Ecológicas Happy Flute - Unicórnio ;1002388032;159.90;baby;banho-e-higiene
627;Kit 4 Fraldas Ecológicas Happy Flute - Leãozinho Marrom ;1002388028;159.90;baby;banho-e-higiene
628;Kit 4 Fraldas Ecológicas Happy Flute - Carneirinhos ;1002388030;159.90;baby;banho-e-higiene
629;Assento Redutor - Escada - Kababy - Dobrável - até 50 Kg - Rosa ;1002324420;163.90;baby;banho-e-higiene
630;Fralda Descartável - Mili Love & Care - Tam:XXG  - 4 Pacotes c/20 Unidades ;100580977;166.40;baby;banho-e-higiene
631;Assento Redutor Infantil Com Escada Para Vaso Sanitário 1+ Ano Até 40 kg Dobrável Rosa e Azul Buba ;1002615661;174.99;baby;banho-e-higiene
632;Redutor de Assento com Escada Azul - Pimpolho ;1002721261;172.98;baby;banho-e-higiene
633;Vapor Bath Johnson´s 400ML ;1002724304;179.90;baby;banho-e-higiene
634;Banheira inflável bebê ;1002703193;189.99;baby;banho-e-higiene
635;Assento Redutor Infantil Com Escada Para Vaso Sanitário 1+ Ano Até 40 kg Dobrável Buba Cor:Azul e Verde ;1002616319;174.00;baby;banho-e-higiene
636;Pomada Desitin Azul Prevençao bisnaga 113 gr ;1002694180;169.00;baby;banho-e-higiene
637;TRONINHO INFANTIL FAZENDA MUSICAL  PRIME BABY - ROSA ;1002621641;166.92;baby;banho-e-higiene
638;Troninho Safety 1st Flex Potty 3 em 1 com Redutor para Assento ;1002609118;199.90;baby;banho-e-higiene
639;Assento Redutor Infantil Com Escada Para Vaso Sanitário 1+ Ano Até 40 kg Dobrável Rosa Buba ;1002615655;174.99;baby;banho-e-higiene
640;Troninho Kingdom Potty 3 in 1 Safety 1st - Blue ;100527079;151.90;baby;banho-e-higiene
641;Kit 5 Liner Forrinho Biodegradável Fralda Ecológica 50 folhas ;1002559684;169.00;baby;banho-e-higiene
642;Fraldas Babysec Premium Galinha Pintadinha Jumbinho M 144 Unidades ;1002529291;199.90;baby;banho-e-higiene
643;Fraldas Babysec UltraSec Galinha Pintadinha Jumbo XXG ;1002529268;179.90;baby;banho-e-higiene
644;Assento Redutor Com Escada Azul Buba ;1002421475;197.90;baby;banho-e-higiene
645;Kit 4 Fraldas Ecológicas Happy Flute - Passarinhos ;1002388017;159.90;baby;banho-e-higiene
646;Kit 4 Fraldas Ecológicas Happy Flute - Milk ;1002388038;159.90;baby;banho-e-higiene
647;Kit 4 Fraldas Ecológicas Happy Flute - Verde Flamingo ;1002388034;159.90;baby;banho-e-higiene
648;PACK 800 TOALHAS UMEDECIDAS RN SEM PERFUME - FISHER PRICE ;1002102985;199.99;baby;banho-e-higiene
649;;;;baby;banho-e-higiene
650;;;;baby;banho-e-higiene
651;Fralda Pampers Pants Ajuste Total Top Tamanho G 72 Unidades ;100329056;156.90;baby;banho-e-higiene
652;Kit com 3 Cremes Pomada de Assadura 120gr Cada - Bepantol ;1002538170;159.00;baby;banho-e-higiene
653;Organizador Banho 3 Sprouts Leão Marinho ;100242509;199.90;baby;banho-e-higiene
654;Organizador Banho 3 Sprouts Urso ;100220178;199.90;baby;banho-e-higiene
655;Organizador Banho 3 Sprouts Tubarão ;100216630;199.90;baby;banho-e-higiene
656;Assento Redutor Infantil Com Escada Para Vaso Sanitário 1+ Ano Até 40 kg Dobrável Cinza Buba ;1002615669;174.99;baby;banho-e-higiene
657;Almofada Banho do Bebê Protetor Acolchoado Do Nascimento Até 10kg  Conforto e Segurança Cinza Buba ;1002566023;168.99;baby;banho-e-higiene
658;ALMOFADA BANHO BABY AZUL - 7278 ;1002438583;179.00;baby;banho-e-higiene
659;Shampoo Sabonete 2 em 1 Baby Jolie Paris 210 ml ;1002458120;198.00;baby;banho-e-higiene
660;ALMOFADA DE BANHO BABY - URSINHO - 12752 - CINZA ;1002438586;179.00;baby;banho-e-higiene
661;Kit 10 Pasta De Dentes Prevent Antiplaca 90 G ;1002314416;158.90;baby;banho-e-higiene
662;Kit 576 Toalhinhas Umedecidas Pampers Lavanda ;100432107;190.90;baby;banho-e-higiene
663;Kit Toalhinhas Umedecidas Pampers Lavanda com 576 ;100432109;190.90;baby;banho-e-higiene
664;Kit Higiene Slim Pinus Capa Nuvem Chevron Azul ;1002557412;159.00;baby;banho-e-higiene
665;Kit Higiene Espelho Potes, Garrafa, Molhadeira e Capa Cavalinho Prata ;1002557462;189.00;baby;banho-e-higiene
666;Kit Higiene Espelho Completo Porcelanas, Garrafa Pequena e Capa Nuvem Prata ;1002557457;189.00;baby;banho-e-higiene
667;Kit Higiene Espelho Completo Porcelanas, Garrafa Pequena e Capa Azul ;1002557444;179.00;baby;banho-e-higiene
668;Potes, Garrafa, Molhadeira e Porta Álcool-Gel Com Capa Florzinha Dourada ;1002557439;179.00;baby;banho-e-higiene
669;Kit Higiene Espelho Potes, Garrafa, Molhadeira e Capa Provençal Rosa ;1002557485;189.00;baby;banho-e-higiene
670;Kit Higiene Slim Pinus Capa Ondinha Rosa ;1002557414;159.00;baby;banho-e-higiene
671;Kit Higiene Espelho Completo Porcelanas, Garrafa Pequena e Capa Rosa ;1002557461;179.00;baby;banho-e-higiene
672;Troninho - Fox Potty - Azul - Safety 1St ;100156969;231.90;baby;banho-e-higiene
673;Fralda Pampers Premium Care Jumbo M - 160 Unidades ;1002529167;249.90;baby;banho-e-higiene
674;Banheira Cosco Dobrável Whippy ;1002611519;229.90;baby;banho-e-higiene
675;Kit Banheira de Bebê Com Suporte + Redutor de Assento Até 20 Litros Acqua Trio Galzerano Branca ;1002548268;233.00;baby;banho-e-higiene
676;Fralda Pampers Pants Ajuste Total G 144 Unidades ;1002529185;209.90;baby;banho-e-higiene
677;Kit Banheira de Bebê Com Suporte + Redutor de Assento Até 20 Litros Acqua Trio Galzerano Cor:Branco ;1002617563;233.00;baby;banho-e-higiene
678;Banheira Baby Portatil Dobravel Flexivel Buba Azul ;1002513323;249.99;baby;banho-e-higiene
679;Fralda Huggies Supreme Care Ultra M 196 Unidades ;1002529273;229.90;baby;banho-e-higiene
680;Troninho infantil - Azul - Buba ;100415571;;baby;banho-e-higiene
681;Kit com 5 Cremes Pomada de Assadura 120gr Cada -  Bepantol ;1002538172;249.00;baby;banho-e-higiene
682;FRALDA BABYSEC ULTRASEC P 168 UNIDADES ;1002634472;202.59;baby;banho-e-higiene
683;Kit Fralda Pampers Confort Sec Super Tamanho M com 140 unidades ;100432066;221.36;baby;banho-e-higiene
684;Kit Fralda Pampers Confort Sec XG com 102 Tiras ;100442980;226.97;baby;banho-e-higiene
685;KIt Fralda Pampers Confort Sec Tamanho XG com 102 Unidades ;100331183;226.97;baby;banho-e-higiene
686;KIt Fralda Pampers Confort Sec Tamanho G com 114 Unidades ;100331203;226.97;baby;banho-e-higiene
687;KIt Fralda Pampers Confort Sec P com 150 Unidades ;100331205;226.95;baby;banho-e-higiene
688;Troninho Penico Infantil Antirrespingo 3 em 1 Ergonomico Com Redutor A partir de 1 Ano Flex Potty Safety 1st Cor:Azul ;1002610352;241.99;baby;banho-e-higiene
689;Assento Redutor com Escada Buba ;1002630722;210.00;baby;banho-e-higiene
690;Conjunto de Higiene Chicco Meu Primeiro Kit de Beleza ;1002505161;229.90;baby;banho-e-higiene
691;Assento Redutor Com Escada Bebê Vaso Sanitário +18 Meses Até 20 kg Dobrável Portátil Clingo Cor:Rosa ;1002618165;233.99;baby;banho-e-higiene
692;Assento Redutor Com Escada Bebê Vaso Sanitário +18 Meses Até 20 kg Dobrável Portátil Azul Clingo ;1002615940;233.99;baby;banho-e-higiene
693;Assento Redutor Com Escada Bebê Vaso Sanitário +18 Meses Até 20 kg Dobrável Portátil Rosa Clingo ;1002615930;233.94;baby;banho-e-higiene
694;Banheira Cosco Dobrável Whippy ;1002499019;229.90;baby;banho-e-higiene
695;Lenço Umedecido MILI Love & Care  12 Pacotes c/100 ;100580979;237.00;baby;banho-e-higiene
696;Roupão De Natação Infantil New Malta Speedo - PINK - M ;1002716642;219.90;baby;banho-e-higiene
697;Roupão De Natação Infantil New Malta Speedo - LARANJA NEON - M ;1002716676;219.90;baby;banho-e-higiene
698;Roupão De Natação Infantil New Malta Speedo - DARK BLUE - G ;1002716538;219.90;baby;banho-e-higiene
699;Roupão De Natação Infantil New Malta Speedo - LARANJA NEON - P ;1002716645;219.90;baby;banho-e-higiene
700;Roupão De Natação Infantil New Malta Speedo - ROSA CLARO - M ;1002716644;219.90;baby;banho-e-higiene
701;Roupão De Natação Infantil New Malta Speedo - ROSA CLARO - G ;1002716678;219.90;baby;banho-e-higiene
702;Roupão De Natação Infantil New Malta Speedo - LARANJA NEON - PP ;1002716641;219.90;baby;banho-e-higiene
703;Roupão De Natação Infantil New Malta Speedo - LARANJA NEON - G ;1002716663;219.90;baby;banho-e-higiene
704;Assento Redutor Com Escada Bebê Vaso Sanitário +3 Anos Até 50 Kg Dobravel Portatil New Style Kababy Cor:Azul ;1002609272;214.90;baby;banho-e-higiene
705;Kit Lenços Umedecidos Pampers Cheirinho de Bebê com 672 unidades ;100523368;222.90;baby;banho-e-higiene
706;Conjunto Galzerano: Banheira Rígida + Suporte - Azul Pastel ;100405860;234.50;baby;banho-e-higiene
707;Kit Higiene Fantasia Strass Corôa Madeira ;1002581590;249.00;baby;banho-e-higiene
708;Kit Higiene Espelho Completo Porcelanas, Garrafa e Capa Dourado ;1002557454;219.00;baby;banho-e-higiene
709;Kit Higiene Espelho Completo Porcelanas, Garrafa e Capa Azul ;1002557490;219.00;baby;banho-e-higiene
710;Kit Higiene Espelho Completo Porcelanas, Garrafa e Capa Ursinho Dourado ;1002557446;229.00;baby;banho-e-higiene
711;Kit Higiene Slim Azul Garrafa Pequena Capa Ondinha Azul ;1002557488;229.00;baby;banho-e-higiene
712;Kit Higiene Espelho Completo Porcelanas e Garrafa Branco ;1002557465;209.00;baby;banho-e-higiene
713;Kit Higiene Slim Branco Garrafa Pequena Capa Chevron Marinho ;1002557476;229.00;baby;banho-e-higiene
714;Kit Higiene Slim Azul Garrafa Pequena Capa Nuvem Chevron Azul ;1002557495;229.00;baby;banho-e-higiene
715;Assento Redutor Com Escada Buba Colorido ;1002421506;230.90;baby;banho-e-higiene
716;Assento Redutor Com Escada Azul Buba ;1002421494;219.90;baby;banho-e-higiene
717;Almofada de Banho Ursinho Cinza Buba ;1002421614;208.90;baby;banho-e-higiene
718;Banheira Babytub Ofurô - De 1 a 6 Anos - Rosa - Baby Tub ;100129089;265.90;baby;banho-e-higiene
719;Banheira Babytub Ofurô - De 1 a 6 Anos - Branco - Baby Tub ;100129091;259.90;baby;banho-e-higiene
720;Kit Banho - Burigotto - Banheira, Suporte e Assento Redutor - Branco ;100457294;269.91;baby;banho-e-higiene
721;Banheira de Bebê Plástica Galzerano Acqua Trio Rosa Perola ;100468257;269.00;baby;banho-e-higiene
722;Banheira Babytub Ofurô - De 1 a 6 Anos - Transparente - Baby Tub ;100166292;259.90;baby;banho-e-higiene
723;Banheira Ofurô - Baby Tub - Candy - Rosa ;1002529962;265.90;baby;banho-e-higiene
724;Banheira para Bebê Safety 1st Smile Cinza ;1002529040;299.90;baby;banho-e-higiene
725;Banheira Ofurô - Baby Tub - Candy - Azul ;1002529963;265.90;baby;banho-e-higiene
726;Banheira Fisher-Price Baby Deluxe 4 em 1 com 4 Estágios ;1002529042;299.90;baby;banho-e-higiene
727;Troninho 3 em 1 - Rosa - HGW36 - Fisher-Price - Mattel ;1002731157;279.90;baby;banho-e-higiene
728;Troninho 3 em 1 - Verde - GYP61 - Fisher-Price - Mattel ;1002731158;279.90;baby;banho-e-higiene
729;Banheira para Bebê Safety 1st Smile Rosa ;1002529039;299.90;baby;banho-e-higiene
730;OFURO OPLA ROSE MADDER - BURIGOTTO ;1002712761;259.00;baby;banho-e-higiene
731;Banheira Retrátil Infantil Glub Azul Até 15Kg - Voyage ;1002615078;245.00;baby;banho-e-higiene
732;Banheira Retrátil Infantil Glub De 0 Meses Até 15Kg - Voyage Cor:Rosa ;1002617780;260.99;baby;banho-e-higiene
733;Banheira Para Bebê Aqualoo Com Suporte Branco - Maxi Baby ;1002568736;299.00;baby;banho-e-higiene
734;Banheira - Bebê - Plástica - Galzerano - Acqua Trio - Azul ;100430966;269.00;baby;banho-e-higiene
735;Banheira Galzerano Acqua Trio - Branca ;100405855;282.15;baby;banho-e-higiene
736;Banheira Retrátil Crocodilo Rosa - BB1145 ;100400168;268.90;baby;banho-e-higiene
737;Banheira Dobrável Baby - Rosa - Buba ;100287892;284.99;baby;banho-e-higiene
738;Banheira Retrátil Voyage Glub Azul IMP01750 ;100266958;279.90;baby;banho-e-higiene
739;Banheira Dobrável Pequena Rosa - Baby Pil ;1002449462;279.80;baby;banho-e-higiene
740;Almofada Banho - Baby Rosa - Buba ;100415997;;baby;banho-e-higiene
741;Conjunto Burigotto: Banheira Avulsa + Suporte - Branco ;100405829;280.26;baby;banho-e-higiene
742;Kit Higiene Slim Azul Garrafa Grande Capa Fundo Do Mar ;1002557482;259.00;baby;banho-e-higiene
743;Kit Higiene Slim Pinus Garrafa Grande Capa Ondinha Rosa ;1002557497;259.00;baby;banho-e-higiene
744;Kit Higiene Slim Azul Garrafa Grande Capa Chuva De Amor Azul ;1002557484;259.00;baby;banho-e-higiene
745;Kit Higiene Slim Branco Garrafa Grande Capa Safári ;1002557496;259.00;baby;banho-e-higiene
746;Kit Higiene Slim Rosa Garrafa Grande Capa Nuvem Chevron Rosa ;1002557493;259.00;baby;banho-e-higiene
747;Kit Higiene Slim Pinus Garrafa Grande Capa Nuvem Black ;1002557475;259.00;baby;banho-e-higiene
748;Kit Higiene Slim Branco Garrafa Grande Capa Bege Chambrê ;1002557492;259.00;baby;banho-e-higiene
749;Kit Higiene Slim Cinza Garrafa Grande Capa Chuva de Amor Cinza ;1002557411;259.00;baby;banho-e-higiene
750;Banheira com Trocador - Tchibum! - Branco - Burigotto ;100140303;479.90;baby;banho-e-higiene
751;Banheira - Burigotto - Millenia+ - Branca ;100457064;499.00;baby;banho-e-higiene
752;Banheira de Bebê Plástica Galzerano Classic 7045 com Trocador e Suporte Dino ;1002521185;465.90;baby;banho-e-higiene
753;Banheira de Bebê Plástica Galzerano Classic 7045 com Trocador e Suporte Panda ;1002521181;465.90;baby;banho-e-higiene
754;Kit Fralda Pampers Premium Care Mega Tamanho XG 104 Unidades ;100432089;347.90;baby;banho-e-higiene
755;Banheira de Bebê Plástica Galzerano Classic 7045 com Trocador e Suporte Rose ;1002719006;449.90;baby;banho-e-higiene
756;Banheira de Bebê Galzerano Plástica Standard Ii 7080 Dino ;1002461817;359.00;baby;banho-e-higiene
757;Kit 160 Fraldas Pampers Premium Care Nova Jumbo Tamanho M ;100331169;320.93;baby;banho-e-higiene
758;Banheira de Bebê Safety 1st Smile Dobravel Compacta Pink Rosa ;1002512120;343.90;baby;banho-e-higiene
759;Banheira de Bebe Burigotto Tchibum com Suporte e Trocador Baby Blue Azul ;1002599973;439.90;baby;banho-e-higiene
760;Banheira de Bebê Plástica Galzerano Classic 7045 com Trocador e Suporte Azul ;1002719008;449.90;baby;banho-e-higiene
761;Kit Johnson's Baby Toalhinhas Recém-Nascido 1152 Lenços ;100432093;315.90;baby;banho-e-higiene
762;Troninho Infantil Skip Hop ;100420562;399.90;baby;banho-e-higiene
763;Banheira de Bebe Burigotto Tchibum com Suporte e Trocador Branco ;1002599974;442.90;baby;banho-e-higiene
764;Banheira Para Bebe Com Suporte Trocador Até 20Kg Standard II Galzerano Cor:Dino ;1002618616;411.90;baby;banho-e-higiene
765;Lixeira Para Descarte de Fraldas Infantis Bebê Lixo Magico Anti-odor Branco Kababy ;1002566697;338.00;baby;banho-e-higiene
766;Kit 112 Fraldas Pampers Premium Care Nova Jumbo Tamanho XXG ;100331166;320.93;baby;banho-e-higiene
767;Kit Fralda Pampers Confort Sec Tamanho G com 152 unidades ;100446381;302.63;baby;banho-e-higiene
768;Kit 160 Fralda Pampers Premium Care Jumbo Tamanho M ;100331170;320.93;baby;banho-e-higiene
769;Kit Fralda Pampers Confort Sec Tamanho XG com 136 unidades ;100432056;302.63;baby;banho-e-higiene
770;Kit 136 Fraldas Pampers Premium Care Pants Top Tamanho G ;100332848;314.97;baby;banho-e-higiene
771;Kit 156 Fraldas Pampers Premium Care Pants Top Tamanho M ;100331192;314.97;baby;banho-e-higiene
772;KIt Fralda Pampers Confort Sec Tamanho M com 176 Unidades ;100331188;302.63;baby;banho-e-higiene
773;KIt Fralda Pampers Confort Sec Tamanho G com 152 Unidades ;100331210;302.63;baby;banho-e-higiene
774;Banheira de Bebe com Trocador Galzerano Standard II Dino ;1002470326;379.00;baby;banho-e-higiene
775;Banheira Infantil Dobrável com Antiderrapante De 0 a 10 Meses Rosa - KaBaby ;1002566226;321.99;baby;banho-e-higiene
776;Banheira Baleia Moby Azul + Brinde Brinquedo de Banho Skip Hop ;1002724023;499.90;baby;banho-e-higiene
777;Banheira Infantil Dobrável Portátil Compacta 30L Do Nascimento Até 6 Anos Azul Buba ;1002566030;319.99;baby;banho-e-higiene
778;Banheira Baleia Moby Cinza + Brinde Brinquedo de Banho Skip Hop ;1002723992;499.90;baby;banho-e-higiene
779;Banheira para Bebe com Trocador Burigotto Tchibum Baby Blue ;1002470450;499.00;baby;banho-e-higiene
